tcpdump: verbose output suppressed, use -v or -vv for full protocol decode
listening on wlan0, link-type EN10MB (Ethernet), capture size 262144 bytes
03:28:51.950908 IP 192.168.1.10.59271 > sea15s07-in-f78.1e100.net.https: Flags [P.], seq 3031683678:3031684097, ack 870108322, win 515, options [nop,nop,TS val 1076669 ecr 2158063783], length 419
03:28:51.980380 IP sea15s07-in-f78.1e100.net.https > 192.168.1.10.59271: Flags [.], ack 419, win 417, options [nop,nop,TS val 2158093292 ecr 1076669], length 0
03:28:51.982455 IP 192.168.1.10.59271 > sea15s07-in-f78.1e100.net.https: Flags [P.], seq 419:1585, ack 1, win 515, options [nop,nop,TS val 1076673 ecr 2158093292], length 1166
03:28:52.012622 IP sea15s07-in-f78.1e100.net.https > 192.168.1.10.59271: Flags [.], ack 1585, win 428, options [nop,nop,TS val 2158093324 ecr 1076673], length 0
03:28:52.197213 IP sea15s07-in-f78.1e100.net.https > 192.168.1.10.59271: Flags [P.], seq 1:505, ack 1585, win 428, options [nop,nop,TS val 2158093509 ecr 1076673], length 504
03:28:52.197512 IP sea15s07-in-f78.1e100.net.https > 192.168.1.10.59271: Flags [P.], seq 505:831, ack 1585, win 428, options [nop,nop,TS val 2158093509 ecr 1076673], length 326
03:28:52.197617 IP sea15s07-in-f78.1e100.net.https > 192.168.1.10.59271: Flags [P.], seq 831:857, ack 1585, win 428, options [nop,nop,TS val 2158093509 ecr 1076673], length 26
03:28:52.205252 IP 192.168.1.10.59271 > sea15s07-in-f78.1e100.net.https: Flags [.], ack 505, win 536, options [nop,nop,TS val 1076695 ecr 2158093509], length 0
03:28:52.205269 IP 192.168.1.10.59271 > sea15s07-in-f78.1e100.net.https: Flags [.], ack 831, win 557, options [nop,nop,TS val 1076695 ecr 2158093509], length 0
03:28:52.205288 IP 192.168.1.10.59271 > sea15s07-in-f78.1e100.net.https: Flags [.], ack 857, win 557, options [nop,nop,TS val 1076695 ecr 2158093509], length 0
03:28:53.639846 IP 192.168.1.10.59748 > sea15s12-in-f2.1e100.net.https: Flags [F.], seq 2180278253, ack 1438309133, win 199, options [nop,nop,TS val 1076838 ecr 3256232784], length 0
03:28:53.640198 IP 192.168.1.10.39449 > sea15s01-in-f14.1e100.net.https: Flags [R.], seq 2215887388, ack 74428957, win 220, options [nop,nop,TS val 1076838 ecr 4243223003], length 0
03:28:53.671150 IP sea15s12-in-f2.1e100.net.https > 192.168.1.10.59748: Flags [F.], seq 1, ack 1, win 179, options [nop,nop,TS val 3256269456 ecr 1076838], length 0
03:28:53.672403 IP 192.168.1.10.59748 > sea15s12-in-f2.1e100.net.https: Flags [.], ack 2, win 199, options [nop,nop,TS val 1076842 ecr 3256269456], length 0
03:28:55.590914 IP 192.168.1.10.37939 > sea15s07-in-f74.1e100.net.https: Flags [F.], seq 2341399041, ack 673234196, win 3169, options [nop,nop,TS val 1077033 ecr 4168168520], length 0
03:28:55.590930 IP 192.168.1.10.37944 > sea15s07-in-f74.1e100.net.https: Flags [F.], seq 2069825934, ack 2971570065, win 1724, options [nop,nop,TS val 1077033 ecr 270737675], length 0
03:28:55.590949 IP 192.168.1.10.37945 > sea15s07-in-f74.1e100.net.https: Flags [F.], seq 705828808, ack 2056052787, win 881, options [nop,nop,TS val 1077033 ecr 3461973066], length 0
03:28:55.619580 IP sea15s07-in-f74.1e100.net.https > 192.168.1.10.37944: Flags [F.], seq 1, ack 1, win 186, options [nop,nop,TS val 270773211 ecr 1077033], length 0
03:28:55.622453 IP sea15s07-in-f74.1e100.net.https > 192.168.1.10.37939: Flags [F.], seq 1, ack 1, win 281, options [nop,nop,TS val 4168205903 ecr 1077033], length 0
03:28:55.622705 IP sea15s07-in-f74.1e100.net.https > 192.168.1.10.37945: Flags [F.], seq 1, ack 1, win 178, options [nop,nop,TS val 3462021013 ecr 1077033], length 0
03:28:55.634496 IP 192.168.1.10.37944 > sea15s07-in-f74.1e100.net.https: Flags [.], ack 2, win 1724, options [nop,nop,TS val 1077037 ecr 270773211], length 0
03:28:55.643579 IP 192.168.1.10.37939 > sea15s07-in-f74.1e100.net.https: Flags [.], ack 2, win 3169, options [nop,nop,TS val 1077039 ecr 4168205903], length 0
03:28:55.652882 IP 192.168.1.10.37945 > sea15s07-in-f74.1e100.net.https: Flags [.], ack 2, win 881, options [nop,nop,TS val 1077040 ecr 3462021013], length 0
03:28:56.713523 IP 192.168.1.10.37967 > sea15s07-in-f74.1e100.net.https: Flags [S], seq 3767703079, win 14600, options [mss 1460,sackOK,TS val 1077145 ecr 0,nop,wscale 7], length 0
03:28:56.743063 IP sea15s07-in-f74.1e100.net.https > 192.168.1.10.37967: Flags [S.], seq 1876139404, ack 3767703080, win 42408, options [mss 1360,sackOK,TS val 1713172764 ecr 1077145,nop,wscale 8], length 0
03:28:56.745315 IP 192.168.1.10.37967 > sea15s07-in-f74.1e100.net.https: Flags [.], ack 1, win 115, options [nop,nop,TS val 1077149 ecr 1713172764], length 0
03:28:56.758595 IP 192.168.1.10.37967 > sea15s07-in-f74.1e100.net.https: Flags [P.], seq 1:198, ack 1, win 115, options [nop,nop,TS val 1077150 ecr 1713172764], length 197
03:28:56.788024 IP sea15s07-in-f74.1e100.net.https > 192.168.1.10.37967: Flags [.], ack 198, win 170, options [nop,nop,TS val 1713172809 ecr 1077150], length 0
03:28:56.803081 IP sea15s07-in-f74.1e100.net.https > 192.168.1.10.37967: Flags [P.], seq 1:140, ack 198, win 170, options [nop,nop,TS val 1713172824 ecr 1077150], length 139
03:28:56.807707 IP 192.168.1.10.37967 > sea15s07-in-f74.1e100.net.https: Flags [.], ack 140, win 123, options [nop,nop,TS val 1077155 ecr 1713172824], length 0
03:28:56.807728 IP 192.168.1.10.37967 > sea15s07-in-f74.1e100.net.https: Flags [P.], seq 198:241, ack 140, win 123, options [nop,nop,TS val 1077155 ecr 1713172824], length 43
03:28:56.860251 IP 192.168.1.10.37967 > sea15s07-in-f74.1e100.net.https: Flags [.], seq 241:1589, ack 140, win 123, options [nop,nop,TS val 1077160 ecr 1713172824], length 1348
03:28:56.860276 IP 192.168.1.10.37967 > sea15s07-in-f74.1e100.net.https: Flags [.], seq 1589:2937, ack 140, win 123, options [nop,nop,TS val 1077160 ecr 1713172824], length 1348
03:28:56.876298 IP sea15s07-in-f74.1e100.net.https > 192.168.1.10.37967: Flags [.], ack 241, win 170, options [nop,nop,TS val 1713172858 ecr 1077155], length 0
03:28:56.880372 IP 192.168.1.10.37967 > sea15s07-in-f74.1e100.net.https: Flags [P.], seq 2937:4126, ack 140, win 123, options [nop,nop,TS val 1077162 ecr 1713172858], length 1189
03:28:56.889683 IP sea15s07-in-f74.1e100.net.https > 192.168.1.10.37967: Flags [.], ack 2937, win 192, options [nop,nop,TS val 1713172911 ecr 1077160], length 0
03:28:56.889819 IP sea15s07-in-f74.1e100.net.https > 192.168.1.10.37967: Flags [.], ack 1589, win 181, options [nop,nop,TS val 1713172911 ecr 1077160], length 0
03:28:56.909891 IP sea15s07-in-f74.1e100.net.https > 192.168.1.10.37967: Flags [.], ack 4126, win 202, options [nop,nop,TS val 1713172931 ecr 1077162], length 0
03:29:01.022387 IP sea15s07-in-f74.1e100.net.https > 192.168.1.10.37967: Flags [P.], seq 140:1488, ack 4126, win 202, options [nop,nop,TS val 1713177043 ecr 1077162], length 1348
03:29:01.022555 IP sea15s07-in-f74.1e100.net.https > 192.168.1.10.37967: Flags [P.], seq 1488:2836, ack 4126, win 202, options [nop,nop,TS val 1713177043 ecr 1077162], length 1348
03:29:01.023134 IP sea15s07-in-f74.1e100.net.https > 192.168.1.10.37967: Flags [P.], seq 2836:4024, ack 4126, win 202, options [nop,nop,TS val 1713177043 ecr 1077162], length 1188
03:29:01.062634 IP 192.168.1.10.37967 > sea15s07-in-f74.1e100.net.https: Flags [.], ack 2836, win 165, options [nop,nop,TS val 1077581 ecr 1713177043], length 0
03:29:01.089145 IP sea15s07-in-f74.1e100.net.https > 192.168.1.10.37967: Flags [P.], seq 2836:4024, ack 4126, win 202, options [nop,nop,TS val 1713177110 ecr 1077162], length 1188
03:29:01.090509 IP 192.168.1.10.37967 > sea15s07-in-f74.1e100.net.https: Flags [.], ack 4024, win 186, options [nop,nop,TS val 1077583 ecr 1713177110,nop,nop,sack 1 {2836:4024}], length 0
03:29:01.181608 IP 192.168.1.10.37967 > sea15s07-in-f74.1e100.net.https: Flags [P.], seq 4126:4149, ack 4024, win 186, options [nop,nop,TS val 1077592 ecr 1713177110], length 23
03:29:01.182162 IP 192.168.1.10.37967 > sea15s07-in-f74.1e100.net.https: Flags [F.], seq 4149, ack 4024, win 186, options [nop,nop,TS val 1077593 ecr 1713177110], length 0
03:29:01.211069 IP sea15s07-in-f74.1e100.net.https > 192.168.1.10.37967: Flags [.], ack 4149, win 202, options [nop,nop,TS val 1713177232 ecr 1077592], length 0
03:29:01.227169 IP 192.168.1.10.59292 > sea15s07-in-f78.1e100.net.https: Flags [S], seq 2762909951, win 14600, options [mss 1460,sackOK,TS val 1077597 ecr 0,nop,wscale 7], length 0
03:29:01.251298 IP sea15s07-in-f74.1e100.net.https > 192.168.1.10.37967: Flags [.], ack 4150, win 202, options [nop,nop,TS val 1713177232 ecr 1077593], length 0
03:29:01.255555 IP sea15s07-in-f78.1e100.net.https > 192.168.1.10.59292: Flags [S.], seq 871056693, ack 2762909952, win 42408, options [mss 1360,sackOK,TS val 3337449049 ecr 1077597,nop,wscale 8], length 0
03:29:01.257034 IP 192.168.1.10.59292 > sea15s07-in-f78.1e100.net.https: Flags [.], ack 1, win 115, options [nop,nop,TS val 1077600 ecr 3337449049], length 0
03:29:01.258396 IP 192.168.1.10.59292 > sea15s07-in-f78.1e100.net.https: Flags [P.], seq 1:171, ack 1, win 115, options [nop,nop,TS val 1077600 ecr 3337449049], length 170
03:29:01.286653 IP sea15s07-in-f78.1e100.net.https > 192.168.1.10.59292: Flags [.], ack 171, win 170, options [nop,nop,TS val 3337449080 ecr 1077600], length 0
03:29:01.296011 IP sea15s07-in-f78.1e100.net.https > 192.168.1.10.59292: Flags [.], seq 1:1349, ack 171, win 170, options [nop,nop,TS val 3337449090 ecr 1077600], length 1348
03:29:01.296106 IP sea15s07-in-f78.1e100.net.https > 192.168.1.10.59292: Flags [.], seq 1349:2697, ack 171, win 170, options [nop,nop,TS val 3337449090 ecr 1077600], length 1348
03:29:01.296140 IP sea15s07-in-f78.1e100.net.https > 192.168.1.10.59292: Flags [P.], seq 2697:2873, ack 171, win 170, options [nop,nop,TS val 3337449090 ecr 1077600], length 176
03:29:01.297670 IP 192.168.1.10.59292 > sea15s07-in-f78.1e100.net.https: Flags [.], ack 1349, win 136, options [nop,nop,TS val 1077604 ecr 3337449090], length 0
03:29:01.297900 IP 192.168.1.10.59292 > sea15s07-in-f78.1e100.net.https: Flags [.], ack 2697, win 157, options [nop,nop,TS val 1077604 ecr 3337449090], length 0
03:29:01.297916 IP 192.168.1.10.59292 > sea15s07-in-f78.1e100.net.https: Flags [.], ack 2873, win 178, options [nop,nop,TS val 1077604 ecr 3337449090], length 0
03:29:01.360338 IP 192.168.1.10.59292 > sea15s07-in-f78.1e100.net.https: Flags [P.], seq 171:256, ack 2873, win 178, options [nop,nop,TS val 1077610 ecr 3337449090], length 85
03:29:01.389139 IP sea15s07-in-f78.1e100.net.https > 192.168.1.10.59292: Flags [P.], seq 2873:3149, ack 256, win 170, options [nop,nop,TS val 3337449183 ecr 1077610], length 276
03:29:01.391054 IP 192.168.1.10.59292 > sea15s07-in-f78.1e100.net.https: Flags [.], ack 3149, win 199, options [nop,nop,TS val 1077613 ecr 3337449183], length 0
03:29:01.413567 IP 192.168.1.10.59292 > sea15s07-in-f78.1e100.net.https: Flags [P.], seq 256:591, ack 3149, win 199, options [nop,nop,TS val 1077616 ecr 3337449183], length 335
03:29:01.453033 IP sea15s07-in-f78.1e100.net.https > 192.168.1.10.59292: Flags [P.], seq 3149:3811, ack 591, win 175, options [nop,nop,TS val 3337449247 ecr 1077616], length 662
03:29:01.483923 IP 192.168.1.10.59274 > sea15s07-in-f78.1e100.net.https: Flags [P.], seq 1729390500:1729390523, ack 2939070642, win 220, options [nop,nop,TS val 1077622 ecr 144346813], length 23
03:29:01.483942 IP 192.168.1.10.59274 > sea15s07-in-f78.1e100.net.https: Flags [F.], seq 23, ack 1, win 220, options [nop,nop,TS val 1077622 ecr 144346813], length 0
03:29:01.511001 IP 192.168.1.10.59292 > sea15s07-in-f78.1e100.net.https: Flags [.], ack 3811, win 220, options [nop,nop,TS val 1077626 ecr 3337449247], length 0
03:29:01.515193 IP sea15s07-in-f78.1e100.net.https > 192.168.1.10.59274: Flags [F.], seq 1, ack 24, win 292, options [nop,nop,TS val 144393371 ecr 1077622], length 0
03:29:01.516172 IP 192.168.1.10.59274 > sea15s07-in-f78.1e100.net.https: Flags [.], ack 2, win 220, options [nop,nop,TS val 1077626 ecr 144393371], length 0
03:29:01.567851 IP 192.168.1.10.59292 > sea15s07-in-f78.1e100.net.https: Flags [P.], seq 591:1282, ack 3811, win 220, options [nop,nop,TS val 1077631 ecr 3337449247], length 691
03:29:01.606403 IP sea15s07-in-f78.1e100.net.https > 192.168.1.10.59292: Flags [P.], seq 3811:4217, ack 1282, win 180, options [nop,nop,TS val 3337449400 ecr 1077631], length 406
03:29:01.607965 IP 192.168.1.10.59292 > sea15s07-in-f78.1e100.net.https: Flags [.], ack 4217, win 241, options [nop,nop,TS val 1077635 ecr 3337449400], length 0
03:29:02.012721 IP sea15s07-in-f74.1e100.net.https > 192.168.1.10.37967: Flags [P.], seq 4024:4050, ack 4150, win 202, options [nop,nop,TS val 1713178034 ecr 1077593], length 26
03:29:02.017068 IP sea15s07-in-f74.1e100.net.https > 192.168.1.10.37967: Flags [F.], seq 4050, ack 4150, win 202, options [nop,nop,TS val 1713178038 ecr 1077593], length 0
03:29:02.085475 IP 192.168.1.10.37967 > sea15s07-in-f74.1e100.net.https: Flags [R], seq 3767707229, win 0, length 0
03:29:02.085493 IP 192.168.1.10.37967 > sea15s07-in-f74.1e100.net.https: Flags [R], seq 3767707229, win 0, length 0
03:29:02.090429 IP sea15s07-in-f74.1e100.net.https > 192.168.1.10.37967: Flags [F.], seq 4050, ack 4150, win 202, options [nop,nop,TS val 1713178111 ecr 1077593], length 0
03:29:02.091507 IP 192.168.1.10.37967 > sea15s07-in-f74.1e100.net.https: Flags [R], seq 3767707229, win 0, length 0
03:29:03.694868 IP 192.168.1.10.37969 > sea15s07-in-f74.1e100.net.https: Flags [S], seq 3841851407, win 14600, options [mss 1460,sackOK,TS val 1077843 ecr 0,nop,wscale 7], length 0
03:29:03.724463 IP sea15s07-in-f74.1e100.net.https > 192.168.1.10.37969: Flags [S.], seq 1988251160, ack 3841851408, win 42408, options [mss 1360,sackOK,TS val 1334261531 ecr 1077843,nop,wscale 8], length 0
03:29:03.725800 IP 192.168.1.10.37969 > sea15s07-in-f74.1e100.net.https: Flags [.], ack 1, win 115, options [nop,nop,TS val 1077847 ecr 1334261531], length 0
03:29:03.749313 IP 192.168.1.10.37969 > sea15s07-in-f74.1e100.net.https: Flags [P.], seq 1:198, ack 1, win 115, options [nop,nop,TS val 1077849 ecr 1334261531], length 197
03:29:03.778764 IP sea15s07-in-f74.1e100.net.https > 192.168.1.10.37969: Flags [.], ack 198, win 170, options [nop,nop,TS val 1334261585 ecr 1077849], length 0
03:29:03.779388 IP sea15s07-in-f74.1e100.net.https > 192.168.1.10.37969: Flags [P.], seq 1:140, ack 198, win 170, options [nop,nop,TS val 1334261586 ecr 1077849], length 139
03:29:03.794541 IP 192.168.1.10.37969 > sea15s07-in-f74.1e100.net.https: Flags [.], ack 140, win 123, options [nop,nop,TS val 1077854 ecr 1334261586], length 0
03:29:03.794564 IP 192.168.1.10.37969 > sea15s07-in-f74.1e100.net.https: Flags [P.], seq 198:241, ack 140, win 123, options [nop,nop,TS val 1077854 ecr 1334261586], length 43
03:29:03.837755 IP 192.168.1.10.37969 > sea15s07-in-f74.1e100.net.https: Flags [.], seq 241:1589, ack 140, win 123, options [nop,nop,TS val 1077858 ecr 1334261586], length 1348
03:29:03.837781 IP 192.168.1.10.37969 > sea15s07-in-f74.1e100.net.https: Flags [.], seq 1589:2937, ack 140, win 123, options [nop,nop,TS val 1077858 ecr 1334261586], length 1348
03:29:03.863752 IP sea15s07-in-f74.1e100.net.https > 192.168.1.10.37969: Flags [.], ack 241, win 170, options [nop,nop,TS val 1334261630 ecr 1077854], length 0
03:29:03.865088 IP 192.168.1.10.37969 > sea15s07-in-f74.1e100.net.https: Flags [P.], seq 2937:4137, ack 140, win 123, options [nop,nop,TS val 1077861 ecr 1334261630], length 1200
03:29:03.867251 IP sea15s07-in-f74.1e100.net.https > 192.168.1.10.37969: Flags [.], ack 1589, win 181, options [nop,nop,TS val 1334261674 ecr 1077858], length 0
03:29:03.867394 IP sea15s07-in-f74.1e100.net.https > 192.168.1.10.37969: Flags [.], ack 2937, win 192, options [nop,nop,TS val 1334261674 ecr 1077858], length 0
03:29:03.894551 IP sea15s07-in-f74.1e100.net.https > 192.168.1.10.37969: Flags [.], ack 4137, win 202, options [nop,nop,TS val 1334261701 ecr 1077861], length 0
03:29:03.925189 IP sea15s07-in-f74.1e100.net.https > 192.168.1.10.37969: Flags [P.], seq 1488:2836, ack 4137, win 202, options [nop,nop,TS val 1334261731 ecr 1077861], length 1348
03:29:03.925383 IP sea15s07-in-f74.1e100.net.https > 192.168.1.10.37969: Flags [P.], seq 140:1488, ack 4137, win 202, options [nop,nop,TS val 1334261731 ecr 1077861], length 1348
03:29:03.925981 IP sea15s07-in-f74.1e100.net.https > 192.168.1.10.37969: Flags [.], seq 2836:4184, ack 4137, win 202, options [nop,nop,TS val 1334261731 ecr 1077861], length 1348
03:29:03.926042 IP sea15s07-in-f74.1e100.net.https > 192.168.1.10.37969: 