tcpdump: verbose output suppressed, use -v or -vv for full protocol decode
listening on wlan0, link-type EN10MB (Ethernet), capture size 262144 bytes
03:27:39.349709 IP 192.168.1.10.36514 > agentportal.flurry.vip.gq1.yahoo.com.www: Flags [S], seq 3089591944, win 14600, options [mss 1460,sackOK,TS val 467125 ecr 0,nop,wscale 7], length 0
03:27:39.350063 IP 192.168.1.10.36515 > agentportal.flurry.vip.gq1.yahoo.com.www: Flags [S], seq 353903827, win 14600, options [mss 1460,sackOK,TS val 467125 ecr 0,nop,wscale 7], length 0
03:27:39.357146 IP agentportal.flurry.vip.gq1.yahoo.com.www > 192.168.1.10.36514: Flags [S.], seq 1471135353, ack 3089591945, win 26960, options [mss 1360,sackOK,TS val 3181279948 ecr 467125,nop,wscale 7], length 0
03:27:39.357378 IP agentportal.flurry.vip.gq1.yahoo.com.www > 192.168.1.10.36515: Flags [S.], seq 3828671709, ack 353903828, win 26960, options [mss 1360,sackOK,TS val 3181279948 ecr 467125,nop,wscale 7], length 0
03:27:39.358654 IP 192.168.1.10.36514 > agentportal.flurry.vip.gq1.yahoo.com.www: Flags [.], ack 1, win 115, options [nop,nop,TS val 467126 ecr 3181279948], length 0
03:27:39.358817 IP 192.168.1.10.36515 > agentportal.flurry.vip.gq1.yahoo.com.www: Flags [.], ack 1, win 115, options [nop,nop,TS val 467126 ecr 3181279948], length 0
03:27:39.367166 IP 192.168.1.10.36515 > agentportal.flurry.vip.gq1.yahoo.com.www: Flags [P.], seq 1:134, ack 1, win 115, options [nop,nop,TS val 467126 ecr 3181279948], length 133: HTTP: POST /aap.do HTTP/1.1
03:27:39.367522 IP 192.168.1.10.36515 > agentportal.flurry.vip.gq1.yahoo.com.www: Flags [P.], seq 134:590, ack 1, win 115, options [nop,nop,TS val 467126 ecr 3181279948], length 456: HTTP
03:27:39.367929 IP 192.168.1.10.36514 > agentportal.flurry.vip.gq1.yahoo.com.www: Flags [P.], seq 1:134, ack 1, win 115, options [nop,nop,TS val 467126 ecr 3181279948], length 133: HTTP: POST /aap.do HTTP/1.1
03:27:39.368283 IP 192.168.1.10.36514 > agentportal.flurry.vip.gq1.yahoo.com.www: Flags [P.], seq 134:406, ack 1, win 115, options [nop,nop,TS val 467126 ecr 3181279948], length 272: HTTP
03:27:39.374532 IP agentportal.flurry.vip.gq1.yahoo.com.www > 192.168.1.10.36515: Flags [.], ack 134, win 219, options [nop,nop,TS val 3181279952 ecr 467126], length 0
03:27:39.374805 IP agentportal.flurry.vip.gq1.yahoo.com.www > 192.168.1.10.36515: Flags [.], ack 590, win 228, options [nop,nop,TS val 3181279952 ecr 467126], length 0
03:27:39.375256 IP agentportal.flurry.vip.gq1.yahoo.com.www > 192.168.1.10.36514: Flags [.], ack 134, win 219, options [nop,nop,TS val 3181279952 ecr 467126], length 0
03:27:39.375594 IP agentportal.flurry.vip.gq1.yahoo.com.www > 192.168.1.10.36514: Flags [.], ack 406, win 228, options [nop,nop,TS val 3181279952 ecr 467126], length 0
03:27:39.455595 IP agentportal.flurry.vip.gq1.yahoo.com.www > 192.168.1.10.36514: Flags [P.], seq 1:274, ack 406, win 228, options [nop,nop,TS val 3181279972 ecr 467126], length 273: HTTP: HTTP/1.1 200 OK
03:27:39.455737 IP agentportal.flurry.vip.gq1.yahoo.com.www > 192.168.1.10.36515: Flags [P.], seq 1:274, ack 590, win 228, options [nop,nop,TS val 3181279972 ecr 467126], length 273: HTTP: HTTP/1.1 200 OK
03:27:39.457037 IP 192.168.1.10.56078 > 208.91.255.230.www: Flags [S], seq 1309145573, win 14600, options [mss 1460,sackOK,TS val 467135 ecr 0,nop,wscale 7], length 0
03:27:39.457796 IP 192.168.1.10.36514 > agentportal.flurry.vip.gq1.yahoo.com.www: Flags [.], ack 274, win 123, options [nop,nop,TS val 467135 ecr 3181279972], length 0
03:27:39.458201 IP 192.168.1.10.36515 > agentportal.flurry.vip.gq1.yahoo.com.www: Flags [.], ack 274, win 123, options [nop,nop,TS val 467135 ecr 3181279972], length 0
03:27:39.460903 IP 192.168.1.10.36515 > agentportal.flurry.vip.gq1.yahoo.com.www: Flags [F.], seq 590, ack 274, win 123, options [nop,nop,TS val 467136 ecr 3181279972], length 0
03:27:39.463615 IP 192.168.1.10.36514 > agentportal.flurry.vip.gq1.yahoo.com.www: Flags [F.], seq 406, ack 274, win 123, options [nop,nop,TS val 467136 ecr 3181279972], length 0
03:27:39.464428 IP 208.91.255.230.www > 192.168.1.10.56078: Flags [S.], seq 922025232, ack 1309145574, win 26960, options [mss 1360,sackOK,TS val 3181279975 ecr 467135,nop,wscale 7], length 0
03:27:39.465686 IP 192.168.1.10.56078 > 208.91.255.230.www: Flags [.], ack 1, win 115, options [nop,nop,TS val 467136 ecr 3181279975], length 0
03:27:39.468321 IP agentportal.flurry.vip.gq1.yahoo.com.www > 192.168.1.10.36515: Flags [F.], seq 274, ack 591, win 228, options [nop,nop,TS val 3181279976 ecr 467136], length 0
03:27:39.469554 IP 192.168.1.10.36515 > agentportal.flurry.vip.gq1.yahoo.com.www: Flags [.], ack 275, win 123, options [nop,nop,TS val 467137 ecr 3181279976], length 0
03:27:39.471036 IP agentportal.flurry.vip.gq1.yahoo.com.www > 192.168.1.10.36514: Flags [F.], seq 274, ack 407, win 228, options [nop,nop,TS val 3181279976 ecr 467136], length 0
03:27:39.472290 IP 192.168.1.10.36514 > agentportal.flurry.vip.gq1.yahoo.com.www: Flags [.], ack 275, win 123, options [nop,nop,TS val 467137 ecr 3181279976], length 0
03:27:39.483108 IP 192.168.1.10.56078 > 208.91.255.230.www: Flags [P.], seq 1:222, ack 1, win 115, options [nop,nop,TS val 467138 ecr 3181279975], length 221: HTTP: GET /guide/v3/lineup/tmobile/mobitvhd_3pg/4.0//tiles.text.plist HTTP/1.1
03:27:39.490453 IP 208.91.255.230.www > 192.168.1.10.56078: Flags [.], ack 222, win 219, options [nop,nop,TS val 3181279981 ecr 467138], length 0
03:27:39.591961 IP 208.91.255.230.www > 192.168.1.10.56078: Flags [.], seq 1:1349, ack 222, win 219, options [nop,nop,TS val 3181280006 ecr 467138], length 1348: HTTP: HTTP/1.1 200 OK
03:27:39.592057 IP 208.91.255.230.www > 192.168.1.10.56078: Flags [.], seq 1349:2697, ack 222, win 219, options [nop,nop,TS val 3181280006 ecr 467138], length 1348: HTTP
03:27:39.592093 IP 208.91.255.230.www > 192.168.1.10.56078: Flags [.], seq 2697:4045, ack 222, win 219, options [nop,nop,TS val 3181280006 ecr 467138], length 1348: HTTP
03:27:39.592122 IP 208.91.255.230.www > 192.168.1.10.56078: Flags [P.], seq 4045:4189, ack 222, win 219, options [nop,nop,TS val 3181280006 ecr 467138], length 144: HTTP
03:27:39.592286 IP 208.91.255.230.www > 192.168.1.10.56078: Flags [.], seq 4189:5537, ack 222, win 219, options [nop,nop,TS val 3181280006 ecr 467138], length 1348: HTTP
03:27:39.592309 IP 208.91.255.230.www > 192.168.1.10.56078: Flags [.], seq 5537:6885, ack 222, win 219, options [nop,nop,TS val 3181280006 ecr 467138], length 1348: HTTP
03:27:39.592321 IP 208.91.255.230.www > 192.168.1.10.56078: Flags [.], seq 6885:8233, ack 222, win 219, options [nop,nop,TS val 3181280006 ecr 467138], length 1348: HTTP
03:27:39.592342 IP 208.91.255.230.www > 192.168.1.10.56078: Flags [P.], seq 8233:8285, ack 222, win 219, options [nop,nop,TS val 3181280006 ecr 467138], length 52: HTTP
03:27:39.592488 IP 208.91.255.230.www > 192.168.1.10.56078: Flags [.], seq 8285:9633, ack 222, win 219, options [nop,nop,TS val 3181280006 ecr 467138], length 1348: HTTP
03:27:39.592507 IP 208.91.255.230.www > 192.168.1.10.56078: Flags [.], seq 9633:10981, ack 222, win 219, options [nop,nop,TS val 3181280006 ecr 467138], length 1348: HTTP
03:27:39.598409 IP 192.168.1.10.56078 > 208.91.255.230.www: Flags [.], ack 9633, win 283, options [nop,nop,TS val 467150 ecr 3181280006], length 0
03:27:39.598592 IP 192.168.1.10.56078 > 208.91.255.230.www: Flags [.], ack 10981, win 304, options [nop,nop,TS val 467150 ecr 3181280006], length 0
03:27:39.605792 IP 208.91.255.230.www > 192.168.1.10.56078: Flags [.], seq 10981:12329, ack 222, win 219, options [nop,nop,TS val 3181280010 ecr 467150], length 1348: HTTP
03:27:39.605848 IP 208.91.255.230.www > 192.168.1.10.56078: Flags [P.], seq 12329:13450, ack 222, win 219, options [nop,nop,TS val 3181280010 ecr 467150], length 1121: HTTP
03:27:39.607378 IP 192.168.1.10.56078 > 208.91.255.230.www: Flags [.], ack 12329, win 325, options [nop,nop,TS val 467150 ecr 3181280010], length 0
03:27:39.609004 IP 192.168.1.10.56078 > 208.91.255.230.www: Flags [.], ack 13450, win 346, options [nop,nop,TS val 467151 ecr 3181280010], length 0
03:27:41.812077 IP 192.168.1.10.46818 > sea15s07-in-f14.1e100.net.www: Flags [S], seq 2112430530, win 14600, options [mss 1460,sackOK,TS val 467371 ecr 0,nop,wscale 7], length 0
03:27:41.819573 IP sea15s07-in-f14.1e100.net.www > 192.168.1.10.46818: Flags [S.], seq 3021843327, ack 2112430531, win 26960, options [mss 1360,sackOK,TS val 3181280563 ecr 467371,nop,wscale 7], length 0
03:27:41.820854 IP 192.168.1.10.46818 > sea15s07-in-f14.1e100.net.www: Flags [.], ack 1, win 115, options [nop,nop,TS val 467372 ecr 3181280563], length 0
03:27:41.821324 IP 192.168.1.10.46818 > sea15s07-in-f14.1e100.net.www: Flags [P.], seq 1:150, ack 1, win 115, options [nop,nop,TS val 467372 ecr 3181280563], length 149: HTTP: GET /generate_204 HTTP/1.1
03:27:41.828656 IP sea15s07-in-f14.1e100.net.www > 192.168.1.10.46818: Flags [.], ack 150, win 219, options [nop,nop,TS val 3181280566 ecr 467372], length 0
03:27:41.927407 IP sea15s07-in-f14.1e100.net.www > 192.168.1.10.46818: Flags [P.], seq 1:222, ack 150, win 219, options [nop,nop,TS val 3181280590 ecr 467372], length 221: HTTP: HTTP/1.1 204 No Content
03:27:41.927590 IP sea15s07-in-f14.1e100.net.www > 192.168.1.10.46818: Flags [F.], seq 222, ack 150, win 219, options [nop,nop,TS val 3181280590 ecr 467372], length 0
03:27:41.933210 IP 192.168.1.10.46818 > sea15s07-in-f14.1e100.net.www: Flags [.], ack 222, win 123, options [nop,nop,TS val 467383 ecr 3181280590], length 0
03:27:41.933385 IP 192.168.1.10.46818 > sea15s07-in-f14.1e100.net.www: Flags [F.], seq 150, ack 222, win 123, options [nop,nop,TS val 467383 ecr 3181280590], length 0
03:27:41.934926 IP 192.168.1.10.46818 > sea15s07-in-f14.1e100.net.www: Flags [.], ack 223, win 123, options [nop,nop,TS val 467383 ecr 3181280590], length 0
03:27:41.940629 IP sea15s07-in-f14.1e100.net.www > 192.168.1.10.46818: Flags [.], ack 151, win 219, options [nop,nop,TS val 3181280594 ecr 467383], length 0
03:27:45.275194 IP 192.168.1.10.34110 > sea15s01-in-f2.1e100.net.https: Flags [S], seq 4188998650, win 14600, options [mss 1460,sackOK,TS val 467717 ecr 0,nop,wscale 7], length 0
03:27:45.304582 IP sea15s01-in-f2.1e100.net.https > 192.168.1.10.34110: Flags [S.], seq 1071888594, ack 4188998651, win 42408, options [mss 1360,sackOK,TS val 3180108700 ecr 467717,nop,wscale 8], length 0
03:27:45.305969 IP 192.168.1.10.34110 > sea15s01-in-f2.1e100.net.https: Flags [.], ack 1, win 115, options [nop,nop,TS val 467720 ecr 3180108700], length 0
03:27:45.313445 IP 192.168.1.10.34110 > sea15s01-in-f2.1e100.net.https: Flags [P.], seq 1:181, ack 1, win 115, options [nop,nop,TS val 467721 ecr 3180108700], length 180
03:27:45.322707 IP 192.168.1.10.50764 > 213.71.30.150.www: Flags [S], seq 3689072247, win 14600, options [mss 1460,sackOK,TS val 467722 ecr 0,nop,wscale 7], length 0
03:27:45.330210 IP 213.71.30.150.www > 192.168.1.10.50764: Flags [S.], seq 718177064, ack 3689072248, win 26960, options [mss 1360,sackOK,TS val 3181281441 ecr 467722,nop,wscale 7], length 0
03:27:45.331468 IP 192.168.1.10.50764 > 213.71.30.150.www: Flags [.], ack 1, win 115, options [nop,nop,TS val 467723 ecr 3181281441], length 0
03:27:45.334287 IP 192.168.1.10.50764 > 213.71.30.150.www: Flags [P.], seq 1:465, ack 1, win 115, options [nop,nop,TS val 467723 ecr 3181281441], length 464: HTTP: GET /security/sso/initialize/time HTTP/1.1
03:27:45.341782 IP 213.71.30.150.www > 192.168.1.10.50764: Flags [.], ack 465, win 219, options [nop,nop,TS val 3181281444 ecr 467723], length 0
03:27:45.342734 IP sea15s01-in-f2.1e100.net.https > 192.168.1.10.34110: Flags [.], ack 181, win 170, options [nop,nop,TS val 3180108738 ecr 467721], length 0
03:27:45.350902 IP sea15s01-in-f2.1e100.net.https > 192.168.1.10.34110: Flags [.], seq 1:1349, ack 181, win 170, options [nop,nop,TS val 3180108746 ecr 467721], length 1348
03:27:45.351057 IP sea15s01-in-f2.1e100.net.https > 192.168.1.10.34110: Flags [P.], seq 1349:2516, ack 181, win 170, options [nop,nop,TS val 3180108746 ecr 467721], length 1167
03:27:45.352674 IP 192.168.1.10.34110 > sea15s01-in-f2.1e100.net.https: Flags [.], ack 1349, win 136, options [nop,nop,TS val 467725 ecr 3180108746], length 0
03:27:45.354416 IP 192.168.1.10.34110 > sea15s01-in-f2.1e100.net.https: Flags [.], ack 2516, win 157, options [nop,nop,TS val 467725 ecr 3180108746], length 0
03:27:45.848957 IP 213.71.30.150.www > 192.168.1.10.50764: Flags [P.], seq 1:354, ack 465, win 219, options [nop,nop,TS val 3181281571 ecr 467723], length 353: HTTP: HTTP/1.1 200 OK
03:27:45.849156 IP 213.71.30.150.www > 192.168.1.10.50764: Flags [P.], seq 354:481, ack 465, win 219, options [nop,nop,TS val 3181281571 ecr 467723], length 127: HTTP
03:27:45.876101 IP 213.71.30.150.www > 192.168.1.10.50764: Flags [P.], seq 354:481, ack 465, win 219, options [nop,nop,TS val 3181281578 ecr 467723], length 127: HTTP
03:27:45.944881 IP 192.168.1.10.50764 > 213.71.30.150.www: Flags [.], ack 354, win 123, options [nop,nop,TS val 467784 ecr 3181281571], length 0
03:27:45.945231 IP 192.168.1.10.50764 > 213.71.30.150.www: Flags [.], ack 481, win 123, options [nop,nop,TS val 467784 ecr 3181281571], length 0
03:27:45.945248 IP 192.168.1.10.50764 > 213.71.30.150.www: Flags [.], ack 481, win 123, options [nop,nop,TS val 467784 ecr 3181281578,nop,nop,sack 1 {354:481}], length 0
03:27:46.186231 IP 192.168.1.10.55131 > server-13-33-151-25.sea4.r.cloudfront.net.www: Flags [S], seq 2026549908, win 14600, options [mss 1460,sackOK,TS val 467808 ecr 0,nop,wscale 7], length 0
03:27:46.193773 IP server-13-33-151-25.sea4.r.cloudfront.net.www > 192.168.1.10.55131: Flags [S.], seq 709745855, ack 2026549909, win 26960, options [mss 1360,sackOK,TS val 3181281657 ecr 467808,nop,wscale 7], length 0
03:27:46.196831 IP 192.168.1.10.55131 > server-13-33-151-25.sea4.r.cloudfront.net.www: Flags [.], ack 1, win 115, options [nop,nop,TS val 467809 ecr 3181281657], length 0
03:27:46.224836 IP 192.168.1.10.55131 > server-13-33-151-25.sea4.r.cloudfront.net.www: Flags [P.], seq 1:480, ack 1, win 115, options [nop,nop,TS val 467812 ecr 3181281657], length 479: HTTP: GET /firmware/TMB/SM-G900T/version.xml HTTP/1.1
03:27:46.232391 IP server-13-33-151-25.sea4.r.cloudfront.net.www > 192.168.1.10.55131: Flags [.], ack 480, win 219, options [nop,nop,TS val 3181281667 ecr 467812], length 0
03:27:46.449440 IP 192.168.1.10.34110 > sea15s01-in-f2.1e100.net.https: Flags [P.], seq 181:266, ack 2516, win 157, options [nop,nop,TS val 467834 ecr 3180108746], length 85
03:27:46.464428 IP server-13-33-151-25.sea4.r.cloudfront.net.www > 192.168.1.10.55131: Flags [.], seq 1:1349, ack 480, win 219, options [nop,nop,TS val 3181281725 ecr 467812], length 1348: HTTP: HTTP/1.1 403 Forbidden
03:27:46.464528 IP server-13-33-151-25.sea4.r.cloudfront.net.www > 192.168.1.10.55131: Flags [.], seq 1349:2697, ack 480, win 219, options [nop,nop,TS val 3181281725 ecr 467812], length 1348: HTTP
03:27:46.464547 IP server-13-33-151-25.sea4.r.cloudfront.net.www > 192.168.1.10.55131: Flags [.], seq 2697:4045, ack 480, win 219, options [nop,nop,TS val 3181281725 ecr 467812], length 1348: HTTP
03:27:46.464559 IP server-13-33-151-25.sea4.r.cloudfront.net.www > 192.168.1.10.55131: Flags [P.], seq 4045:4078, ack 480, win 219, options [nop,nop,TS val 3181281725 ecr 467812], length 33: HTTP
03:27:46.479259 IP sea15s01-in-f2.1e100.net.https > 192.168.1.10.34110: Flags [P.], seq 2516:2792, ack 266, win 170, options [nop,nop,TS val 3180109875 ecr 467834], length 276
03:27:46.491952 IP server-13-33-151-25.sea4.r.cloudfront.net.www > 192.168.1.10.55131: Flags [P.], seq 4045:4078, ack 480, win 219, options [nop,nop,TS val 3181281732 ecr 467812], length 33: HTTP
03:27:46.501561 IP 192.168.1.10.55131 > server-13-33-151-25.sea4.r.cloudfront.net.www: Flags [.], ack 1349, win 136, options [nop,nop,TS val 467840 ecr 3181281725], length 0
03:27:46.502889 IP 192.168.1.10.55131 > server-13-33-151-25.sea4.r.cloudfront.net.www: Flags [.], ack 2697, win 157, options [nop,nop,TS val 467840 ecr 3181281725], length 0
03:27:46.503231 IP 192.168.1.10.55131 > server-13-33-151-25.sea4.r.cloudfront.net.www: Flags [.], ack 4078, win 178, options [nop,nop,TS val 467840 ecr 3181281725], length 0
03:27:46.503249 IP 192.168.1.10.34110 > sea15s01-in-f2.1e100.net.https: Flags [.], ack 2792, win 178, options [nop,nop,TS val 467840 ecr 3180109875], length 0
03:27:46.503265 IP 192.168.1.10.55131 > server-13-33-151-25.sea4.r.cloudfront.net.www: Flags [.], ack 4078, win 178, options [nop,nop,TS val 467840 ecr 3181281732,nop,nop,sack 1 {4045:4078}], length 0
03:27:46.512333 IP 192.168.1.10.33202 > sea15s01-in-f10.1e100.net.https: Flags [S], seq 1401982070, win 14600, options [mss 1460,sackOK,TS val 467841 ecr 0,nop,wscale 7], length 0
03:27:46.543708 IP sea15s01-in-f10.1e100.net.https > 192.168.1.10.33202: Flags [S.], seq 1138932954, ack 1401982071, win 42408, options [mss 1360,sackOK,TS val 2690615442 ecr 467841,nop,wscale 8], length 0
03:27:46.550097 IP 192.168.1.10.33202 > sea15s01-in-f10.1e100.net.https: Flags [.], ack 1, win 115, options [nop,nop,TS val 467845 ecr 2690615442], length 0
03:27:46.564304 IP 192.168.1.10.33202 > sea15s01-in-f10.1e100.net.https: Flags [P.], seq 1:170, ack 1, win 115, options [nop,nop,TS val 467846 ecr 2690615442], length 169
03:27:46.595676 IP sea15s01-in-f10.1e100.net.https > 192.168.1.10.33202: Flags [.], ack 170, win 170, options [nop,nop,TS val 2690615494 ecr 467846], length 0
03:27:46.603203 IP sea15s01-in-f10.1e100.net.https > 192.168.1.10.33202: Flags [.], seq 1:1349, ack 170, win 170, options [nop,nop,TS val 2690615501 ecr 467846], length 1348
03:27:46.603331 IP sea15s01-in-f10.1e100.net.https > 192.168.1.10.33202: Flags [.], seq 1349:2697, ack 170, win 170, options [nop,nop,TS val 2690615501 ecr 467846], length 1348
03:27:46.603368 IP sea15s01-in-f10.1e100.net.https > 192.168.1.10.33202: Flags [P.], seq 2697:3236, ack 170, win 170, options [nop,nop,TS val 2690615501 ecr 467846], length 539
03:27:46.605723 IP 192.168.1.10.33202 > sea15s01-in-f10.1e100.net.https: Flags [.], ack 1349, win 136, options [nop,nop,TS val 467850 ecr 2690615501], length 0
03:27:46.606338 IP 192.168.1.10.33202 > sea15s01-in-f10.1e100.net.https: Flags [.], ack 2697, win 157, options [nop,nop,TS val 467850 ecr 2690615501], length 0
03:27:46.606545 IP 192.168.1.10.33202 > sea15s01-in-f10.1e100.net.https: Flags [.], ack 3236, win 178, options [nop,nop,TS val 467850 ecr 2690615501], length 0
03:27:46.649965 IP 192.168.1.10.34110 > sea15s01-in-f2.1e100.net.https: Flags [P.], seq 266:721, ack 2792, win 178, options [nop,nop,TS val 467855 ecr 3180109875], length 455
03:27:46.687788 IP sea15s01-in-f2.1e100.net.https > 192.168.1.10.34110: Flags [P.], seq 2792:3602, ack 721, win 175, options [nop,nop,TS val 3180110083 ecr 467855], length 810
03:27:46.704972 IP 192.168.1.10.34110 > sea15s01-in-f2.1e100.net.https: Flags [.], ack 3602, win 199, options [nop,nop,TS val 467860 ecr 3180110083], length 0
03:27:46.710592 IP 192.168.1.10.33202 > sea15s01-in-f10.1e100.net.https: Flags [P.], seq 170:255, ack 3236, win 178, options [nop,nop,TS val 467861 ecr 2690615501], length 85
03:27:46.717338 IP 192.168.1.10.34114 > sea15s01-in-f2.1e100.net.https: Flags [S], seq 3556614413, win 14600, options [mss 1460,sackOK,TS val 467861 ecr 0,nop,wscale 7], length 0
03:27:46.742366 IP sea15s01-in-f10.1e100.net.https > 192.168.1.10.33202: Flags [P.], seq 3236:3512, ack 255, win 170, options [nop,nop,TS val 2690615641 ecr 467861], length 276
03:27:46.746151 IP 192.168.1.10.33202 > sea15s01-in-f10.1e100.net.https: Flags [.], ack 3512, win 199, options [nop,nop,TS val 467864 ecr 2690615641], length 0
03:27:46.748049 IP sea15s01-in-f2.1e100.net.https > 192.168.1.10.34114: Flags [S.], seq 2542012440, ack 3556614414, win 42408, options [mss 1360,sackOK,TS val 2691811430 ecr 467861,nop,wscale 8], length 0
03:27:46.755207 IP 192.168.1.10.34114 > sea15s01-in-f2.1e100.net.https: Flags [.], ack 1, win 115, options [nop,nop,TS val 467865 ecr 2691811430], length 0
03:27:46.803809 IP 192.168.1.10.33202 > sea15s01-in-f10.1e100.net.https: Flags [P.], seq 255:1203, ack 3512, win 199, options [nop,nop,TS val 467870 ecr 2690615641], length 948
03:27:46.864708 IP sea15s01-in-f10.1e100.net.https > 192.168.1.10.33202: Flags [P.], seq 3512:4860, ack 1203, win 178, options [nop,nop,TS val 2690615763 ecr 467870], length 1348
03:27:46.864883 IP sea15s01-in-f10.1e100.net.https > 192.168.1.10.33202: Flags [P.], seq 4860:6208, ack 1203, win 178, options [nop,nop,TS val 2690615763 ecr 467870], length 1348
03:27:46.865040 IP sea15s01-in-f10.1e100.net.https > 192.168.1.10.33202: Flags [.], seq 6208:7556, ack 1203, win 178, options [nop,nop,TS val 2690615763 ecr 467870], length 1348
03:27:46.865086 IP sea15s01-in-f10.1e100.net.https > 192.168.1.10.33202: Flags [P.], seq 7556:7699, ack 1203, win 178, options [nop,nop,TS val 2690615763 ecr 467870], length 143
03:27:46.865176 IP sea15s01-in-f10.1e100.net.https > 192.168.1.10.33202: Flags [P.], seq 7699:9047, ack 1203, win 178, options [nop,nop,TS val 2690615763 ecr 467870], length 1348
03:27:46.865282 IP sea15s01-in-f10.1e100.net.https > 192.168.1.10.33202: Flags [.], seq 9047:10395, ack 1203, win 178, options [nop,nop,TS val 2690615763 ecr 467870], length 1348
03:27:46.865299 IP sea15s01-in-f10.1e100.net.https > 192.168.1.10.33202: Flags [P.], seq 10395:11743, ack 1203, win 178, options [nop,nop,TS val 2690615763 ecr 467870], length 1348
03:27:46.865357 IP sea15s01-in-f10.1e100.net.https > 192.168.1.10.33202: Flags [P.], seq 11743:11944, ack 1203, win 178, options [nop,nop,TS val 2690615763 ecr 467870], length 201
03:27:46.865405 IP sea15s01-in-f10.1e100.net.https > 192.168.1.10.33202: Flags [P.], seq 11944:13292, ack 1203, win 178, options [nop,nop,TS val 2690615763 ecr 467870], length 1348
03:27:46.865452 IP sea15s01-in-f10.1e100.net.https > 192.168.1.10.33202: Flags [P.], seq 13292:14640, ack 1203, win 178, options [nop,nop,TS val 2690615763 ecr 467870], length 1348
03:27:46.865528 IP sea15s01-in-f10.1e100.net.https > 192.168.1.10.33202: Flags [.], seq 14640:15988, ack 1203, win 178, options [nop,nop,TS val 2690615763 ecr 467870], length 1348
03:27:46.865545 IP sea15s01-in-f10.1e100.net.https > 192.168.1.10.33202: Flags [P.], seq 15988:17336, ack 1203, win 178, options [nop,nop,TS val 2690615763 ecr 467870], length 1348
03:27:46.868120 IP sea15s01-in-f10.1e100.net.https > 192.168.1.10.33202: Flags [.], seq 17336:18684, ack 1203, win 178, options [nop,nop,TS val 2690615763 ecr 467870], length 1348
03:27:46.868207 IP sea15s01-in-f10.1e100.net.https > 192.168.1.10.33202: Flags [.], seq 18684:20032, ack 1203, win 178, options [nop,nop,TS val 2690615763 ecr 467870], length 1348
03:27:46.869020 IP 192.168.1.10.33202 > sea15s01-in-f10.1e100.net.https: Flags [.], ack 4860, win 220, options [nop,nop,TS val 467876 ecr 2690615763], length 0
03:27:46.869601 IP 192.168.1.10.33202 > sea15s01-in-f10.1e100.net.https: Flags [.], ack 6208, win 241, options [nop,nop,TS val 467877 ecr 2690615763], length 0
03:27:46.869792 IP 192.168.1.10.33202 > sea15s01-in-f10.1e100.net.https: Flags [.], ack 7556, win 262, options [nop,nop,TS val 467877 ecr 2690615763], length 0
03:27:46.869804 IP 192.168.1.10.33202 > sea15s01-in-f10.1e100.net.https: Flags [.], ack 9047, win 304, options [nop,nop,TS val 467877 ecr 2690615763], length 0
03:27:46.869816 IP 192.168.1.10.33202 > sea15s01-in-f10.1e100.net.https: Flags [.], ack 11743, win 346, options [nop,nop,TS val 467877 ecr 2690615763], length 0
03:27:46.869904 IP 192.168.1.10.33202 > sea15s01-in-f10.1e100.net.https: Flags [.], ack 11944, win 367, options [nop,nop,TS val 467877 ecr 2690615763], length 0
03:27:46.869915 IP 192.168.1.10.33202 > sea15s01-in-f10.1e100.net.https: Flags [.], ack 13292, win 388, options [nop,nop,TS val 467877 ecr 2690615763], length 0
03:27:46.869926 IP 192.168.1.10.33202 > sea15s01-in-f10.1e100.net.https: Flags [.], ack 14640, win 409, options [nop,nop,TS val 467877 ecr 2690615763], length 0
03:27:46.870153 IP 192.168.1.10.33202 > sea15s01-in-f10.1e100.net.https: Flags [.], ack 15988, win 430, options [nop,nop,TS val 467877 ecr 2690615763], length 0
03:27:46.871806 IP 192.168.1.10.33202 > sea15s01-in-f10.1e100.net.https: Flags [.], ack 17336, win 452, options [nop,nop,TS val 467877 ecr 2690615763], length 0
03:27:46.872057 IP 192.168.1.10.33202 > sea15s01-in-f10.1e100.net.https: Flags [.], ack 20032, win 494, options [nop,nop,TS val 467877 ecr 2690615763], length 0
03:27:46.900321 IP sea15s01-in-f10.1e100.net.https > 192.168.1.10.33202: Flags [.], seq 20032:21380, ack 1203, win 178, options [nop,nop,TS val 2690615798 ecr 467876], length 1348
03:27:46.900439 IP sea15s01-in-f10.1e100.net.https > 192.168.1.10.33202: Flags [.], seq 21380:22728, ack 1203, win 178, options [nop,nop,TS val 2690615798 ecr 467876], length 1348
03:27:46.901936 IP sea15s01-in-f10.1e100.net.https > 192.168.1.10.33202: Flags [.], seq 22728:24076, ack 1203, win 178, options [nop,nop,TS val 2690615799 ecr 467877], length 1348
03:27:46.902090 IP sea15s01-in-f10.1e100.net.https > 192.168.1.10.33202: Flags [.], seq 24076:25424, ack 1203, win 178, options [nop,nop,TS val 2690615799 ecr 467877], length 1348
03:27:46.903894 IP 192.168.1.10.33202 > sea15s01-in-f10.1e100.net.https: Flags [.], ack 21380, win 515, options [nop,nop,TS val 467880 ecr 2690615798], length 0
03:27:46.904230 IP 192.168.1.10.33202 > sea15s01-in-f10.1e100.net.https: Flags [.], ack 22728, win 536, options [nop,nop,TS val 467880 ecr 2690615798], length 0
03:27:46.904548 IP sea15s01-in-f10.1e100.net.https > 192.168.1.10.33202: Flags [.], seq 25424:26772, ack 1203, win 178, options [nop,nop,TS val 2690615799 ecr 467877], length 1348
03:27:46.904631 IP sea15s01-in-f10.1e100.net.https > 192.168.1.10.33202: Flags [.], seq 26772:28120, ack 1203, win 178, options [nop,nop,TS val 2690615799 ecr 467877], length 1348
03:27:46.904698 IP 192.168.1.10.33202 > sea15s01-in-f10.1e100.net.https: Flags [.], ack 24076, win 557, options [nop,nop,TS val 467880 ecr 2690615799], length 0
03:27:46.904716 IP 192.168.1.10.33202 > sea15s01-in-f10.1e100.net.https: Flags [.], ack 25424, win 578, options [nop,nop,TS val 467880 ecr 2690615799], length 0
03:27:46.906635 IP sea15s01-in-f10.1e100.net.https > 192.168.1.10.33202: Flags [.], seq 28120:29468, ack 1203, win 178, options [nop,nop,TS val 2690615800 ecr 467877], length 1348
03:27:46.907113 IP sea15s01-in-f10.1e100.net.https > 192.168.1.10.33202: Flags [.], seq 29468:30816, ack 1203, win 178, options [nop,nop,TS val 2690615800 ecr 467877], length 1348
03:27:46.906793 IP 192.168.1.10.33202 > sea15s01-in-f10.1e100.net.https: Flags [.], ack 26772, win 599, options [nop,nop,TS val 467880 ecr 2690615799], length 0
03:27:46.908070 IP 192.168.1.10.33202 > sea15s01-in-f10.1e100.net.https: Flags [.], ack 28120, win 620, options [nop,nop,TS val 467880 ecr 2690615799], length 0
03:27:46.908828 IP sea15s01-in-f10.1e100.net.https > 192.168.1.10.33202: Flags [P.], seq 30816:32164, ack 1203, win 178, options [nop,nop,TS val 2690615803 ecr 467877], length 1348
03:27:46.909045 IP sea15s01-in-f10.1e100.net.https > 192.168.1.10.33202: Flags [.], seq 32164:33512, ack 1203, win 178, options [nop,nop,TS val 2690615803 ecr 467877], length 1348
03:27:46.909100 IP sea15s01-in-f10.1e100.net.https > 192.168.1.10.33202: Flags [.], seq 33512:34860, ack 1203, win 178, options [nop,nop,TS val 2690615803 ecr 467877], length 1348
03:27:46.911185 IP sea15s01-in-f10.1e100.net.https > 192.168.1.10.33202: Flags [.], seq 34860:36208, ack 1203, win 178, options [nop,nop,TS val 2690615805 ecr 467877], length 1348
03:27:46.911283 IP sea15s01-in-f10.1e100.net.https > 192.168.1.10.33202: Flags [.], seq 36208:37556, ack 1203, win 178, options [nop,nop,TS val 2690615805 ecr 467877], length 1348
03:27:46.911553 IP 192.168.1.10.33202 > sea15s01-in-f10.1e100.net.https: Flags [.], ack 29468, win 641, options [nop,nop,TS val 467881 ecr 2690615800], length 0
03:27:46.911569 IP 192.168.1.10.33202 > sea15s01-in-f10.1e100.net.https: Flags [.], ack 30816, win 662, options [nop,nop,TS val 467881 ecr 2690615800], length 0
03:27:46.911587 IP 192.168.1.10.33202 > sea15s01-in-f10.1e100.net.https: Flags [.], ack 32164, win 683, options [nop,nop,TS val 467881 ecr 2690615803], length 0
03:27:46.911600 IP 192.168.1.10.33202 > sea15s01-in-f10.1e100.net.https: Flags [.], ack 34860, win 725, options [nop,nop,TS val 467881 ecr 2690615803], length 0
03:27:46.912858 IP 192.168.1.10.33202 > sea15s01-in-f10.1e100.net.https: Flags [.], ack 36208, win 746, options [nop,nop,TS val 467881 ecr 2690615805], length 0
03:27:46.913272 IP sea15s01-in-f10.1e100.net.https > 192.168.1.10.33202: Flags [.], seq 37556:38904, ack 1203, win 178, options [nop,nop,TS val 2690615807 ecr 467877], length 1348
03:27:46.913418 IP sea15s01-in-f10.1e100.net.https > 192.168.1.10.33202: Flags [.], seq 38904:40252, ack 1203, win 178, options [nop,nop,TS val 2690615807 ecr 467877], length 1348
03:27:46.914824 IP 192.168.1.10.33202 > sea15s01-in-f10.1e100.net.https: Flags [.], ack 38904, win 789, options [nop,nop,TS val 467881 ecr 2690615807], length 0
03:27:46.915112 IP 192.168.1.10.33202 > sea15s01-in-f10.1e100.net.https: Flags [.], ack 40252, win 810, options [nop,nop,TS val 467881 ecr 2690615807], length 0
03:27:46.915611 IP sea15s01-in-f10.1e100.net.https > 192.168.1.10.33202: Flags [.], seq 40252:41600, ack 1203, win 178, options [nop,nop,TS val 2690615809 ecr 467877], length 1348
03:27:46.915703 IP sea15s01-in-f10.1e100.net.https > 192.168.1.10.33202: Flags [.], seq 41600:42948, ack 1203, win 178, options [nop,nop,TS val 2690615809 ecr 467877], length 1348
03:27:46.915803 IP sea15s01-in-f10.1e100.net.https > 192.168.1.10.33202: Flags [.], seq 42948:44296, ack 1203, win 178, options [nop,nop,TS val 2690615812 ecr 467877], length 1348
03:27:46.917771 IP sea15s01-in-f10.1e100.net.https > 192.168.1.10.33202: Flags [.], seq 44296:45644, ack 1203, win 178, options [nop,nop,TS val 2690615812 ecr 467877], length 1348
03:27:46.917866 IP sea15s01-in-f10.1e100.net.https > 192.168.1.10.33202: Flags [.], seq 45644:46992, ack 1203, win 178, options [nop,nop,TS val 2690615812 ecr 467877], length 1348
03:27:46.920068 IP sea15s01-in-f10.1e100.net.https > 192.168.1.10.33202: Flags [.], seq 46992:48340, ack 1203, win 178, options [nop,nop,TS val 2690615814 ecr 467877], length 1348
03:27:46.920182 IP sea15s01-in-f10.1e100.net.https > 192.168.1.10.33202: Flags [.], seq 48340:49688, ack 1203, win 178, options [nop,nop,TS val 2690615814 ecr 467877], length 1348
03:27:46.920332 IP 192.168.1.10.33202 > sea15s01-in-f10.1e100.net.https: Flags [.], ack 41600, win 831, options [nop,nop,TS val 467881 ecr 2690615809], length 0
03:27:46.920348 IP 192.168.1.10.33202 > sea15s01-in-f10.1e100.net.https: Flags [.], ack 42948, win 852, options [nop,nop,TS val 467882 ecr 2690615809], length 0
03:27:46.920357 IP 192.168.1.10.33202 > sea15s01-in-f10.1e100.net.https: Flags [.], ack 44296, win 873, options [nop,nop,TS val 467882 ecr 2690615812], length 0
03:27:46.920388 IP 192.168.1.10.33202 > sea15s01-in-f10.1e100.net.https: Flags [.], ack 45644, win 894, options [nop,nop,TS val 467882 ecr 2690615812], length 0
03:27:46.920400 IP 192.168.1.10.33202 > sea15s01-in-f10.1e100.net.https: Flags [.], ack 46992, win 915, options [nop,nop,TS val 467882 ecr 2690615812], length 0
03:27:46.922282 IP sea15s01-in-f10.1e100.net.https > 192.168.1.10.33202: Flags [.], seq 49688:51036, ack 1203, win 178, options [nop,nop,TS val 2690615816 ecr 467877], length 1348
03:27:46.922360 IP sea15s01-in-f10.1e100.net.https > 192.168.1.10.33202: Flags [.], seq 51036:52384, ack 1203, win 178, options [nop,nop,TS val 2690615816 ecr 467877], length 1348
03:27:46.922518 IP 192.168.1.10.33202 > sea15s01-in-f10.1e100.net.https: Flags [.], ack 48340, win 936, options [nop,nop,TS val 467882 ecr 2690615814], length 0
03:27:46.924189 IP 192.168.1.10.33202 > sea15s01-in-f10.1e100.net.https: Flags [.], ack 49688, win 957, options [nop,nop,TS val 467882 ecr 2690615814], length 0
03:27:46.924209 IP 192.168.1.10.33202 > sea15s01-in-f10.1e100.net.https: Flags [.], ack 51036, win 978, options [nop,nop,TS val 467882 ecr 2690615816], length 0
03:27:46.924573 IP sea15s01-in-f10.1e100.net.https > 192.168.1.10.33202: Flags [.], seq 52384:53732, ack 1203, win 178, options [nop,nop,TS val 2690615818 ecr 467877], length 1348
03:27:46.924658 IP sea15s01-in-f10.1e100.net.https > 192.168.1.10.33202: Flags [.], seq 53732:55080, ack 1203, win 178, options [nop,nop,TS val 2690615818 ecr 467877], length 1348
03:27:46.924758 IP sea15s01-in-f10.1e100.net.https > 192.168.1.10.33202: Flags [.], seq 55080:56428, ack 1203, win 178, options [nop,nop,TS val 2690615820 ecr 467877], length 1348
03:27:46.924886 IP 192.168.1.10.33202 > sea15s01-in-f10.1e100.net.https: Flags [.], ack 52384, win 999, options [nop,nop,TS val 467882 ecr 2690615816], length 0
03:27:46.926860 IP 192.168.1.10.33202 > sea15s01-in-f10.1e100.net.https: Flags [.], ack 53732, win 1020, options [nop,nop,TS val 467882 ecr 2690615818], length 0
03:27:46.927492 IP 192.168.1.10.33202 > sea15s01-in-f10.1e100.net.https: Flags [.], ack 55080, win 1041, options [nop,nop,TS val 467882 ecr 2690615818], length 0
03:27:46.927509 IP 192.168.1.10.33202 > sea15s01-in-f10.1e100.net.https: Flags [.], ack 56428, win 1062, options [nop,nop,TS val 467882 ecr 2690615820], length 0
03:27:46.935217 IP sea15s01-in-f10.1e100.net.https > 192.168.1.10.33202: Flags [.], seq 56428:57776, ack 1203, win 178, options [nop,nop,TS val 2690615833 ecr 467880], length 1348
03:27:46.935451 IP sea15s01-in-f10.1e100.net.https > 192.168.1.10.33202: Flags [.], seq 57776:59124, ack 1203, win 178, options [nop,nop,TS val 2690615833 ecr 467880], length 1348
03:27:46.936290 IP sea15s01-in-f10.1e100.net.https > 192.168.1.10.33202: Flags [.], seq 59124:60472, ack 1203, win 178, options [nop,nop,TS val 2690615834 ecr 467880], length 1348
03:27:46.936458 IP sea15s01-in-f10.1e100.net.https > 192.168.1.10.33202: Flags [.], seq 60472:61820, ack 1203, win 178, options [nop,nop,TS val 2690615834 ecr 467880], length 1348
03:27:46.937219 IP 192.168.1.10.33202 > sea15s01-in-f10.1e100.net.https: Flags [.], ack 57776, win 1083, options [nop,nop,TS val 467883 ecr 2690615833], length 0
03:27:46.938278 IP sea15s01-in-f10.1e100.net.https > 192.168.1.10.33202: Flags [.], seq 61820:63168, ack 1203, win 178, options [nop,nop,TS val 2690615834 ecr 467880], length 1348
03:27:46.938408 IP sea15s01-in-f10.1e100.net.https > 192.168.1.10.33202: Flags [.], seq 63168:64516, ack 1203, win 178, options [nop,nop,TS val 2690615834 ecr 467880], length 1348
03:27:46.938450 IP sea15s01-in-f10.1e100.net.https > 192.168.1.10.33202: Flags [.], seq 64516:65864, ack 1203, win 178, options [nop,nop,TS val 2690615834 ecr 467880], length 1348
03:27:46.938481 IP sea15s01-in-f10.1e100.net.https > 192.168.1.10.33202: Flags [.], seq 65864:67212, ack 1203, win 178, options [nop,nop,TS val 2690615834 ecr 467880], length 1348
03:27:46.938968 IP 192.168.1.10.33202 > sea15s01-in-f10.1e100.net.https: Flags [.], ack 59124, win 1104, options [nop,nop,TS val 467884 ecr 2690615833], length 0
03:27:46.939870 IP sea15s01-in-f10.1e100.net.https > 192.168.1.10.33202: Flags [.], seq 67212:68560, ack 1203, win 178, options [nop,nop,TS val 2690615836 ecr 467880], length 1348
03:27:46.941811 IP sea15s01-in-f10.1e100.net.https > 192.168.1.10.33202: Flags [.], seq 68560:69908, ack 1203, win 178, options [nop,nop,TS val 2690615837 ecr 467880], length 1348
03:27:46.941914 IP sea15s01-in-f10.1e100.net.https > 192.168.1.10.33202: Flags [.], seq 69908:71256, ack 1203, win 178, options [nop,nop,TS val 2690615837 ecr 467880], length 1348
03:27:46.943607 IP sea15s01-in-f10.1e100.net.https > 192.168.1.10.33202: Flags [.], seq 71256:72604, ack 1203, win 178, options [nop,nop,TS val 2690615837 ecr 467880], length 1348
03:27:46.943711 IP sea15s01-in-f10.1e100.net.https > 192.168.1.10.33202: Flags [.], seq 72604:73952, ack 1203, win 178, options [nop,nop,TS val 2690615837 ecr 467880], length 1348
03:27:46.943887 IP sea15s01-in-f10.1e100.net.https > 192.168.1.10.33202: Flags [.], seq 73952:75300, ack 1203, win 178, options [nop,nop,TS val 2690615841 ecr 467881], length 1348
03:27:46.943937 IP sea15s01-in-f10.1e100.net.https > 192.168.1.10.33202: Flags [.], seq 75300:76648, ack 1203, win 178, options [nop,nop,TS val 2690615841 ecr 467881], length 1348
03:27:46.944176 IP 192.168.1.10.33202 > sea15s01-in-f10.1e100.net.https: Flags [.], ack 60472, win 1126, options [nop,nop,TS val 467884 ecr 2690615834], length 0
03:27:46.944191 IP 192.168.1.10.33202 > sea15s01-in-f10.1e100.net.https: Flags [.], ack 61820, win 1147, options [nop,nop,TS val 467884 ecr 2690615834], length 0
03:27:46.944203 IP 192.168.1.10.33202 > sea15s01-in-f10.1e100.net.https: Flags [.], ack 63168, win 1168, options [nop,nop,TS val 467884 ecr 2690615834], length 0
03:27:46.944213 IP 192.168.1.10.33202 > sea15s01-in-f10.1e100.net.https: Flags [.], ack 64516, win 1189, options [nop,nop,TS val 467884 ecr 2690615834], length 0
03:27:46.944223 IP 192.168.1.10.33202 > sea15s01-in-f10.1e100.net.https: Flags [.], ack 65864, win 1210, options [nop,nop,TS val 467884 ecr 2690615834], length 0
03:27:46.944232 IP 192.168.1.10.33202 > sea15s01-in-f10.1e100.net.https: Flags [.], ack 68560, win 1252, options [nop,nop,TS val 467884 ecr 2690615836], length 0
03:27:46.944263 IP 192.168.1.10.33202 > sea15s01-in-f10.1e100.net.https: Flags [.], ack 69908, win 1273, options [nop,nop,TS val 467884 ecr 2690615837], length 0
03:27:46.944275 IP 192.168.1.10.33202 > sea15s01-in-f10.1e100.net.https: Flags [.], ack 71256, win 1294, options [nop,nop,TS val 467884 ecr 2690615837], length 0
03:27:46.945468 IP sea15s01-in-f10.1e100.net.https > 192.168.1.10.33202: Flags [.], seq 76648:77996, ack 1203, win 178, options [nop,nop,TS val 2690615842 ecr 467881], length 1348
03:27:46.945563 IP sea15s01-in-f10.1e100.net.https > 192.168.1.10.33202: Flags [.], seq 77996:79344, ack 1203, win 178, options [nop,nop,TS val 2690615842 ecr 467881], length 1348
03:27:46.945941 IP 192.168.1.10.33202 > sea15s01-in-f10.1e100.net.https: Flags [.], ack 72604, win 1315, options [nop,nop,TS val 467884 ecr 2690615837], length 0
03:27:46.946313 IP 192.168.1.10.33202 > sea15s01-in-f10.1e100.net.https: Flags [.], ack 73952, win 1336, options [nop,nop,TS val 467884 ecr 2690615837], length 0
03:27:46.946476 IP 192.168.1.10.33202 > sea15s01-in-f10.1e100.net.https: Flags [.], ack 75300, win 1357, options [nop,nop,TS val 467884 ecr 2690615841], length 0
03:27:46.946508 IP 192.168.1.10.33202 > sea15s01-in-f10.1e100.net.https: Flags [.], ack 76648, win 1378, options [nop,nop,TS val 467884 ecr 2690615841], length 0
03:27:46.947247 IP sea15s01-in-f10.1e100.net.https > 192.168.1.10.33202: Flags [.], seq 79344:80692, ack 1203, win 178, options [nop,nop,TS val 2690615842 ecr 467881], length 1348
03:27:46.949058 IP sea15s01-in-f10.1e100.net.https > 192.168.1.10.33202: Flags [.], seq 80692:82040, ack 1203, win 178, options [nop,nop,TS val 2690615842 ecr 467881], length 1348
03:27:46.949150 IP sea15s01-in-f10.1e100.net.https > 192.168.1.10.33202: Flags [.], seq 82040:83388, ack 1203, win 178, options [nop,nop,TS val 2690615842 ecr 467881], length 1348
03:27:46.949258 IP 192.168.1.10.33202 > sea15s01-in-f10.1e100.net.https: Flags [.], ack 77996, win 1399, options [nop,nop,TS val 467884 ecr 2690615842], length 0
03:27:46.949277 IP 192.168.1.10.33202 > sea15s01-in-f10.1e100.net.https: Flags [.], ack 79344, win 1420, options [nop,nop,TS val 467885 ecr 2690615842], length 0
03:27:46.950792 IP sea15s01-in-f10.1e100.net.https > 192.168.1.10.33202: Flags [.], seq 83388:84736, ack 1203, win 178, options [nop,nop,TS val 2690615844 ecr 467881], length 1348
03:27:46.950887 IP sea15s01-in-f10.1e100.net.https > 192.168.1.10.33202: Flags [.], seq 84736:86084, ack 1203, win 178, options [nop,nop,TS val 2690615844 ecr 467881], length 1348
