tcpdump: verbose output suppressed, use -v or -vv for full protocol decode
listening on wlan0, link-type EN10MB (Ethernet), capture size 262144 bytes
03:29:42.478163 IP 192.168.1.10.50464 > a104-126-147-179.deploy.static.akamaitechnologies.com.www: Flags [S], seq 3478337820, win 14600, options [mss 1460,sackOK,TS val 120700 ecr 0,nop,wscale 7], length 0
03:29:42.487084 IP a104-126-147-179.deploy.static.akamaitechnologies.com.www > 192.168.1.10.50464: Flags [S.], seq 4126586080, ack 3478337821, win 26960, options [mss 1360,sackOK,TS val 634960660 ecr 120700,nop,wscale 7], length 0
03:29:42.488402 IP 192.168.1.10.50464 > a104-126-147-179.deploy.static.akamaitechnologies.com.www: Flags [.], ack 1, win 115, options [nop,nop,TS val 120701 ecr 634960660], length 0
03:29:42.525006 IP 192.168.1.10.50464 > a104-126-147-179.deploy.static.akamaitechnologies.com.www: Flags [P.], seq 1:163, ack 1, win 115, options [nop,nop,TS val 120704 ecr 634960660], length 162: HTTP: GET /services/cms/doc/promo/shop_widget_default.png HTTP/1.1
03:29:42.533936 IP a104-126-147-179.deploy.static.akamaitechnologies.com.www > 192.168.1.10.50464: Flags [.], ack 163, win 219, options [nop,nop,TS val 634960672 ecr 120704], length 0
03:29:42.534122 IP a104-126-147-179.deploy.static.akamaitechnologies.com.www > 192.168.1.10.50464: Flags [P.], seq 1:671, ack 163, win 219, options [nop,nop,TS val 634960672 ecr 120704], length 670: HTTP: HTTP/1.1 302 Moved Temporarily
03:29:42.535387 IP 192.168.1.10.50464 > a104-126-147-179.deploy.static.akamaitechnologies.com.www: Flags [.], ack 671, win 125, options [nop,nop,TS val 120706 ecr 634960672], length 0
03:29:42.570651 IP 192.168.1.10.50464 > a104-126-147-179.deploy.static.akamaitechnologies.com.www: Flags [F.], seq 163, ack 671, win 125, options [nop,nop,TS val 120709 ecr 634960672], length 0
03:29:42.579502 IP a104-126-147-179.deploy.static.akamaitechnologies.com.www > 192.168.1.10.50464: Flags [F.], seq 671, ack 164, win 219, options [nop,nop,TS val 634960683 ecr 120709], length 0
03:29:42.580824 IP 192.168.1.10.50464 > a104-126-147-179.deploy.static.akamaitechnologies.com.www: Flags [.], ack 672, win 125, options [nop,nop,TS val 120710 ecr 634960683], length 0
03:29:42.597119 IP 192.168.1.10.43596 > a104-126-131-152.deploy.static.akamaitechnologies.com.www: Flags [S], seq 2450859765, win 14600, options [mss 1460,sackOK,TS val 120712 ecr 0,nop,wscale 7], length 0
03:29:42.605927 IP a104-126-131-152.deploy.static.akamaitechnologies.com.www > 192.168.1.10.43596: Flags [S.], seq 1967011847, ack 2450859766, win 26960, options [mss 1360,sackOK,TS val 634960690 ecr 120712,nop,wscale 7], length 0
03:29:42.611157 IP 192.168.1.10.43596 > a104-126-131-152.deploy.static.akamaitechnologies.com.www: Flags [.], ack 1, win 115, options [nop,nop,TS val 120713 ecr 634960690], length 0
03:29:42.664048 IP 192.168.1.10.43596 > a104-126-131-152.deploy.static.akamaitechnologies.com.www: Flags [P.], seq 1:131, ack 1, win 115, options [nop,nop,TS val 120717 ecr 634960690], length 130: HTTP: GET /nook HTTP/1.1
03:29:42.672831 IP a104-126-131-152.deploy.static.akamaitechnologies.com.www > 192.168.1.10.43596: Flags [.], ack 131, win 219, options [nop,nop,TS val 634960707 ecr 120717], length 0
03:29:42.762901 IP a104-126-131-152.deploy.static.akamaitechnologies.com.www > 192.168.1.10.43596: Flags [P.], seq 1:558, ack 131, win 219, options [nop,nop,TS val 634960729 ecr 120717], length 557: HTTP: HTTP/1.1 301 Moved Permanently
03:29:42.771162 IP 192.168.1.10.43596 > a104-126-131-152.deploy.static.akamaitechnologies.com.www: Flags [.], ack 558, win 123, options [nop,nop,TS val 120729 ecr 634960729], length 0
03:29:42.894179 IP 192.168.1.10.43596 > a104-126-131-152.deploy.static.akamaitechnologies.com.www: Flags [F.], seq 131, ack 558, win 123, options [nop,nop,TS val 120741 ecr 634960729], length 0
03:29:42.896286 IP 192.168.1.10.57535 > a104-126-131-152.deploy.static.akamaitechnologies.com.https: Flags [S], seq 1430778800, win 14600, options [mss 1460,sackOK,TS val 120742 ecr 0,nop,wscale 7], length 0
03:29:42.902935 IP a104-126-131-152.deploy.static.akamaitechnologies.com.www > 192.168.1.10.43596: Flags [F.], seq 558, ack 132, win 219, options [nop,nop,TS val 634960764 ecr 120741], length 0
03:29:42.904012 IP 192.168.1.10.43596 > a104-126-131-152.deploy.static.akamaitechnologies.com.www: Flags [.], ack 559, win 123, options [nop,nop,TS val 120742 ecr 634960764], length 0
03:29:42.910303 IP a104-126-131-152.deploy.static.akamaitechnologies.com.https > 192.168.1.10.57535: Flags [S.], seq 17558617, ack 1430778801, win 28960, options [mss 1360,sackOK,TS val 1030717838 ecr 120742,nop,wscale 5], length 0
03:29:42.912541 IP 192.168.1.10.57535 > a104-126-131-152.deploy.static.akamaitechnologies.com.https: Flags [.], ack 1, win 115, options [nop,nop,TS val 120743 ecr 1030717838], length 0
03:29:42.936176 IP 192.168.1.10.57535 > a104-126-131-152.deploy.static.akamaitechnologies.com.https: Flags [P.], seq 1:217, ack 1, win 115, options [nop,nop,TS val 120746 ecr 1030717838], length 216
03:29:42.950141 IP a104-126-131-152.deploy.static.akamaitechnologies.com.https > 192.168.1.10.57535: Flags [.], ack 217, win 939, options [nop,nop,TS val 1030717878 ecr 120746], length 0
03:29:42.950601 IP a104-126-131-152.deploy.static.akamaitechnologies.com.https > 192.168.1.10.57535: Flags [P.], seq 1:154, ack 217, win 939, options [nop,nop,TS val 1030717879 ecr 120746], length 153
03:29:42.952516 IP 192.168.1.10.57535 > a104-126-131-152.deploy.static.akamaitechnologies.com.https: Flags [.], ack 154, win 123, options [nop,nop,TS val 120747 ecr 1030717879], length 0
03:29:42.955149 IP 192.168.1.10.57535 > a104-126-131-152.deploy.static.akamaitechnologies.com.https: Flags [P.], seq 217:276, ack 154, win 123, options [nop,nop,TS val 120748 ecr 1030717879], length 59
03:29:43.008428 IP a104-126-131-152.deploy.static.akamaitechnologies.com.https > 192.168.1.10.57535: Flags [.], ack 276, win 939, options [nop,nop,TS val 1030717937 ecr 120748], length 0
03:29:43.010661 IP 192.168.1.10.57535 > a104-126-131-152.deploy.static.akamaitechnologies.com.https: Flags [P.], seq 276:537, ack 154, win 123, options [nop,nop,TS val 120753 ecr 1030717937], length 261
03:29:43.024570 IP a104-126-131-152.deploy.static.akamaitechnologies.com.https > 192.168.1.10.57535: Flags [.], ack 537, win 972, options [nop,nop,TS val 1030717953 ecr 120753], length 0
03:29:43.116538 IP a104-126-131-152.deploy.static.akamaitechnologies.com.https > 192.168.1.10.57535: Flags [P.], seq 154:895, ack 537, win 972, options [nop,nop,TS val 1030718045 ecr 120753], length 741
03:29:43.154571 IP 192.168.1.10.57535 > a104-126-131-152.deploy.static.akamaitechnologies.com.https: Flags [.], ack 895, win 135, options [nop,nop,TS val 120768 ecr 1030718045], length 0
03:29:43.182467 IP 192.168.1.10.57535 > a104-126-131-152.deploy.static.akamaitechnologies.com.https: Flags [P.], seq 537:1198, ack 895, win 135, options [nop,nop,TS val 120770 ecr 1030718045], length 661
03:29:43.196467 IP a104-126-131-152.deploy.static.akamaitechnologies.com.https > 192.168.1.10.57535: Flags [.], ack 1198, win 1014, options [nop,nop,TS val 1030718125 ecr 120770], length 0
03:29:43.482390 IP a104-126-131-152.deploy.static.akamaitechnologies.com.https > 192.168.1.10.57535: Flags [.], seq 895:2243, ack 1198, win 1014, options [nop,nop,TS val 1030718410 ecr 120770], length 1348
03:29:43.482484 IP a104-126-131-152.deploy.static.akamaitechnologies.com.https > 192.168.1.10.57535: Flags [.], seq 2243:3591, ack 1198, win 1014, options [nop,nop,TS val 1030718410 ecr 120770], length 1348
03:29:43.482501 IP a104-126-131-152.deploy.static.akamaitechnologies.com.https > 192.168.1.10.57535: Flags [.], seq 3591:4939, ack 1198, win 1014, options [nop,nop,TS val 1030718410 ecr 120770], length 1348
03:29:43.482514 IP a104-126-131-152.deploy.static.akamaitechnologies.com.https > 192.168.1.10.57535: Flags [.], seq 4939:6287, ack 1198, win 1014, options [nop,nop,TS val 1030718410 ecr 120770], length 1348
03:29:43.482526 IP a104-126-131-152.deploy.static.akamaitechnologies.com.https > 192.168.1.10.57535: Flags [.], seq 6287:7635, ack 1198, win 1014, options [nop,nop,TS val 1030718410 ecr 120770], length 1348
03:29:43.482538 IP a104-126-131-152.deploy.static.akamaitechnologies.com.https > 192.168.1.10.57535: Flags [.], seq 7635:8983, ack 1198, win 1014, options [nop,nop,TS val 1030718410 ecr 120770], length 1348
03:29:43.482549 IP a104-126-131-152.deploy.static.akamaitechnologies.com.https > 192.168.1.10.57535: Flags [.], seq 8983:10331, ack 1198, win 1014, options [nop,nop,TS val 1030718410 ecr 120770], length 1348
03:29:43.482560 IP a104-126-131-152.deploy.static.akamaitechnologies.com.https > 192.168.1.10.57535: Flags [.], seq 10331:11679, ack 1198, win 1014, options [nop,nop,TS val 1030718410 ecr 120770], length 1348
03:29:43.482572 IP a104-126-131-152.deploy.static.akamaitechnologies.com.https > 192.168.1.10.57535: Flags [.], seq 11679:13027, ack 1198, win 1014, options [nop,nop,TS val 1030718410 ecr 120770], length 1348
03:29:43.482582 IP a104-126-131-152.deploy.static.akamaitechnologies.com.https > 192.168.1.10.57535: Flags [.], seq 13027:14375, ack 1198, win 1014, options [nop,nop,TS val 1030718410 ecr 120770], length 1348
03:29:43.482594 IP a104-126-131-152.deploy.static.akamaitechnologies.com.https > 192.168.1.10.57535: Flags [.], seq 14375:15723, ack 1198, win 1014, options [nop,nop,TS val 1030718410 ecr 120770], length 1348
03:29:43.482605 IP a104-126-131-152.deploy.static.akamaitechnologies.com.https > 192.168.1.10.57535: Flags [.], seq 15723:17071, ack 1198, win 1014, options [nop,nop,TS val 1030718410 ecr 120770], length 1348
03:29:43.548232 IP 192.168.1.10.57535 > a104-126-131-152.deploy.static.akamaitechnologies.com.https: Flags [.], ack 2243, win 156, options [nop,nop,TS val 120806 ecr 1030718410], length 0
03:29:43.548247 IP 192.168.1.10.57535 > a104-126-131-152.deploy.static.akamaitechnologies.com.https: Flags [.], ack 3591, win 177, options [nop,nop,TS val 120806 ecr 1030718410], length 0
03:29:43.548260 IP 192.168.1.10.57535 > a104-126-131-152.deploy.static.akamaitechnologies.com.https: Flags [.], ack 4939, win 198, options [nop,nop,TS val 120806 ecr 1030718410], length 0
03:29:43.548271 IP 192.168.1.10.57535 > a104-126-131-152.deploy.static.akamaitechnologies.com.https: Flags [.], ack 6287, win 219, options [nop,nop,TS val 120806 ecr 1030718410], length 0
03:29:43.548291 IP 192.168.1.10.57535 > a104-126-131-152.deploy.static.akamaitechnologies.com.https: Flags [.], ack 7635, win 240, options [nop,nop,TS val 120806 ecr 1030718410], length 0
03:29:43.557610 IP 192.168.1.10.57535 > a104-126-131-152.deploy.static.akamaitechnologies.com.https: Flags [.], ack 8983, win 261, options [nop,nop,TS val 120808 ecr 1030718410], length 0
03:29:43.557623 IP 192.168.1.10.57535 > a104-126-131-152.deploy.static.akamaitechnologies.com.https: Flags [.], ack 10331, win 282, options [nop,nop,TS val 120808 ecr 1030718410], length 0
03:29:43.557633 IP 192.168.1.10.57535 > a104-126-131-152.deploy.static.akamaitechnologies.com.https: Flags [.], ack 11679, win 303, options [nop,nop,TS val 120808 ecr 1030718410], length 0
03:29:43.557654 IP 192.168.1.10.57535 > a104-126-131-152.deploy.static.akamaitechnologies.com.https: Flags [.], ack 13027, win 324, options [nop,nop,TS val 120808 ecr 1030718410], length 0
03:29:43.558703 IP 192.168.1.10.57535 > a104-126-131-152.deploy.static.akamaitechnologies.com.https: Flags [.], ack 14375, win 345, options [nop,nop,TS val 120808 ecr 1030718410], length 0
03:29:43.558726 IP 192.168.1.10.57535 > a104-126-131-152.deploy.static.akamaitechnologies.com.https: Flags [.], ack 15723, win 366, options [nop,nop,TS val 120808 ecr 1030718410], length 0
03:29:43.558739 IP 192.168.1.10.57535 > a104-126-131-152.deploy.static.akamaitechnologies.com.https: Flags [.], ack 17071, win 387, options [nop,nop,TS val 120808 ecr 1030718410], length 0
03:29:43.562740 IP a104-126-131-152.deploy.static.akamaitechnologies.com.https > 192.168.1.10.57535: Flags [.], seq 17071:18419, ack 1198, win 1014, options [nop,nop,TS val 1030718491 ecr 120806], length 1348
03:29:43.562928 IP a104-126-131-152.deploy.static.akamaitechnologies.com.https > 192.168.1.10.57535: Flags [.], seq 18419:19767, ack 1198, win 1014, options [nop,nop,TS val 1030718491 ecr 120806], length 1348
03:29:43.562969 IP a104-126-131-152.deploy.static.akamaitechnologies.com.https > 192.168.1.10.57535: Flags [.], seq 19767:21115, ack 1198, win 1014, options [nop,nop,TS val 1030718491 ecr 120806], length 1348
03:29:43.563003 IP a104-126-131-152.deploy.static.akamaitechnologies.com.https > 192.168.1.10.57535: Flags [.], seq 21115:22211, ack 1198, win 1014, options [nop,nop,TS val 1030718491 ecr 120806], length 1096
03:29:43.564875 IP 192.168.1.10.57535 > a104-126-131-152.deploy.static.akamaitechnologies.com.https: Flags [.], ack 18419, win 408, options [nop,nop,TS val 120809 ecr 1030718491], length 0
03:29:43.564903 IP 192.168.1.10.57535 > a104-126-131-152.deploy.static.akamaitechnologies.com.https: Flags [.], ack 19767, win 429, options [nop,nop,TS val 120809 ecr 1030718491], length 0
03:29:43.565151 IP a104-126-131-152.deploy.static.akamaitechnologies.com.https > 192.168.1.10.57535: Flags [.], seq 22211:23559, ack 1198, win 1014, options [nop,nop,TS val 1030718491 ecr 120806], length 1348
03:29:43.565229 IP a104-126-131-152.deploy.static.akamaitechnologies.com.https > 192.168.1.10.57535: Flags [.], seq 23559:24907, ack 1198, win 1014, options [nop,nop,TS val 1030718491 ecr 120806], length 1348
03:29:43.565275 IP a104-126-131-152.deploy.static.akamaitechnologies.com.https > 192.168.1.10.57535: Flags [.], seq 24907:26255, ack 1198, win 1014, options [nop,nop,TS val 1030718491 ecr 120806], length 1348
03:29:43.565304 IP a104-126-131-152.deploy.static.akamaitechnologies.com.https > 192.168.1.10.57535: Flags [.], seq 26255:27603, ack 1198, win 1014, options [nop,nop,TS val 1030718491 ecr 120806], length 1348
03:29:43.565334 IP a104-126-131-152.deploy.static.akamaitechnologies.com.https > 192.168.1.10.57535: Flags [.], seq 27603:27855, ack 1198, win 1014, options [nop,nop,TS val 1030718491 ecr 120806], length 252
03:29:43.565680 IP 192.168.1.10.57535 > a104-126-131-152.deploy.static.akamaitechnologies.com.https: Flags [.], ack 21115, win 450, options [nop,nop,TS val 120809 ecr 1030718491], length 0
03:29:43.565695 IP 192.168.1.10.57535 > a104-126-131-152.deploy.static.akamaitechnologies.com.https: Flags [.], ack 22211, win 472, options [nop,nop,TS val 120809 ecr 1030718491], length 0
03:29:43.567192 IP 192.168.1.10.57535 > a104-126-131-152.deploy.static.akamaitechnologies.com.https: Flags [.], ack 23559, win 493, options [nop,nop,TS val 120809 ecr 1030718491], length 0
03:29:43.567216 IP 192.168.1.10.57535 > a104-126-131-152.deploy.static.akamaitechnologies.com.https: Flags [.], ack 24907, win 514, options [nop,nop,TS val 120809 ecr 1030718491], length 0
03:29:43.567232 IP 192.168.1.10.57535 > a104-126-131-152.deploy.static.akamaitechnologies.com.https: Flags [.], ack 26255, win 535, options [nop,nop,TS val 120809 ecr 1030718491], length 0
03:29:43.567597 IP 192.168.1.10.57535 > a104-126-131-152.deploy.static.akamaitechnologies.com.https: Flags [.], ack 27603, win 556, options [nop,nop,TS val 120809 ecr 1030718491], length 0
03:29:43.567678 IP 192.168.1.10.57535 > a104-126-131-152.deploy.static.akamaitechnologies.com.https: Flags [.], ack 27855, win 577, options [nop,nop,TS val 120809 ecr 1030718491], length 0
03:29:43.568710 IP a104-126-131-152.deploy.static.akamaitechnologies.com.https > 192.168.1.10.57535: Flags [.], seq 27855:29203, ack 1198, win 1014, options [nop,nop,TS val 1030718491 ecr 120806], length 1348
03:29:43.568841 IP a104-126-131-152.deploy.static.akamaitechnologies.com.https > 192.168.1.10.57535: Flags [.], seq 29203:30283, ack 1198, win 1014, options [nop,nop,TS val 1030718491 ecr 120806], length 1080
03:29:43.570356 IP a104-126-131-152.deploy.static.akamaitechnologies.com.https > 192.168.1.10.57535: Flags [.], seq 30283:31631, ack 1198, win 1014, options [nop,nop,TS val 1030718491 ecr 120806], length 1348
03:29:43.570441 IP a104-126-131-152.deploy.static.akamaitechnologies.com.https > 192.168.1.10.57535: Flags [.], seq 31631:32979, ack 1198, win 1014, options [nop,nop,TS val 1030718491 ecr 120806], length 1348
03:29:43.570473 IP a104-126-131-152.deploy.static.akamaitechnologies.com.https > 192.168.1.10.57535: Flags [.], seq 32979:34327, ack 1198, win 1014, options [nop,nop,TS val 1030718491 ecr 120806], length 1348
03:29:43.570504 IP a104-126-131-152.deploy.static.akamaitechnologies.com.https > 192.168.1.10.57535: Flags [.], seq 34327:35675, ack 1198, win 1014, options [nop,nop,TS val 1030718491 ecr 120806], length 1348
03:29:43.570533 IP a104-126-131-152.deploy.static.akamaitechnologies.com.https > 192.168.1.10.57535: Flags [P.], seq 35675:35943, ack 1198, win 1014, options [nop,nop,TS val 1030718491 ecr 120806], length 268
03:29:43.570237 IP 192.168.1.10.57535 > a104-126-131-152.deploy.static.akamaitechnologies.com.https: Flags [.], ack 29203, win 598, options [nop,nop,TS val 120809 ecr 1030718491], length 0
03:29:43.570916 IP 192.168.1.10.57535 > a104-126-131-152.deploy.static.akamaitechnologies.com.https: Flags [.], ack 30283, win 619, options [nop,nop,TS val 120809 ecr 1030718491], length 0
03:29:43.572345 IP 192.168.1.10.57535 > a104-126-131-152.deploy.static.akamaitechnologies.com.https: Flags [.], ack 31631, win 640, options [nop,nop,TS val 120809 ecr 1030718491], length 0
03:29:43.572592 IP 192.168.1.10.57535 > a104-126-131-152.deploy.static.akamaitechnologies.com.https: Flags [.], ack 32979, win 661, options [nop,nop,TS val 120809 ecr 1030718491], length 0
03:29:43.572607 IP 192.168.1.10.57535 > a104-126-131-152.deploy.static.akamaitechnologies.com.https: Flags [.], ack 34327, win 682, options [nop,nop,TS val 120809 ecr 1030718491], length 0
03:29:43.573058 IP 192.168.1.10.57535 > a104-126-131-152.deploy.static.akamaitechnologies.com.https: Flags [.], ack 35675, win 703, options [nop,nop,TS val 120809 ecr 1030718491], length 0
03:29:43.573077 IP 192.168.1.10.57535 > a104-126-131-152.deploy.static.akamaitechnologies.com.https: Flags [.], ack 35943, win 724, options [nop,nop,TS val 120809 ecr 1030718491], length 0
03:29:43.573904 IP a104-126-131-152.deploy.static.akamaitechnologies.com.https > 192.168.1.10.57535: Flags [.], seq 35943:37291, ack 1198, win 1014, options [nop,nop,TS val 1030718500 ecr 120808], length 1348
03:29:43.574808 IP a104-126-131-152.deploy.static.akamaitechnologies.com.https > 192.168.1.10.57535: Flags [.], seq 37291:38639, ack 1198, win 1014, options [nop,nop,TS val 1030718500 ecr 120808], length 1348
03:29:43.574903 IP a104-126-131-152.deploy.static.akamaitechnologies.com.https > 192.168.1.10.57535: Flags [.], seq 38639:39987, ack 1198, win 1014, options [nop,nop,TS val 1030718500 ecr 120808], length 1348
03:29:43.574937 IP a104-126-131-152.deploy.static.akamaitechnologies.com.https > 192.168.1.10.57535: Flags [.], seq 39987:41335, ack 1198, win 1014, options [nop,nop,TS val 1030718500 ecr 120808], length 1348
03:29:43.576857 IP 192.168.1.10.57535 > a104-126-131-152.deploy.static.akamaitechnologies.com.https: Flags [.], ack 37291, win 745, options [nop,nop,TS val 120810 ecr 1030718500], length 0
03:29:43.577195 IP 192.168.1.10.57535 > a104-126-131-152.deploy.static.akamaitechnologies.com.https: Flags [.], ack 38639, win 766, options [nop,nop,TS val 120810 ecr 1030718500], length 0
03:29:43.577384 IP a104-126-131-152.deploy.static.akamaitechnologies.com.https > 192.168.1.10.57535: Flags [.], seq 41335:42683, ack 1198, win 1014, options [nop,nop,TS val 1030718501 ecr 120808], length 1348
03:29:43.577454 IP a104-126-131-152.deploy.static.akamaitechnologies.com.https > 192.168.1.10.57535: Flags [.], seq 42683:44031, ack 1198, win 1014, options [nop,nop,TS val 1030718501 ecr 120808], length 1348
03:29:43.577489 IP a104-126-131-152.deploy.static.akamaitechnologies.com.https > 192.168.1.10.57535: Flags [.], seq 44031:45379, ack 1198, win 1014, options [nop,nop,TS val 1030718501 ecr 120808], length 1348
03:29:43.577605 IP 192.168.1.10.57535 > a104-126-131-152.deploy.static.akamaitechnologies.com.https: Flags [.], ack 39987, win 787, options [nop,nop,TS val 120810 ecr 1030718500], length 0
03:29:43.577620 IP 192.168.1.10.57535 > a104-126-131-152.deploy.static.akamaitechnologies.com.https: Flags [.], ack 41335, win 809, options [nop,nop,TS val 120810 ecr 1030718500], length 0
03:29:43.579133 IP 192.168.1.10.57535 > a104-126-131-152.deploy.static.akamaitechnologies.com.https: Flags [.], ack 42683, win 830, options [nop,nop,TS val 120810 ecr 1030718501], length 0
03:29:43.579535 IP 192.168.1.10.57535 > a104-126-131-152.deploy.static.akamaitechnologies.com.https: Flags [.], ack 44031, win 851, options [nop,nop,TS val 120810 ecr 1030718501], length 0
03:29:43.579934 IP a104-126-131-152.deploy.static.akamaitechnologies.com.https > 192.168.1.10.57535: Flags [.], seq 45379:46727, ack 1198, win 1014, options [nop,nop,TS val 1030718501 ecr 120808], length 1348
03:29:43.579750 IP 192.168.1.10.57535 > a104-126-131-152.deploy.static.akamaitechnologies.com.https: Flags [.], ack 45379, win 872, options [nop,nop,TS val 120810 ecr 1030718501], length 0
03:29:43.580862 IP a104-126-131-152.deploy.static.akamaitechnologies.com.https > 192.168.1.10.57535: Flags [.], seq 46727:48075, ack 1198, win 1014, options [nop,nop,TS val 1030718507 ecr 120809], length 1348
03:29:43.580979 IP a104-126-131-152.deploy.static.akamaitechnologies.com.https > 192.168.1.10.57535: Flags [.], seq 48075:49423, ack 1198, win 1014, options [nop,nop,TS val 1030718507 ecr 120809], length 1348
03:29:43.581192 IP 192.168.1.10.57535 > a104-126-131-152.deploy.static.akamaitechnologies.com.https: Flags [.], ack 46727, win 893, options [nop,nop,TS val 120810 ecr 1030718501], length 0
03:29:43.582535 IP a104-126-131-152.deploy.static.akamaitechnologies.com.https > 192.168.1.10.57535: Flags [.], seq 49423:50771, ack 1198, win 1014, options [nop,nop,TS val 1030718508 ecr 120809], length 1348
03:29:43.582500 IP 192.168.1.10.57535 > a104-126-131-152.deploy.static.akamaitechnologies.com.https: Flags [.], ack 48075, win 914, options [nop,nop,TS val 120810 ecr 1030718507], length 0
03:29:43.582915 IP 192.168.1.10.57535 > a104-126-131-152.deploy.static.akamaitechnologies.com.https: Flags [.], ack 49423, win 935, options [nop,nop,TS val 120810 ecr 1030718507], length 0
03:29:43.583418 IP a104-126-131-152.deploy.static.akamaitechnologies.com.https > 192.168.1.10.57535: Flags [.], seq 50771:52119, ack 1198, win 1014, options [nop,nop,TS val 1030718508 ecr 120809], length 1348
03:29:43.583522 IP a104-126-131-152.deploy.static.akamaitechnologies.com.https > 192.168.1.10.57535: Flags [.], seq 52119:53467, ack 1198, win 1014, options [nop,nop,TS val 1030718508 ecr 120809], length 1348
03:29:43.583891 IP 192.168.1.10.57535 > a104-126-131-152.deploy.static.akamaitechnologies.com.https: Flags [.], ack 50771, win 956, options [nop,nop,TS val 120810 ecr 1030718508], length 0
03:29:43.585238 IP a104-126-131-152.deploy.static.akamaitechnologies.com.https > 192.168.1.10.57535: Flags [.], seq 53467:54815, ack 1198, win 1014, options [nop,nop,TS val 1030718509 ecr 120809], length 1348
03:29:43.585320 IP a104-126-131-152.deploy.static.akamaitechnologies.com.https > 192.168.1.10.57535: Flags [.], seq 54815:56163, ack 1198, win 1014, options [nop,nop,TS val 1030718509 ecr 120809], length 1348
03:29:43.585355 IP a104-126-131-152.deploy.static.akamaitechnologies.com.https > 192.168.1.10.57535: Flags [.], seq 56163:57511, ack 1198, win 1014, options [nop,nop,TS val 1030718509 ecr 120809], length 1348
03:29:43.585384 IP a104-126-131-152.deploy.static.akamaitechnologies.com.https > 192.168.1.10.57535: Flags [.], seq 57511:58859, ack 1198, win 1014, options [nop,nop,TS val 1030718509 ecr 120809], length 1348
03:29:43.585412 IP a104-126-131-152.deploy.static.akamaitechnologies.com.https > 192.168.1.10.57535: Flags [P.], seq 58859:60207, ack 1198, win 1014, options [nop,nop,TS val 1030718509 ecr 120809], length 1348
03:29:43.585113 IP 192.168.1.10.57535 > a104-126-131-152.deploy.static.akamaitechnologies.com.https: Flags [.], ack 52119, win 977, options [nop,nop,TS val 120811 ecr 1030718508], length 0
03:29:43.585132 IP 192.168.1.10.57535 > a104-126-131-152.deploy.static.akamaitechnologies.com.https: Flags [.], ack 53467, win 998, options [nop,nop,TS val 120811 ecr 1030718508], length 0
03:29:43.587502 IP 192.168.1.10.57535 > a104-126-131-152.deploy.static.akamaitechnologies.com.https: Flags [.], ack 54815, win 1019, options [nop,nop,TS val 120811 ecr 1030718509], length 0
03:29:43.587516 IP 192.168.1.10.57535 > a104-126-131-152.deploy.static.akamaitechnologies.com.https: Flags [.], ack 56163, win 1040, options [nop,nop,TS val 120811 ecr 1030718509], length 0
03:29:43.587536 IP 192.168.1.10.57535 > a104-126-131-152.deploy.static.akamaitechnologies.com.https: Flags [.], ack 57511, win 1061, options [nop,nop,TS val 120811 ecr 1030718509], length 0
03:29:43.587964 IP 192.168.1.10.57535 > a104-126-131-152.deploy.static.akamaitechnologies.com.https: Flags [.], ack 58859, win 1082, options [nop,nop,TS val 120811 ecr 1030718509], length 0
03:29:43.587983 IP 192.168.1.10.57535 > a104-126-131-152.deploy.static.akamaitechnologies.com.https: Flags [.], ack 60207, win 1103, options [nop,nop,TS val 120811 ecr 1030718509], length 0
03:29:43.589423 IP a104-126-131-152.deploy.static.akamaitechnologies.com.https > 192.168.1.10.57535: Flags [.], seq 60207:61555, ack 1198, win 1014, options [nop,nop,TS val 1030718509 ecr 120809], length 1348
03:29:43.590327 IP a104-126-131-152.deploy.static.akamaitechnologies.com.https > 192.168.1.10.57535: Flags [.], seq 61555:62903, ack 1198, win 1014, options [nop,nop,TS val 1030718510 ecr 120809], length 1348
03:29:43.590430 IP a104-126-131-152.deploy.static.akamaitechnologies.com.https > 192.168.1.10.57535: Flags [.], seq 62903:64251, ack 1198, win 1014, options [nop,nop,TS val 1030718510 ecr 120809], length 1348
03:29:43.591128 IP 192.168.1.10.57535 > a104-126-131-152.deploy.static.akamaitechnologies.com.https: Flags [.], ack 61555, win 1124, options [nop,nop,TS val 120811 ecr 1030718509], length 0
03:29:43.592049 IP a104-126-131-152.deploy.static.akamaitechnologies.com.https > 192.168.1.10.57535: Flags [.], seq 64251:65599, ack 1198, win 1014, options [nop,nop,TS val 1030718510 ecr 120809], length 1348
03:29:43.592134 IP a104-126-131-152.deploy.static.akamaitechnologies.com.https > 192.168.1.10.57535: Flags [.], seq 65599:66947, ack 1198, win 1014, options [nop,nop,TS val 1030718510 ecr 120809], length 1348
03:29:43.592214 IP 192.168.1.10.57535 > a104-126-131-152.deploy.static.akamaitechnologies.com.https: Flags [.], ack 62903, win 1146, options [nop,nop,TS val 120811 ecr 1030718510], length 0
03:29:43.592356 IP 192.168.1.10.57535 > a104-126-131-152.deploy.static.akamaitechnologies.com.https: Flags [.], ack 64251, win 1167, options [nop,nop,TS val 120811 ecr 1030718510], length 0
03:29:43.593464 IP 192.168.1.10.57535 > a104-126-131-152.deploy.static.akamaitechnologies.com.https: Flags [.], ack 65599, win 1188, options [nop,nop,TS val 120811 ecr 1030718510], length 0
03:29:43.593926 IP a104-126-131-152.deploy.static.akamaitechnologies.com.https > 192.168.1.10.57535: Flags [.], seq 66947:68295, ack 1198, win 1014, options [nop,nop,TS val 1030718513 ecr 120809], length 1348
03:29:43.594018 IP a104-126-131-152.deploy.static.akamaitechnologies.com.https > 192.168.1.10.57535: Flags [.], seq 68295:69643, ack 1198, win 1014, options [nop,nop,TS val 1030718513 ecr 120809], length 1348
03:29:43.594305 IP 192.168.1.10.57535 > a104-126-131-152.deploy.static.akamaitechnologies.com.https: Flags [.], ack 66947, win 1209, options [nop,nop,TS val 120811 ecr 1030718510], length 0
03:29:43.595338 IP 192.168.1.10.57535 > a104-126-131-152.deploy.static.akamaitechnologies.com.https: Flags [.], ack 68295, win 1230, options [nop,nop,TS val 120812 ecr 1030718513], length 0
03:29:43.595685 IP a104-126-131-152.deploy.static.akamaitechnologies.com.https > 192.168.1.10.57535: Flags [.], seq 69643:70991, ack 1198, win 1014, options [nop,nop,TS val 1030718513 ecr 120809], length 1348
03:29:43.595825 IP a104-126-131-152.deploy.static.akamaitechnologies.com.https > 192.168.1.10.57535: Flags [.], seq 70991:72339, ack 1198, win 1014, options [nop,nop,TS val 1030718513 ecr 120809], length 1348
03:29:43.596158 IP 192.168.1.10.57535 > a104-126-131-152.deploy.static.akamaitechnologies.com.https: Flags [.], ack 69643, win 1251, options [nop,nop,TS val 120812 ecr 1030718513], length 0
03:29:43.597074 IP 192.168.1.10.57535 > a104-126-131-152.deploy.static.akamaitechnologies.com.https: Flags [.], ack 70991, win 1272, options [nop,nop,TS val 120812 ecr 1030718513], length 0
03:29:43.597216 IP a104-126-131-152.deploy.static.akamaitechnologies.com.https > 192.168.1.10.57535: Flags [.], seq 72339:73687, ack 1198, win 1014, options [nop,nop,TS val 1030718514 ecr 120809], length 1348
03:29:43.597315 IP a104-126-131-152.deploy.static.akamaitechnologies.com.https > 192.168.1.10.57535: Flags [.], seq 73687:75035, ack 1198, win 1014, options [nop,nop,TS val 1030718514 ecr 120809], length 1348
03:29:43.597557 IP 192.168.1.10.57535 > a104-126-131-152.deploy.static.akamaitechnologies.com.https: Flags [.], ack 72339, win 1293, options [nop,nop,TS val 120812 ecr 1030718513], length 0
03:29:43.598579 IP 192.168.1.10.57535 > a104-126-131-152.deploy.static.akamaitechnologies.com.https: Flags [.], ack 73687, win 1314, options [nop,nop,TS val 120812 ecr 1030718514], length 0
03:29:43.598969 IP a104-126-131-152.deploy.static.akamaitechnologies.com.https > 192.168.1.10.57535: Flags [.], seq 75035:76383, ack 1198, win 1014, options [nop,nop,TS val 1030718515 ecr 120809], length 1348
03:29:43.599037 IP a104-126-131-152.deploy.static.akamaitechnologies.com.https > 192.168.1.10.57535: Flags [.], seq 76383:77731, ack 1198, win 1014, options [nop,nop,TS val 1030718515 ecr 120809], length 1348
03:29:43.599069 IP a104-126-131-152.deploy.static.akamaitechnologies.com.https > 192.168.1.10.57535: Flags [.], seq 77731:79079, ack 1198, win 1014, options [nop,nop,TS val 1030718515 ecr 120809], length 1348
03:29:43.599117 IP a104-126-131-152.deploy.static.akamaitechnologies.com.https > 192.168.1.10.57535: Flags [.], seq 79079:80427, ack 1198, win 1014, options [nop,nop,TS val 1030718515 ecr 120809], length 1348
03:29:43.598867 IP 192.168.1.10.57535 > a104-126-131-152.deploy.static.akamaitechnologies.com.https: Flags [.], ack 75035, win 1335, options [nop,nop,TS val 120812 ecr 1030718514], length 0
03:29:43.602253 IP 192.168.1.10.57535 > a104-126-131-152.deploy.static.akamaitechnologies.com.https: Flags [.], ack 76383, win 1356, options [nop,nop,TS val 120812 ecr 1030718515], length 0
03:29:43.602269 IP 192.168.1.10.57535 > a104-126-131-152.deploy.static.akamaitechnologies.com.https: Flags [.], ack 77731, win 1377, options [nop,nop,TS val 120812 ecr 1030718515], length 0
03:29:43.602280 IP 192.168.1.10.57535 > a104-126-131-152.deploy.static.akamaitechnologies.com.https: Flags [.], ack 79079, win 1398, options [nop,nop,TS val 120812 ecr 1030718515], length 0
03:29:43.602291 IP 192.168.1.10.57535 > a104-126-131-152.deploy.static.akamaitechnologies.com.https: Flags [.], ack 80427, win 1419, options [nop,nop,TS val 120812 ecr 1030718515], length 0
03:29:43.602480 IP a104-126-131-152.deploy.static.akamaitechnologies.com.https > 192.168.1.10.57535: Flags [.], seq 80427:81775, ack 1198, win 1014, options [nop,nop,TS val 1030718515 ecr 120809], length 1348
03:29:43.602582 IP a104-126-131-152.deploy.static.akamaitechnologies.com.https > 192.168.1.10.57535: Flags [.], seq 81775:83123, ack 1198, win 1014, options [nop,nop,TS val 1030718515 ecr 120809], length 1348
03:29:43.604015 IP 192.168.1.10.57535 > a104-126-131-152.deploy.static.akamaitechnologies.com.https: Flags [.], ack 81775, win 1440, options [nop,nop,TS val 120812 ecr 1030718515], length 0
03:29:43.604329 IP a104-126-131-152.deploy.static.akamaitechnologies.com.https > 192.168.1.10.57535: Flags [.], seq 83123:84471, ack 1198, win 1014, options [nop,nop,TS val 1030718515 ecr 120809], length 1348
03:29:43.604408 IP a104-126-131-152.deploy.static.akamaitechnologies.com.https > 192.168.1.10.57535: Flags [.], seq 84471:85819, ack 1198, win 1014, options [nop,nop,TS val 1030718515 ecr 120809], length 1348
03:29:43.604480 IP 192.168.1.10.57535 > a104-126-131-152.deploy.static.akamaitechnologies.com.https: Flags [.], ack 83123, win 1461, options [nop,nop,TS val 120812 ecr 1030718515], length 0
03:29:43.605751 IP 192.168.1.10.57535 > a104-126-131-152.deploy.static.akamaitechnologies.com.https: Flags [.], ack 84471, win 1483, options [nop,nop,TS val 120813 ecr 1030718515], length 0
03:29:43.605899 IP a104-126-131-152.deploy.static.akamaitechnologies.com.https > 192.168.1.10.57535: Flags [.], seq 85819:87167, ack 1198, win 1014, options [nop,nop,TS val 1030718519 ecr 120810], length 1348
03:29:43.605982 IP a104-126-131-152.deploy.static.akamaitechnologies.com.https > 192.168.1.10.57535: Flags [.], seq 87167:88515, ack 1198, win 1014, options [nop,nop,TS val 1030718519 ecr 120810], length 1348
03:29:43.606271 IP 192.168.1.10.57535 > a104-126-131-152.deploy.static.akamaitechnologies.com.https: Flags [.], ack 85819, win 1504, options [nop,nop,TS val 120813 ecr 1030718515], length 0
03:29:43.607269 IP 192.168.1.10.57535 > a104-126-131-152.deploy.static.akamaitechnologies.com.https: Flags [.], ack 87167, win 1525, options [nop,nop,TS val 120813 ecr 1030718519], length 0
03:29:43.607641 IP a104-126-131-152.deploy.static.akamaitechnologies.com.https > 192.168.1.10.57535: Flags [.], seq 88515:89863, ack 1198, win 1014, options [nop,nop,TS val 1030718519 ecr 120810], length 1348
03:29:43.607736 IP a104-126-131-152.deploy.static.akamaitechnologies.com.https > 192.168.1.10.57535: Flags [.], seq 89863:91211, ack 1198, win 1014, options [nop,nop,TS val 1030718519 ecr 120810], length 1348
03:29:43.607862 IP 192.168.1.10.57535 > a104-126-131-152.deploy.static.akamaitechnologies.com.https: Flags [.], ack 88515, win 1546, options [nop,nop,TS val 120813 ecr 1030718519], length 0
03:29:43.609116 IP 192.168.1.10.57535 > a104-126-131-152.deploy.static.akamaitechnologies.com.https: Flags [.], ack 89863, win 1567, options [nop,nop,TS val 120813 ecr 1030718519], length 0
03:29:43.609382 IP a104-126-131-152.deploy.static.akamaitechnologies.com.https > 192.168.1.10.57535: Flags [.], seq 91211:92559, ack 1198, win 1014, options [nop,nop,TS val 1030718520 ecr 120810], length 1348
03:29:43.609695 IP 192.168.1.10.57535 > a104-126-131-152.deploy.static.akamaitechnologies.com.https: Flags [.], ack 91211, win 1588, options [nop,nop,TS val 120813 ecr 1030718519], length 0
03:29:43.610175 IP a104-126-131-152.deploy.static.akamaitechnologies.com.https > 192.168.1.10.57535: Flags [.], seq 92559:93907, ack 1198, win 1014, options [nop,nop,TS val 1030718520 ecr 120810], length 1348
03:29:43.610250 IP a104-126-131-152.deploy.static.akamaitechnologies.com.https > 192.168.1.10.57535: Flags [.], seq 93907:95255, ack 1198, win 1014, options [nop,nop,TS val 1030718520 ecr 120810], length 1348
03:29:43.610284 IP a104-126-131-152.deploy.static.akamaitechnologies.com.https > 192.168.1.10.57535: Flags [.], seq 95255:96603, ack 1198, win 1014, options [nop,nop,TS val 1030718520 ecr 120810], length 1348
03:29:43.610594 IP 192.168.1.10.57535 > a104-126-131-152.deploy.static.akamaitechnologies.com.https: Flags [.], ack 92559, win 1609, options [nop,nop,TS val 120813 ecr 1030718520], length 0
03:29:43.612358 IP 192.168.1.10.57535 > a104-126-131-152.deploy.static.akamaitechnologies.com.https: Flags [.], ack 93907, win 1630, options [nop,nop,TS val 120813 ecr 1030718520], length 0
03:29:43.612750 IP a104-126-131-152.deploy.static.akamaitechnologies.com.https > 192.168.1.10.57535: Flags [.], seq 96603:97951, ack 1198, win 1014, options [nop,nop,TS val 1030718521 ecr 120810], length 1348
03:29:43.613030 IP 192.168.1.10.57535 > a104-126-131-152.deploy.static.akamaitechnologies.com.https: Flags [.], ack 95255, win 1651, options [nop,nop,TS val 120813 ecr 1030718520], length 0
03:29:43.613050 IP 192.168.1.10.57535 > a104-126-131-152.deploy.static.akamaitechnologies.com.https: Flags [.], ack 96603, win 1672, options [nop,nop,TS val 120813 ecr 1030718520], length 0
03:29:43.613578 IP a104-126-131-152.deploy.static.akamaitechnologies.com.https > 192.168.1.10.57535: Flags [.], seq 97951:99299, ack 1198, win 1014, options [nop,nop,TS val 1030718521 ecr 120810], length 1348
03:29:43.613916 IP 192.168.1.10.57535 > a104-126-131-152.deploy.static.akamaitechnologies.com.https: Flags [.], ack 97951, win 1693, options [nop,nop,TS val 120813 ecr 1030718521], length 0
03:29:43.614496 IP a104-126-131-152.deploy.static.akamaitechnologies.com.https > 192.168.1.10.57535: Flags [.], seq 99299:100647, ack 1198, win 1014, options [nop,nop,TS val 1030718522 ecr 120810], length 1348
03:29:43.614576 IP a104-126-131-152.deploy.static.akamaitechnologies.com.https > 192.168.1.10.57535: Flags [.], seq 100647:101995, ack 1198, win 1014, options [nop,nop,TS val 1030718522 ecr 120810], length 1348
03:29:43.614901 IP 192.168.1.10.57535 > a104-126-131-152.deploy.static.akamaitechnologies.com.https: Flags [.], ack 99299, win 1714, options [nop,nop,TS val 120814 ecr 1030718521], length 0
03:29:43.615840 IP 192.168.1.10.57535 > a104-126-131-152.deploy.static.akamaitechnologies.com.https: Flags [.], ack 100647, win 1735, options [nop,nop,TS val 120814 ecr 1030718522], length 0
03:29:43.616121 IP 192.168.1.10.57535 > a104-126-131-152.deploy.static.akamaitechnologies.com.https: Flags [.], ack 101995, win 1756, options [nop,nop,TS val 120814 ecr 1030718522], length 0
03:29:43.616227 IP a104-126-131-152.deploy.static.akamaitechnologies.com.https > 192.168.1.10.57535: Flags [.], seq 101995:103343, ack 1198, win 1014, options [nop,nop,TS val 1030718522 ecr 120810], length 1348
03:29:43.616289 IP a104-126-131-152.deploy.static.akamaitechnologies.com.https > 192.168.1.10.57535: Flags [.], seq 103343:104691, ack 1198, win 1014, options [nop,nop,TS val 1030718522 ecr 120810], length 1348
03:29:43.617487 IP 192.168.1.10.57535 > a104-126-131-152.deploy.static.akamaitechnologies.com.https: Flags [.], ack 103343, win 1777, options [nop,nop,TS val 120814 ecr 1030718522], length 0
03:29:43.617845 IP 192.168.1.10.57535 > a104-126-131-152.deploy.static.akamaitechnologies.com.https: Flags [.], ack 104691, win 1798, options [nop,nop,TS val 120814 ecr 1030718522], length 0
03:29:43.617983 IP a104-126-131-152.deploy.static.akamaitechnologies.com.https > 192.168.1.10.57535: Flags [.], seq 104691:106039, ack 1198, win 1014, options [nop,nop,TS val 1030718524 ecr 120810], length 1348
03:29:43.618075 IP a104-126-131-152.deploy.static.akamaitechnologies.com.https > 192.168.1.10.57535: Flags [.], seq 106039:107387, ack 1198, win 1014, options [nop,nop,TS val 1030718524 ecr 120810], length 1348
03:29:43.619337 IP 192.168.1.10.57535 > a104-126-131-152.deploy.static.akamaitechnologies.com.https: Flags [.], ack 106039, win 1820, options [nop,nop,TS val 120814 ecr 1030718524], length 0
03:29:43.619663 IP a104-126-131-152.deploy.static.akamaitechnologies.com.https > 192.168.1.10.57535: Flags [.], seq 107387:108735, ack 1198, win 1014, options [nop,nop,TS val 1030718525 ecr 120810], length 1348
03:29:43.619733 IP a104-126-131-152.deploy.static.akamaitechnologies.com.https > 192.168.1.10.57535: Flags [.], seq 108735:110083, ack 1198, win 1014, options [nop,nop,TS val 1030718525 ecr 120810], length 1348
03:29:43.619605 IP 192.168.1.10.57535 > a104-126-131-152.deploy.static.akamaitechnologies.com.https: Flags [.], ack 107387, win 1841, options [nop,nop,TS val 120814 ecr 1030718524], length 0
