tcpdump: verbose output suppressed, use -v or -vv for full protocol decode
listening on wlan0, link-type EN10MB (Ethernet), capture size 262144 bytes
03:27:46.183580 IP 192.168.1.10.50514 > pf-in-f109.1e100.net.587: Flags [S], seq 4126229630, win 14600, options [mss 1460,sackOK,TS val 1070092 ecr 0,nop,wscale 7], length 0
03:27:46.204676 IP pf-in-f109.1e100.net.587 > 192.168.1.10.50514: Flags [S.], seq 3776894231, ack 4126229631, win 42408, options [mss 1360,sackOK,TS val 835803320 ecr 1070092,nop,wscale 8], length 0
03:27:46.211047 IP 192.168.1.10.50514 > pf-in-f109.1e100.net.587: Flags [.], ack 1, win 115, options [nop,nop,TS val 1070095 ecr 835803320], length 0
03:27:46.243094 IP pf-in-f109.1e100.net.587 > 192.168.1.10.50514: Flags [P.], seq 1:54, ack 1, win 166, options [nop,nop,TS val 835803359 ecr 1070095], length 53
03:27:46.250205 IP 192.168.1.10.50514 > pf-in-f109.1e100.net.587: Flags [.], ack 54, win 115, options [nop,nop,TS val 1070099 ecr 835803359], length 0
03:27:46.250223 IP 192.168.1.10.50514 > pf-in-f109.1e100.net.587: Flags [F.], seq 1, ack 54, win 115, options [nop,nop,TS val 1070099 ecr 835803359], length 0
03:27:46.271257 IP pf-in-f109.1e100.net.587 > 192.168.1.10.50514: Flags [.], ack 2, win 166, options [nop,nop,TS val 835803387 ecr 1070099], length 0
03:27:46.271784 IP pf-in-f109.1e100.net.587 > 192.168.1.10.50514: Flags [F.], seq 54, ack 2, win 166, options [nop,nop,TS val 835803387 ecr 1070099], length 0
03:27:46.278329 IP 192.168.1.10.50514 > pf-in-f109.1e100.net.587: Flags [.], ack 55, win 115, options [nop,nop,TS val 1070102 ecr 835803387], length 0
03:27:46.293812 IP 192.168.1.10.49107 > ec2-54-205-161-210.compute-1.amazonaws.com.https: Flags [S], seq 532636899, win 14600, options [mss 1460,sackOK,TS val 1070103 ecr 0,nop,wscale 7], length 0
03:27:47.118540 IP 192.168.1.10.42181 > sea15s07-in-f14.1e100.net.www: Flags [S], seq 4261381587, win 14600, options [mss 1460,sackOK,TS val 1070186 ecr 0,nop,wscale 7], length 0
03:27:47.126061 IP sea15s07-in-f14.1e100.net.www > 192.168.1.10.42181: Flags [S.], seq 216617975, ack 4261381588, win 26960, options [mss 1360,sackOK,TS val 3181281165 ecr 1070186,nop,wscale 7], length 0
03:27:47.131688 IP 192.168.1.10.42181 > sea15s07-in-f14.1e100.net.www: Flags [.], ack 1, win 115, options [nop,nop,TS val 1070187 ecr 3181281165], length 0
03:27:47.153125 IP 192.168.1.10.42181 > sea15s07-in-f14.1e100.net.www: Flags [P.], seq 1:187, ack 1, win 115, options [nop,nop,TS val 1070189 ecr 3181281165], length 186: HTTP: GET /generate_204 HTTP/1.1
03:27:47.160367 IP sea15s07-in-f14.1e100.net.www > 192.168.1.10.42181: Flags [.], ack 187, win 219, options [nop,nop,TS val 3181281174 ecr 1070189], length 0
03:27:47.237584 IP sea15s07-in-f14.1e100.net.www > 192.168.1.10.42181: Flags [P.], seq 1:227, ack 187, win 219, options [nop,nop,TS val 3181281193 ecr 1070189], length 226: HTTP: HTTP/1.1 204 No Content
03:27:47.252319 IP 192.168.1.10.42181 > sea15s07-in-f14.1e100.net.www: Flags [.], ack 227, win 123, options [nop,nop,TS val 1070199 ecr 3181281193], length 0
03:27:47.285477 IP 192.168.1.10.49107 > ec2-54-205-161-210.compute-1.amazonaws.com.https: Flags [S], seq 532636899, win 14600, options [mss 1460,sackOK,TS val 1070203 ecr 0,nop,wscale 7], length 0
03:27:49.308660 IP 192.168.1.10.49107 > ec2-54-205-161-210.compute-1.amazonaws.com.https: Flags [S], seq 532636899, win 14600, options [mss 1460,sackOK,TS val 1070403 ecr 0,nop,wscale 7], length 0
03:27:53.303932 IP 192.168.1.10.49107 > ec2-54-205-161-210.compute-1.amazonaws.com.https: Flags [S], seq 532636899, win 14600, options [mss 1460,sackOK,TS val 1070804 ecr 0,nop,wscale 7], length 0
03:27:56.087206 IP 192.168.1.10.42186 > sea15s07-in-f14.1e100.net.www: Flags [S], seq 1424817817, win 14600, options [mss 1460,sackOK,TS val 1071082 ecr 0,nop,wscale 7], length 0
03:27:56.094676 IP sea15s07-in-f14.1e100.net.www > 192.168.1.10.42186: Flags [S.], seq 1179528017, ack 1424817818, win 26960, options [mss 1360,sackOK,TS val 3181283407 ecr 1071082,nop,wscale 7], length 0
03:27:56.100374 IP 192.168.1.10.42186 > sea15s07-in-f14.1e100.net.www: Flags [.], ack 1, win 115, options [nop,nop,TS val 1071084 ecr 3181283407], length 0
03:27:56.122989 IP 192.168.1.10.42186 > sea15s07-in-f14.1e100.net.www: Flags [P.], seq 1:181, ack 1, win 115, options [nop,nop,TS val 1071086 ecr 3181283407], length 180: HTTP: GET /generate_204 HTTP/1.1
03:27:56.130227 IP sea15s07-in-f14.1e100.net.www > 192.168.1.10.42186: Flags [.], ack 181, win 219, options [nop,nop,TS val 3181283416 ecr 1071086], length 0
03:27:56.154713 IP sea15s07-in-f14.1e100.net.www > 192.168.1.10.42186: Flags [P.], seq 1:227, ack 181, win 219, options [nop,nop,TS val 3181283422 ecr 1071086], length 226: HTTP: HTTP/1.1 204 No Content
03:27:56.161031 IP 192.168.1.10.42186 > sea15s07-in-f14.1e100.net.www: Flags [.], ack 227, win 123, options [nop,nop,TS val 1071090 ecr 3181283422], length 0
03:27:58.939583 IP 192.168.1.10.34353 > sea15s01-in-f2.1e100.net.https: Flags [S], seq 1687595456, win 14600, options [mss 1460,sackOK,TS val 1071367 ecr 0,nop,wscale 7], length 0
03:27:58.969145 IP sea15s01-in-f2.1e100.net.https > 192.168.1.10.34353: Flags [S.], seq 2502686659, ack 1687595457, win 42408, options [mss 1360,sackOK,TS val 3810449184 ecr 1071367,nop,wscale 8], length 0
03:27:58.976750 IP 192.168.1.10.34353 > sea15s01-in-f2.1e100.net.https: Flags [.], ack 1, win 115, options [nop,nop,TS val 1071371 ecr 3810449184], length 0
03:27:59.162993 IP 192.168.1.10.34353 > sea15s01-in-f2.1e100.net.https: Flags [P.], seq 1:181, ack 1, win 115, options [nop,nop,TS val 1071390 ecr 3810449184], length 180
03:27:59.192519 IP sea15s01-in-f2.1e100.net.https > 192.168.1.10.34353: Flags [.], ack 181, win 170, options [nop,nop,TS val 3810449407 ecr 1071390], length 0
03:27:59.200821 IP sea15s01-in-f2.1e100.net.https > 192.168.1.10.34353: Flags [.], seq 1:1349, ack 181, win 170, options [nop,nop,TS val 3810449415 ecr 1071390], length 1348
03:27:59.200937 IP sea15s01-in-f2.1e100.net.https > 192.168.1.10.34353: Flags [P.], seq 1349:2517, ack 181, win 170, options [nop,nop,TS val 3810449415 ecr 1071390], length 1168
03:27:59.209994 IP 192.168.1.10.34353 > sea15s01-in-f2.1e100.net.https: Flags [.], ack 1349, win 136, options [nop,nop,TS val 1071395 ecr 3810449415], length 0
03:27:59.210014 IP 192.168.1.10.34353 > sea15s01-in-f2.1e100.net.https: Flags [.], ack 2517, win 157, options [nop,nop,TS val 1071395 ecr 3810449415], length 0
03:27:59.668264 IP 192.168.1.10.52566 > pl-in-f188.1e100.net.5228: Flags [S], seq 1881387401, win 14600, options [mss 1460,sackOK,TS val 1071441 ecr 0,nop,wscale 7], length 0
03:27:59.684755 IP 192.168.1.10.57721 > sea15s07-in-f67.1e100.net.https: Flags [S], seq 4185589236, win 14600, options [mss 1460,sackOK,TS val 1071442 ecr 0,nop,wscale 7], length 0
03:27:59.690250 IP pl-in-f188.1e100.net.5228 > 192.168.1.10.52566: Flags [S.], seq 2499076973, ack 1881387402, win 42408, options [mss 1360,sackOK,TS val 2905459197 ecr 1071441,nop,wscale 8], length 0
03:27:59.696778 IP 192.168.1.10.52566 > pl-in-f188.1e100.net.5228: Flags [.], ack 1, win 115, options [nop,nop,TS val 1071444 ecr 2905459197], length 0
03:27:59.708640 IP 192.168.1.10.52566 > pl-in-f188.1e100.net.5228: Flags [P.], seq 1:168, ack 1, win 115, options [nop,nop,TS val 1071445 ecr 2905459197], length 167
03:27:59.713212 IP sea15s07-in-f67.1e100.net.https > 192.168.1.10.57721: Flags [S.], seq 1223286856, ack 4185589237, win 42408, options [mss 1360,sackOK,TS val 539319601 ecr 1071442,nop,wscale 8], length 0
03:27:59.730508 IP pl-in-f188.1e100.net.5228 > 192.168.1.10.52566: Flags [.], ack 168, win 170, options [nop,nop,TS val 2905459237 ecr 1071445], length 0
03:27:59.730900 IP pl-in-f188.1e100.net.5228 > 192.168.1.10.52566: Flags [.], seq 1:1349, ack 168, win 170, options [nop,nop,TS val 2905459237 ecr 1071445], length 1348
03:27:59.730963 IP pl-in-f188.1e100.net.5228 > 192.168.1.10.52566: Flags [.], seq 1349:2697, ack 168, win 170, options [nop,nop,TS val 2905459237 ecr 1071445], length 1348
03:27:59.730995 IP pl-in-f188.1e100.net.5228 > 192.168.1.10.52566: Flags [.], seq 2697:4045, ack 168, win 170, options [nop,nop,TS val 2905459237 ecr 1071445], length 1348
03:27:59.731025 IP pl-in-f188.1e100.net.5228 > 192.168.1.10.52566: Flags [P.], seq 4045:4112, ack 168, win 170, options [nop,nop,TS val 2905459237 ecr 1071445], length 67
03:27:59.736277 IP 192.168.1.10.57721 > sea15s07-in-f67.1e100.net.https: Flags [.], ack 1, win 115, options [nop,nop,TS val 1071447 ecr 539319601], length 0
03:27:59.745629 IP 192.168.1.10.52566 > pl-in-f188.1e100.net.5228: Flags [.], ack 1349, win 136, options [nop,nop,TS val 1071449 ecr 2905459237], length 0
03:27:59.745644 IP 192.168.1.10.52566 > pl-in-f188.1e100.net.5228: Flags [.], ack 2697, win 157, options [nop,nop,TS val 1071449 ecr 2905459237], length 0
03:27:59.745656 IP 192.168.1.10.52566 > pl-in-f188.1e100.net.5228: Flags [.], ack 4045, win 178, options [nop,nop,TS val 1071449 ecr 2905459237], length 0
03:27:59.745668 IP 192.168.1.10.52566 > pl-in-f188.1e100.net.5228: Flags [.], ack 4112, win 178, options [nop,nop,TS val 1071449 ecr 2905459237], length 0
03:27:59.783406 IP 192.168.1.10.34356 > sea15s01-in-f2.1e100.net.https: Flags [S], seq 321797711, win 14600, options [mss 1460,sackOK,TS val 1071452 ecr 0,nop,wscale 7], length 0
03:27:59.803417 IP 192.168.1.10.57721 > sea15s07-in-f67.1e100.net.https: Flags [P.], seq 1:165, ack 1, win 115, options [nop,nop,TS val 1071454 ecr 539319601], length 164
03:27:59.812794 IP sea15s01-in-f2.1e100.net.https > 192.168.1.10.34356: Flags [S.], seq 2735251533, ack 321797712, win 42408, options [mss 1360,sackOK,TS val 1375524001 ecr 1071452,nop,wscale 8], length 0
03:27:59.822908 IP 192.168.1.10.34356 > sea15s01-in-f2.1e100.net.https: Flags [.], ack 1, win 115, options [nop,nop,TS val 1071456 ecr 1375524001], length 0
03:27:59.831869 IP sea15s07-in-f67.1e100.net.https > 192.168.1.10.57721: Flags [.], ack 165, win 170, options [nop,nop,TS val 539319719 ecr 1071454], length 0
03:27:59.839408 IP sea15s07-in-f67.1e100.net.https > 192.168.1.10.57721: Flags [.], seq 1:1349, ack 165, win 170, options [nop,nop,TS val 539319727 ecr 1071454], length 1348
03:27:59.839478 IP sea15s07-in-f67.1e100.net.https > 192.168.1.10.57721: Flags [.], seq 1349:2697, ack 165, win 170, options [nop,nop,TS val 539319727 ecr 1071454], length 1348
03:27:59.839509 IP sea15s07-in-f67.1e100.net.https > 192.168.1.10.57721: Flags [.], seq 2697:4045, ack 165, win 170, options [nop,nop,TS val 539319727 ecr 1071454], length 1348
03:27:59.839538 IP sea15s07-in-f67.1e100.net.https > 192.168.1.10.57721: Flags [P.], seq 4045:4138, ack 165, win 170, options [nop,nop,TS val 539319727 ecr 1071454], length 93
03:27:59.848304 IP 192.168.1.10.34356 > sea15s01-in-f2.1e100.net.https: Flags [P.], seq 1:181, ack 1, win 115, options [nop,nop,TS val 1071459 ecr 1375524001], length 180
03:27:59.848318 IP 192.168.1.10.57721 > sea15s07-in-f67.1e100.net.https: Flags [.], ack 1349, win 136, options [nop,nop,TS val 1071459 ecr 539319727], length 0
03:27:59.848330 IP 192.168.1.10.57721 > sea15s07-in-f67.1e100.net.https: Flags [.], ack 2697, win 157, options [nop,nop,TS val 1071459 ecr 539319727], length 0
03:27:59.848342 IP 192.168.1.10.57721 > sea15s07-in-f67.1e100.net.https: Flags [.], ack 4045, win 178, options [nop,nop,TS val 1071459 ecr 539319727], length 0
03:27:59.848353 IP 192.168.1.10.57721 > sea15s07-in-f67.1e100.net.https: Flags [.], ack 4138, win 178, options [nop,nop,TS val 1071459 ecr 539319727], length 0
03:27:59.848364 IP 192.168.1.10.37939 > sea15s07-in-f10.1e100.net.https: Flags [S], seq 2341385688, win 14600, options [mss 1460,sackOK,TS val 1071459 ecr 0,nop,wscale 7], length 0
03:27:59.877841 IP sea15s01-in-f2.1e100.net.https > 192.168.1.10.34356: Flags [.], ack 181, win 170, options [nop,nop,TS val 1375524066 ecr 1071459], length 0
03:27:59.879774 IP sea15s07-in-f10.1e100.net.https > 192.168.1.10.37939: Flags [S.], seq 673027233, ack 2341385689, win 42408, options [mss 1360,sackOK,TS val 4168150161 ecr 1071459,nop,wscale 8], length 0
03:27:59.885198 IP sea15s01-in-f2.1e100.net.https > 192.168.1.10.34356: Flags [.], seq 1:1349, ack 181, win 170, options [nop,nop,TS val 1375524073 ecr 1071459], length 1348
03:27:59.885248 IP sea15s01-in-f2.1e100.net.https > 192.168.1.10.34356: Flags [P.], seq 1349:2517, ack 181, win 170, options [nop,nop,TS val 1375524073 ecr 1071459], length 1168
03:27:59.886264 IP 192.168.1.10.37939 > sea15s07-in-f10.1e100.net.https: Flags [.], ack 1, win 115, options [nop,nop,TS val 1071463 ecr 4168150161], length 0
03:27:59.890689 IP 192.168.1.10.37939 > sea15s07-in-f10.1e100.net.https: Flags [P.], seq 1:170, ack 1, win 115, options [nop,nop,TS val 1071463 ecr 4168150161], length 169
03:27:59.921947 IP sea15s07-in-f10.1e100.net.https > 192.168.1.10.37939: Flags [.], ack 170, win 170, options [nop,nop,TS val 4168150203 ecr 1071463], length 0
03:27:59.929194 IP sea15s07-in-f10.1e100.net.https > 192.168.1.10.37939: Flags [.], seq 1:1349, ack 170, win 170, options [nop,nop,TS val 4168150210 ecr 1071463], length 1348
03:27:59.929331 IP sea15s07-in-f10.1e100.net.https > 192.168.1.10.37939: Flags [.], seq 1349:2697, ack 170, win 170, options [nop,nop,TS val 4168150210 ecr 1071463], length 1348
03:27:59.929368 IP sea15s07-in-f10.1e100.net.https > 192.168.1.10.37939: Flags [P.], seq 2697:3236, ack 170, win 170, options [nop,nop,TS val 4168150210 ecr 1071463], length 539
03:27:59.935406 IP 192.168.1.10.37939 > sea15s07-in-f10.1e100.net.https: Flags [.], ack 1349, win 136, options [nop,nop,TS val 1071468 ecr 4168150210], length 0
03:27:59.935425 IP 192.168.1.10.37939 > sea15s07-in-f10.1e100.net.https: Flags [.], ack 2697, win 157, options [nop,nop,TS val 1071468 ecr 4168150210], length 0
03:27:59.935436 IP 192.168.1.10.37939 > sea15s07-in-f10.1e100.net.https: Flags [.], ack 3236, win 178, options [nop,nop,TS val 1071468 ecr 4168150210], length 0
03:27:59.935448 IP 192.168.1.10.34356 > sea15s01-in-f2.1e100.net.https: Flags [.], ack 1349, win 136, options [nop,nop,TS val 1071468 ecr 1375524073], length 0
03:27:59.935458 IP 192.168.1.10.34356 > sea15s01-in-f2.1e100.net.https: Flags [.], ack 2517, win 157, options [nop,nop,TS val 1071468 ecr 1375524073], length 0
03:27:59.939747 IP 192.168.1.10.52566 > pl-in-f188.1e100.net.5228: Flags [P.], seq 168:253, ack 4112, win 178, options [nop,nop,TS val 1071468 ecr 2905459237], length 85
03:27:59.961798 IP pl-in-f188.1e100.net.5228 > 192.168.1.10.52566: Flags [P.], seq 4112:4388, ack 253, win 170, options [nop,nop,TS val 2905459468 ecr 1071468], length 276
03:27:59.972294 IP 192.168.1.10.52566 > pl-in-f188.1e100.net.5228: Flags [.], ack 4388, win 199, options [nop,nop,TS val 1071471 ecr 2905459468], length 0
03:28:00.398000 IP 192.168.1.10.52566 > pl-in-f188.1e100.net.5228: Flags [P.], seq 253:498, ack 4388, win 199, options [nop,nop,TS val 1071512 ecr 2905459468], length 245
03:28:00.420396 IP pl-in-f188.1e100.net.5228 > 192.168.1.10.52566: Flags [P.], seq 4388:4410, ack 498, win 175, options [nop,nop,TS val 2905459927 ecr 1071512], length 22
03:28:00.423875 IP pl-in-f188.1e100.net.5228 > 192.168.1.10.52566: Flags [P.], seq 4410:4516, ack 498, win 175, options [nop,nop,TS val 2905459930 ecr 1071512], length 106
03:28:00.426310 IP pl-in-f188.1e100.net.5228 > 192.168.1.10.52566: Flags [P.], seq 4516:4633, ack 498, win 175, options [nop,nop,TS val 2905459933 ecr 1071512], length 117
03:28:00.426962 IP 192.168.1.10.52566 > pl-in-f188.1e100.net.5228: Flags [.], ack 4410, win 199, options [nop,nop,TS val 1071517 ecr 2905459927], length 0
03:28:00.431329 IP 192.168.1.10.52566 > pl-in-f188.1e100.net.5228: Flags [.], ack 4516, win 199, options [nop,nop,TS val 1071517 ecr 2905459930], length 0
03:28:00.435864 IP 192.168.1.10.52566 > pl-in-f188.1e100.net.5228: Flags [.], ack 4633, win 199, options [nop,nop,TS val 1071517 ecr 2905459933], length 0
03:28:00.586894 IP 192.168.1.10.37939 > sea15s07-in-f10.1e100.net.https: Flags [P.], seq 170:255, ack 3236, win 178, options [nop,nop,TS val 1071533 ecr 4168150210], length 85
03:28:00.618925 IP sea15s07-in-f10.1e100.net.https > 192.168.1.10.37939: Flags [P.], seq 3236:3512, ack 255, win 170, options [nop,nop,TS val 4168150900 ecr 1071533], length 276
03:28:00.632741 IP 192.168.1.10.37939 > sea15s07-in-f10.1e100.net.https: Flags [.], ack 3512, win 199, options [nop,nop,TS val 1071537 ecr 4168150900], length 0
03:28:00.719874 IP 192.168.1.10.34356 > sea15s01-in-f2.1e100.net.https: Flags [P.], seq 181:266, ack 2517, win 157, options [nop,nop,TS val 1071546 ecr 1375524073], length 85
03:28:00.749582 IP sea15s01-in-f2.1e100.net.https > 192.168.1.10.34356: Flags [P.], seq 2517:2793, ack 266, win 170, options [nop,nop,TS val 1375524938 ecr 1071546], length 276
03:28:00.750973 IP 192.168.1.10.34356 > sea15s01-in-f2.1e100.net.https: Flags [.], ack 2793, win 178, options [nop,nop,TS val 1071550 ecr 1375524938], length 0
03:28:00.846643 IP 192.168.1.10.37939 > sea15s07-in-f10.1e100.net.https: Flags [P.], seq 255:1223, ack 3512, win 199, options [nop,nop,TS val 1071559 ecr 4168150900], length 968
03:28:00.877258 IP 192.168.1.10.34353 > sea15s01-in-f2.1e100.net.https: Flags [P.], seq 181:266, ack 2517, win 157, options [nop,nop,TS val 1071562 ecr 3810449415], length 85
03:28:00.906984 IP sea15s01-in-f2.1e100.net.https > 192.168.1.10.34353: Flags [P.], seq 2517:2793, ack 266, win 170, options [nop,nop,TS val 3810451121 ecr 1071562], length 276
03:28:00.908383 IP 192.168.1.10.34353 > sea15s01-in-f2.1e100.net.https: Flags [.], ack 2793, win 178, options [nop,nop,TS val 1071565 ecr 3810451121], length 0
03:28:00.911288 IP sea15s07-in-f10.1e100.net.https > 192.168.1.10.37939: Flags [P.], seq 3512:4860, ack 1223, win 178, options [nop,nop,TS val 4168151192 ecr 1071559], length 1348
03:28:00.911458 IP sea15s07-in-f10.1e100.net.https > 192.168.1.10.37939: Flags [P.], seq 4860:6208, ack 1223, win 178, options [nop,nop,TS val 4168151192 ecr 1071559], length 1348
03:28:00.912093 IP sea15s07-in-f10.1e100.net.https > 192.168.1.10.37939: Flags [.], seq 6208:7556, ack 1223, win 178, options [nop,nop,TS val 4168151192 ecr 1071559], length 1348
03:28:00.912160 IP sea15s07-in-f10.1e100.net.https > 192.168.1.10.37939: Flags [P.], seq 7556:7798, ack 1223, win 178, options [nop,nop,TS val 4168151192 ecr 1071559], length 242
03:28:00.913104 IP sea15s07-in-f10.1e100.net.https > 192.168.1.10.37939: Flags [P.], seq 7798:9146, ack 1223, win 178, options [nop,nop,TS val 4168151192 ecr 1071559], length 1348
03:28:00.914044 IP sea15s07-in-f10.1e100.net.https > 192.168.1.10.37939: Flags [.], seq 9146:10494, ack 1223, win 178, options [nop,nop,TS val 4168151192 ecr 1071559], length 1348
03:28:00.914124 IP sea15s07-in-f10.1e100.net.https > 192.168.1.10.37939: Flags [P.], seq 10494:11842, ack 1223, win 178, options [nop,nop,TS val 4168151192 ecr 1071559], length 1348
03:28:00.915146 IP 192.168.1.10.37939 > sea15s07-in-f10.1e100.net.https: Flags [.], ack 4860, win 220, options [nop,nop,TS val 1071566 ecr 4168151192], length 0
03:28:00.915174 IP 192.168.1.10.37939 > sea15s07-in-f10.1e100.net.https: Flags [.], ack 6208, win 241, options [nop,nop,TS val 1071566 ecr 4168151192], length 0
03:28:00.915532 IP 192.168.1.10.37939 > sea15s07-in-f10.1e100.net.https: Flags [.], ack 7556, win 262, options [nop,nop,TS val 1071566 ecr 4168151192], length 0
03:28:00.915692 IP sea15s07-in-f10.1e100.net.https > 192.168.1.10.37939: Flags [P.], seq 11842:12098, ack 1223, win 178, options [nop,nop,TS val 4168151192 ecr 1071559], length 256
03:28:00.915881 IP sea15s07-in-f10.1e100.net.https > 192.168.1.10.37939: Flags [P.], seq 12098:13446, ack 1223, win 178, options [nop,nop,TS val 4168151192 ecr 1071559], length 1348
03:28:00.916789 IP sea15s07-in-f10.1e100.net.https > 192.168.1.10.37939: Flags [.], seq 13446:14794, ack 1223, win 178, options [nop,nop,TS val 4168151192 ecr 1071559], length 1348
03:28:00.916878 IP sea15s07-in-f10.1e100.net.https > 192.168.1.10.37939: Flags [P.], seq 14794:16142, ack 1223, win 178, options [nop,nop,TS val 4168151192 ecr 1071559], length 1348
03:28:00.917329 IP 192.168.1.10.37939 > sea15s07-in-f10.1e100.net.https: Flags [.], ack 7798, win 283, options [nop,nop,TS val 1071566 ecr 4168151192], length 0
03:28:00.917343 IP 192.168.1.10.37939 > sea15s07-in-f10.1e100.net.https: Flags [.], ack 9146, win 304, options [nop,nop,TS val 1071566 ecr 4168151192], length 0
03:28:00.917352 IP 192.168.1.10.37939 > sea15s07-in-f10.1e100.net.https: Flags [.], ack 10494, win 325, options [nop,nop,TS val 1071566 ecr 4168151192], length 0
03:28:00.917368 IP 192.168.1.10.37939 > sea15s07-in-f10.1e100.net.https: Flags [.], ack 11842, win 346, options [nop,nop,TS val 1071566 ecr 4168151192], length 0
03:28:00.917906 IP 192.168.1.10.37939 > sea15s07-in-f10.1e100.net.https: Flags [.], ack 12098, win 367, options [nop,nop,TS val 1071566 ecr 4168151192], length 0
03:28:00.917925 IP 192.168.1.10.37939 > sea15s07-in-f10.1e100.net.https: Flags [.], ack 13446, win 388, options [nop,nop,TS val 1071566 ecr 4168151192], length 0
03:28:00.918377 IP 192.168.1.10.37939 > sea15s07-in-f10.1e100.net.https: Flags [.], ack 14794, win 409, options [nop,nop,TS val 1071566 ecr 4168151192], length 0
03:28:00.918533 IP sea15s07-in-f10.1e100.net.https > 192.168.1.10.37939: Flags [.], seq 16142:17490, ack 1223, win 178, options [nop,nop,TS val 4168151193 ecr 1071559], length 1348
03:28:00.918607 IP sea15s07-in-f10.1e100.net.https > 192.168.1.10.37939: Flags [.], seq 17490:18838, ack 1223, win 178, options [nop,nop,TS val 4168151193 ecr 1071559], length 1348
03:28:00.918875 IP 192.168.1.10.37939 > sea15s07-in-f10.1e100.net.https: Flags [.], ack 16142, win 430, options [nop,nop,TS val 1071566 ecr 4168151192], length 0
03:28:00.920134 IP 192.168.1.10.37939 > sea15s07-in-f10.1e100.net.https: Flags [.], ack 17490, win 452, options [nop,nop,TS val 1071566 ecr 4168151193], length 0
03:28:00.920232 IP sea15s07-in-f10.1e100.net.https > 192.168.1.10.37939: Flags [.], seq 18838:20186, ack 1223, win 178, options [nop,nop,TS val 4168151193 ecr 1071559], length 1348
03:28:00.920720 IP 192.168.1.10.37939 > sea15s07-in-f10.1e100.net.https: Flags [.], ack 18838, win 473, options [nop,nop,TS val 1071566 ecr 4168151193], length 0
03:28:00.922211 IP 192.168.1.10.37939 > sea15s07-in-f10.1e100.net.https: Flags [.], ack 20186, win 494, options [nop,nop,TS val 1071567 ecr 4168151193], length 0
03:28:00.946595 IP sea15s07-in-f10.1e100.net.https > 192.168.1.10.37939: Flags [.], seq 20186:21534, ack 1223, win 178, options [nop,nop,TS val 4168151227 ecr 1071566], length 1348
03:28:00.946701 IP sea15s07-in-f10.1e100.net.https > 192.168.1.10.37939: Flags [.], seq 21534:22882, ack 1223, win 178, options [nop,nop,TS val 4168151227 ecr 1071566], length 1348
03:28:00.948055 IP sea15s07-in-f10.1e100.net.https > 192.168.1.10.37939: Flags [.], seq 22882:24230, ack 1223, win 178, options [nop,nop,TS val 4168151227 ecr 1071566], length 1348
03:28:00.948108 IP sea15s07-in-f10.1e100.net.https > 192.168.1.10.37939: Flags [.], seq 24230:25578, ack 1223, win 178, options [nop,nop,TS val 4168151227 ecr 1071566], length 1348
03:28:00.948266 IP 192.168.1.10.37939 > sea15s07-in-f10.1e100.net.https: Flags [.], ack 21534, win 515, options [nop,nop,TS val 1071569 ecr 4168151227], length 0
03:28:00.948477 IP 192.168.1.10.37939 > sea15s07-in-f10.1e100.net.https: Flags [.], ack 22882, win 536, options [nop,nop,TS val 1071569 ecr 4168151227], length 0
03:28:00.949466 IP 192.168.1.10.37939 > sea15s07-in-f10.1e100.net.https: Flags [.], ack 24230, win 557, options [nop,nop,TS val 1071569 ecr 4168151227], length 0
03:28:00.949958 IP 192.168.1.10.37939 > sea15s07-in-f10.1e100.net.https: Flags [.], ack 25578, win 578, options [nop,nop,TS val 1071569 ecr 4168151227], length 0
03:28:00.951096 IP sea15s07-in-f10.1e100.net.https > 192.168.1.10.37939: Flags [.], seq 25578:26926, ack 1223, win 178, options [nop,nop,TS val 4168151228 ecr 1071566], length 1348
03:28:00.951149 IP sea15s07-in-f10.1e100.net.https > 192.168.1.10.37939: Flags [.], seq 26926:28274, ack 1223, win 178, options [nop,nop,TS val 4168151228 ecr 1071566], length 1348
03:28:00.952640 IP 192.168.1.10.37939 > sea15s07-in-f10.1e100.net.https: Flags [.], ack 26926, win 599, options [nop,nop,TS val 1071570 ecr 4168151228], length 0
03:28:00.952977 IP 192.168.1.10.37939 > sea15s07-in-f10.1e100.net.https: Flags [.], ack 28274, win 620, options [nop,nop,TS val 1071570 ecr 4168151228], length 0
03:28:00.953974 IP sea15s07-in-f10.1e100.net.https > 192.168.1.10.37939: Flags [.], seq 28274:29622, ack 1223, win 178, options [nop,nop,TS val 4168151229 ecr 1071566], length 1348
03:28:00.954075 IP sea15s07-in-f10.1e100.net.https > 192.168.1.10.37939: Flags [.], seq 29622:30970, ack 1223, win 178, options [nop,nop,TS val 4168151229 ecr 1071566], length 1348
03:28:00.955514 IP 192.168.1.10.37939 > sea15s07-in-f10.1e100.net.https: Flags [.], ack 29622, win 641, options [nop,nop,TS val 1071570 ecr 4168151229], length 0
03:28:00.955836 IP 192.168.1.10.37939 > sea15s07-in-f10.1e100.net.https: Flags [.], ack 30970, win 662, options [nop,nop,TS val 1071570 ecr 4168151229], length 0
03:28:00.956393 IP sea15s07-in-f10.1e100.net.https > 192.168.1.10.37939: Flags [.], seq 30970:32318, ack 1223, win 178, options [nop,nop,TS val 4168151232 ecr 1071566], length 1348
03:28:00.956491 IP sea15s07-in-f10.1e100.net.https > 192.168.1.10.37939: Flags [.], seq 32318:33666, ack 1223, win 178, options [nop,nop,TS val 4168151232 ecr 1071566], length 1348
03:28:00.956526 IP sea15s07-in-f10.1e100.net.https > 192.168.1.10.37939: Flags [.], seq 33666:35014, ack 1223, win 178, options [nop,nop,TS val 4168151232 ecr 1071566], length 1348
03:28:00.958829 IP sea15s07-in-f10.1e100.net.https > 192.168.1.10.37939: Flags [.], seq 35014:36362, ack 1223, win 178, options [nop,nop,TS val 4168151235 ecr 1071567], length 1348
03:28:00.958932 IP sea15s07-in-f10.1e100.net.https > 192.168.1.10.37939: Flags [.], seq 36362:37710, ack 1223, win 178, options [nop,nop,TS val 4168151235 ecr 1071567], length 1348
03:28:00.961191 IP sea15s07-in-f10.1e100.net.https > 192.168.1.10.37939: Flags [.], seq 37710:39058, ack 1223, win 178, options [nop,nop,TS val 4168151237 ecr 1071567], length 1348
03:28:00.961278 IP sea15s07-in-f10.1e100.net.https > 192.168.1.10.37939: Flags [.], seq 39058:40406, ack 1223, win 178, options [nop,nop,TS val 4168151237 ecr 1071567], length 1348
03:28:00.963627 IP sea15s07-in-f10.1e100.net.https > 192.168.1.10.37939: Flags [.], seq 40406:41754, ack 1223, win 178, options [nop,nop,TS val 4168151240 ecr 1071567], length 1348
03:28:00.963716 IP sea15s07-in-f10.1e100.net.https > 192.168.1.10.37939: Flags [.], seq 41754:43102, ack 1223, win 178, options [nop,nop,TS val 4168151240 ecr 1071567], length 1348
03:28:00.966037 IP sea15s07-in-f10.1e100.net.https > 192.168.1.10.37939: Flags [.], seq 43102:44450, ack 1223, win 178, options [nop,nop,TS val 4168151242 ecr 1071567], length 1348
03:28:00.966126 IP sea15s07-in-f10.1e100.net.https > 192.168.1.10.37939: Flags [.], seq 44450:45798, ack 1223, win 178, options [nop,nop,TS val 4168151242 ecr 1071567], length 1348
03:28:00.966160 IP sea15s07-in-f10.1e100.net.https > 192.168.1.10.37939: Flags [.], seq 45798:47146, ack 1223, win 178, options [nop,nop,TS val 4168151242 ecr 1071567], length 1348
03:28:00.968390 IP sea15s07-in-f10.1e100.net.https > 192.168.1.10.37939: Flags [.], seq 47146:48494, ack 1223, win 178, options [nop,nop,TS val 4168151244 ecr 1071567], length 1348
03:28:00.968473 IP sea15s07-in-f10.1e100.net.https > 192.168.1.10.37939: Flags [.], seq 48494:49842, ack 1223, win 178, options [nop,nop,TS val 4168151244 ecr 1071567], length 1348
03:28:00.970776 IP sea15s07-in-f10.1e100.net.https > 192.168.1.10.37939: Flags [.], seq 49842:51190, ack 1223, win 178, options [nop,nop,TS val 4168151247 ecr 1071567], length 1348
03:28:00.970898 IP sea15s07-in-f10.1e100.net.https > 192.168.1.10.37939: Flags [.], seq 51190:52538, ack 1223, win 178, options [nop,nop,TS val 4168151247 ecr 1071567], length 1348
03:28:00.973188 IP sea15s07-in-f10.1e100.net.https > 192.168.1.10.37939: Flags [.], seq 52538:53886, ack 1223, win 178, options [nop,nop,TS val 4168151249 ecr 1071567], length 1348
03:28:00.973234 IP sea15s07-in-f10.1e100.net.https > 192.168.1.10.37939: Flags [.], seq 53886:55234, ack 1223, win 178, options [nop,nop,TS val 4168151249 ecr 1071567], length 1348
03:28:00.973988 IP sea15s07-in-f10.1e100.net.https > 192.168.1.10.37939: Flags [.], seq 55234:56582, ack 1223, win 178, options [nop,nop,TS val 4168151252 ecr 1071567], length 1348
03:28:00.976029 IP 192.168.1.10.37939 > sea15s07-in-f10.1e100.net.https: Flags [.], ack 32318, win 683, options [nop,nop,TS val 1071571 ecr 4168151232], length 0
03:28:00.976046 IP 192.168.1.10.37939 > sea15s07-in-f10.1e100.net.https: Flags [.], ack 33666, win 704, options [nop,nop,TS val 1071571 ecr 4168151232], length 0
03:28:00.976056 IP 192.168.1.10.37939 > sea15s07-in-f10.1e100.net.https: Flags [.], ack 35014, win 725, options [nop,nop,TS val 1071571 ecr 4168151232], length 0
03:28:00.976067 IP 192.168.1.10.37939 > sea15s07-in-f10.1e100.net.https: Flags [.], ack 36362, win 746, options [nop,nop,TS val 1071572 ecr 4168151235], length 0
03:28:00.976076 IP 192.168.1.10.37939 > sea15s07-in-f10.1e100.net.https: Flags [.], ack 37710, win 767, options [nop,nop,TS val 1071572 ecr 4168151235], length 0
03:28:00.976085 IP 192.168.1.10.37939 > sea15s07-in-f10.1e100.net.https: Flags [.], ack 39058, win 789, options [nop,nop,TS val 1071572 ecr 4168151237], length 0
03:28:00.976094 IP 192.168.1.10.37939 > sea15s07-in-f10.1e100.net.https: Flags [.], ack 40406, win 810, options [nop,nop,TS val 1071572 ecr 4168151237], length 0
03:28:00.976103 IP 192.168.1.10.37939 > sea15s07-in-f10.1e100.net.https: Flags [.], ack 41754, win 831, options [nop,nop,TS val 1071572 ecr 4168151240], length 0
03:28:00.976113 IP 192.168.1.10.37939 > sea15s07-in-f10.1e100.net.https: Flags [.], ack 43102, win 852, options [nop,nop,TS val 1071572 ecr 4168151240], length 0
03:28:00.976122 IP 192.168.1.10.37939 > sea15s07-in-f10.1e100.net.https: Flags [.], ack 44450, win 873, options [nop,nop,TS val 1071572 ecr 4168151242], length 0
03:28:00.976131 IP 192.168.1.10.37939 > sea15s07-in-f10.1e100.net.https: Flags [.], ack 45798, win 894, options [nop,nop,TS val 1071572 ecr 4168151242], length 0
03:28:00.976140 IP 192.168.1.10.37939 > sea15s07-in-f10.1e100.net.https: Flags [.], ack 47146, win 915, options [nop,nop,TS val 1071572 ecr 4168151242], length 0
03:28:00.976148 IP 192.168.1.10.37939 > sea15s07-in-f10.1e100.net.https: Flags [.], ack 48494, win 936, options [nop,nop,TS val 1071572 ecr 4168151244], length 0
03:28:00.976158 IP 192.168.1.10.37939 > sea15s07-in-f10.1e100.net.https: Flags [.], ack 49842, win 957, options [nop,nop,TS val 1071572 ecr 4168151244], length 0
03:28:00.976167 IP 192.168.1.10.37939 > sea15s07-in-f10.1e100.net.https: Flags [.], ack 51190, win 978, options [nop,nop,TS val 1071572 ecr 4168151247], length 0
03:28:00.976176 IP 192.168.1.10.37939 > sea15s07-in-f10.1e100.net.https: Flags [.], ack 52538, win 999, options [nop,nop,TS val 1071572 ecr 4168151247], length 0
03:28:00.976186 IP 192.168.1.10.37939 > sea15s07-in-f10.1e100.net.https: Flags [.], ack 53886, win 1020, options [nop,nop,TS val 1071572 ecr 4168151249], length 0
03:28:00.976204 IP 192.168.1.10.37939 > sea15s07-in-f10.1e100.net.https: Flags [.], ack 55234, win 1041, options [nop,nop,TS val 1071572 ecr 4168151249], length 0
03:28:00.976216 IP 192.168.1.10.37939 > sea15s07-in-f10.1e100.net.https: Flags [.], ack 56582, win 1062, options [nop,nop,TS val 1071572 ecr 4168151252], length 0
03:28:00.979644 IP sea15s07-in-f10.1e100.net.https > 192.168.1.10.37939: Flags [.], seq 56582:57930, ack 1223, win 178, options [nop,nop,TS val 4168151260 ecr 1071569], length 1348
03:28:00.979736 IP sea15s07-in-f10.1e100.net.https > 192.168.1.10.37939: Flags [.], seq 57930:59278, ack 1223, win 178, options [nop,nop,TS val 4168151260 ecr 1071569], length 1348
03:28:00.980598 IP sea15s07-in-f10.1e100.net.https > 192.168.1.10.37939: Flags [.], seq 59278:60626, ack 1223, win 178, options [nop,nop,TS val 4168151260 ecr 1071569], length 1348
03:28:00.980679 IP sea15s07-in-f10.1e100.net.https > 192.168.1.10.37939: Flags [.], seq 60626:61974, ack 1223, win 178, options [nop,nop,TS val 4168151260 ecr 1071569], length 1348
03:28:00.981774 IP 192.168.1.10.37939 > sea15s07-in-f10.1e100.net.https: Flags [.], ack 57930, win 1083, options [nop,nop,TS val 1071573 ecr 4168151260], length 0
03:28:00.981788 IP 192.168.1.10.37939 > sea15s07-in-f10.1e100.net.https: Flags [.], ack 59278, win 1104, options [nop,nop,TS val 1071573 ecr 4168151260], length 0
03:28:00.981806 IP 192.168.1.10.37939 > sea15s07-in-f10.1e100.net.https: Flags [.], ack 60626, win 1126, options [nop,nop,TS val 1071573 ecr 4168151260], length 0
03:28:00.982113 IP 192.168.1.10.37939 > sea15s07-in-f10.1e100.net.https: Flags [.], ack 61974, win 1147, options [nop,nop,TS val 1071573 ecr 4168151260], length 0
03:28:00.982501 IP sea15s07-in-f10.1e100.net.https > 192.168.1.10.37939: Flags [.], seq 61974:63322, ack 1223, win 178, options [nop,nop,TS val 4168151261 ecr 1071569], length 1348
03:28:00.982569 IP sea15s07-in-f10.1e100.net.https > 192.168.1.10.37939: Flags [.], seq 63322:64670, ack 1223, win 178, options [nop,nop,TS val 4168151261 ecr 1071569], length 1348
03:28:00.983836 IP sea15s07-in-f10.1e100.net.https > 192.168.1.10.37939: Flags [.], seq 64670:66018, ack 1223, win 178, options [nop,nop,TS val 4168151262 ecr 1071569], length 1348
03:28:00.983883 IP sea15s07-in-f10.1e100.net.https > 192.168.1.10.37939: Flags [.], seq 66018:67366, ack 1223, win 178, options [nop,nop,TS val 4168151262 ecr 1071569], length 1348
03:28:00.984109 IP 192.168.1.10.37939 > sea15s07-in-f10.1e100.net.https: Flags [.], ack 63322, win 1168, options [nop,nop,TS val 1071573 ecr 4168151261], length 0
03:28:00.984341 IP 192.168.1.10.37939 > sea15s07-in-f10.1e100.net.https: Flags [.], ack 64670, win 1189, options [nop,nop,TS val 1071573 ecr 4168151261], length 0
03:28:00.985224 IP 192.168.1.10.37939 > sea15s07-in-f10.1e100.net.https: Flags [.], ack 66018, win 1210, options [nop,nop,TS val 1071573 ecr 4168151262], length 0
03:28:00.985460 IP 192.168.1.10.37939 > sea15s07-in-f10.1e100.net.https: Flags [.], ack 67366, win 1231, options [nop,nop,TS val 1071573 ecr 4168151262], length 0
03:28:00.985545 IP sea15s07-in-f10.1e100.net.https > 192.168.1.10.37939: Flags [.], seq 67366:68714, ack 1223, win 178, options [nop,nop,TS val 4168151263 ecr 1071569], length 1348
03:28:00.986422 IP sea15s07-in-f10.1e100.net.https > 192.168.1.10.37939: Flags [.], seq 68714:70062, ack 1223, win 178, options [nop,nop,TS val 4168151265 ecr 1071570], length 1348
03:28:00.986471 IP sea15s07-in-f10.1e100.net.https > 192.168.1.10.37939: Flags [.], seq 70062:71410, ack 1223, win 178, options [nop,nop,TS val 4168151265 ecr 1071570], length 1348
03:28:00.986956 IP 192.168.1.10.37939 > sea15s07-in-f10.1e100.net.https: Flags [.], ack 68714, win 1252, options [nop,nop,TS val 1071573 ecr 4168151263], length 0
03:28:00.987842 IP 192.168.1.10.37939 > sea15s07-in-f10.1e100.net.https: Flags [.], ack 70062, win 1273, options [nop,nop,TS val 1071573 ecr 4168151265], length 0
03:28:00.988079 IP 192.168.1.10.37939 > sea15s07-in-f10.1e100.net.https: Flags [.], ack 71410, win 1294, options [nop,nop,TS val 1071573 ecr 4168151265], length 0
03:28:00.988181 IP sea15s07-in-f10.1e100.net.https > 192.168.1.10.37939: Flags [.], seq 71410:72758, ack 1223, win 178, options [nop,nop,TS val 4168151265 ecr 1071570], length 1348
03:28:00.988226 IP sea15s07-in-f10.1e100.net.https > 192.168.1.10.37939: Flags [.], seq 72758:74106, ack 1223, win 178, options [nop,nop,TS val 4168151265 ecr 1071570], length 1348
03:28:00.989608 IP 192.168.1.10.37939 > sea15s07-in-f10.1e100.net.https: Flags [.], ack 72758, win 1315, options [nop,nop,TS val 1071573 ecr 4168151265], length 0
03:28:00.989894 IP sea15s07-in-f10.1e100.net.https > 192.168.1.10.37939: Flags [.], seq 74106:75454, ack 1223, win 178, options [nop,nop,TS val 4168151268 ecr 1071570], length 1348
03:28:00.989959 IP sea15s07-in-f10.1e100.net.https > 192.168.1.10.37939: Flags [.], seq 75454:76802, ack 1223, win 178, options [nop,nop,TS val 4168151268 ecr 1071570], length 1348
03:28:00.989851 IP 192.168.1.10.37939 > sea15s07-in-f10.1e100.net.https: Flags [.], ack 74106, win 1336, options [nop,nop,TS val 1071573 ecr 4168151265], length 0
03:28:00.991469 IP 192.168.1.10.37939 > sea15s07-in-f10.1e100.net.https: Flags [.], ack 75454, win 1357, options [nop,nop,TS val 1071574 ecr 4168151268], length 0
03:28:00.991599 IP sea15s07-in-f10.1e100.net.https > 192.168.1.10.37939: Flags [.], seq 76802:78150, ack 1223, win 178, options [nop,nop,TS val 4168151269 ecr 1071570], length 1348
03:28:00.991644 IP sea15s07-in-f10.1e100.net.https > 192.168.1.10.37939: Flags [.], seq 78150:79498, ack 1223, win 178, options [nop,nop,TS val 4168151269 ecr 1071570], length 1348
03:28:00.991724 IP 192.168.1.10.37939 > sea15s07-in-f10.1e100.net.https: Flags [.], ack 76802, win 1378, options [nop,nop,TS val 1071574 ecr 4168151268], length 0
03:28:01.003218 IP 192.168.1.10.57721 > sea15s07-in-f67.1e100.net.https: Flags [P.], seq 165:250, ack 4138, win 178, options [nop,nop,TS val 1071574 ecr 539319727], length 85
03:28:01.007660 IP sea15s07-in-f10.1e100.net.https > 192.168.1.10.37939: Flags [.], seq 79498:80846, ack 1223, win 178, options [nop,nop,TS val 4168151288 ecr 1071571], length 1348
03:28:01.008754 IP sea15s07-in-f10.1e100.net.https > 192.168.1.10.37939: Flags [.], seq 80846:82194, ack 1223, win 178, options [nop,nop,TS val 4168151289 ecr 1071571], length 1348
03:28:01.008846 IP sea15s07-in-f10.1e100.net.https > 192.168.1.10.37939: Flags [.], seq 82194:83542, ack 1223, win 178, options [nop,nop,TS val 4168151289 ecr 1071571], length 1348
03:28:01.010327 IP sea15s07-in-f10.1e100.net.https > 192.168.1.10.37939: Flags [.], seq 83542:84890, ack 1223, win 178, options [nop,nop,TS val 4168151289 ecr 1071571], length 1348
03:28:01.010412 IP sea15s07-in-f10.1e100.net.https > 192.168.1.10.37939: Flags [.], seq 84890:86238, ack 1223, win 178, options [nop,nop,TS val 4168151289 ecr 1071571], length 1348
03:28:01.011233 IP sea15s07-in-f10.1e100.net.https > 192.168.1.10.37939: Flags [.], seq 86238:87586, ack 1223, win 178, options [nop,nop,TS val 4168151289 ecr 1071572], length 1348
03:28:01.011287 IP sea15s07-in-f10.1e100.net.https > 192.168.1.10.37939: Flags [.], seq 87586:88934, ack 1223, win 178, options [nop,nop,TS val 4168151289 ecr 1071572], length 1348
03:28:01.013007 IP sea15s07-in-f10.1e100.net.https > 192.168.1.10.37939: Flags [.], seq 88934:90282, ack 1223, win 178, options [nop,nop,TS val 4168151291 ecr 1071572], length 1348
03:28:01.013113 IP sea15s07-in-f10.1e100.net.https > 192.168.1.10.37939: Flags [.], seq 90282:91630, ack 1223, win 178, options [nop,nop,TS val 4168151291 ecr 1071572], length 1348
03:28:01.013227 IP 192.168.1.10.37939 > sea15s07-in-f10.1e100.net.https: Flags [.], ack 78150, win 1399, options [nop,nop,TS val 1071576 ecr 4168151269], length 0
03:28:01.013244 IP 192.168.1.10.37939 > sea15s07-in-f10.1e100.net.https: Flags [.], ack 79498, win 1420, options [nop,nop,TS val 1071576 ecr 4168151269], length 0
03:28:01.013254 IP 192.168.1.10.37939 > sea15s07-in-f10.1e100.net.https: Flags [.], ack 80846, win 1441, options [nop,nop,TS val 1071576 ecr 4168151288], length 0
03:28:01.013264 IP 192.168.1.10.37939 > sea15s07-in-f10.1e100.net.https: Flags [.], ack 82194, win 1463, options [nop,nop,TS val 1071576 ecr 4168151289], length 0
03:28:01.013273 IP 192.168.1.10.37939 > sea15s07-in-f10.1e100.net.https: Flags [.], ack 83542, win 1484, options [nop,nop,TS val 1071576 ecr 4168151289], length 0
03:28:01.013283 IP 192.168.1.10.37939 > sea15s07-in-f10.1e100.net.https: Flags [.], ack 84890, win 1505, options [nop,nop,TS val 1071576 ecr 4168151289], length 0
