tcpdump: verbose output suppressed, use -v or -vv for full protocol decode
listening on wlan0, link-type EN10MB (Ethernet), capture size 262144 bytes
03:28:45.556613 IP 192.168.1.10.49690 > sea15s07-in-f14.1e100.net.www: Flags [S], seq 2648153837, win 14600, options [mss 1460,sackOK,TS val 115007 ecr 0,nop,wscale 7], length 0
03:28:45.565403 IP sea15s07-in-f14.1e100.net.www > 192.168.1.10.49690: Flags [S.], seq 2797329947, ack 2648153838, win 26960, options [mss 1360,sackOK,TS val 634946430 ecr 115007,nop,wscale 7], length 0
03:28:45.571098 IP 192.168.1.10.49690 > sea15s07-in-f14.1e100.net.www: Flags [.], ack 1, win 115, options [nop,nop,TS val 115009 ecr 634946430], length 0
03:28:45.588746 IP 192.168.1.10.49690 > sea15s07-in-f14.1e100.net.www: Flags [P.], seq 1:175, ack 1, win 115, options [nop,nop,TS val 115011 ecr 634946430], length 174: HTTP: GET /generate_204 HTTP/1.1
03:28:45.597392 IP sea15s07-in-f14.1e100.net.www > 192.168.1.10.49690: Flags [.], ack 175, win 219, options [nop,nop,TS val 634946438 ecr 115011], length 0
03:28:45.647101 IP sea15s07-in-f14.1e100.net.www > 192.168.1.10.49690: Flags [P.], seq 1:224, ack 175, win 219, options [nop,nop,TS val 634946451 ecr 115011], length 223: HTTP: HTTP/1.1 204 No Content
03:28:45.652849 IP 192.168.1.10.49690 > sea15s07-in-f14.1e100.net.www: Flags [.], ack 224, win 123, options [nop,nop,TS val 115017 ecr 634946451], length 0
03:28:52.086763 IP 192.168.1.10.57560 > sea15s01-in-f130.1e100.net.https: Flags [S], seq 1567631914, win 14600, options [mss 1460,sackOK,TS val 115660 ecr 0,nop,wscale 7], length 0
03:28:52.107385 IP 192.168.1.10.57561 > sea15s01-in-f130.1e100.net.https: Flags [S], seq 940474108, win 14600, options [mss 1460,sackOK,TS val 115661 ecr 0,nop,wscale 7], length 0
03:28:52.118193 IP sea15s01-in-f130.1e100.net.https > 192.168.1.10.57560: Flags [S.], seq 4108261631, ack 1567631915, win 42408, options [mss 1360,sackOK,TS val 43203012 ecr 115660,nop,wscale 8], length 0
03:28:52.123876 IP 192.168.1.10.57560 > sea15s01-in-f130.1e100.net.https: Flags [.], ack 1, win 115, options [nop,nop,TS val 115664 ecr 43203012], length 0
03:28:52.139865 IP sea15s01-in-f130.1e100.net.https > 192.168.1.10.57561: Flags [S.], seq 1695210409, ack 940474109, win 42408, options [mss 1360,sackOK,TS val 3888796265 ecr 115661,nop,wscale 8], length 0
03:28:52.158140 IP 192.168.1.10.57561 > sea15s01-in-f130.1e100.net.https: Flags [.], ack 1, win 115, options [nop,nop,TS val 115667 ecr 3888796265], length 0
03:28:52.312039 IP 192.168.1.10.57560 > sea15s01-in-f130.1e100.net.https: Flags [P.], seq 1:181, ack 1, win 115, options [nop,nop,TS val 115683 ecr 43203012], length 180
03:28:52.342779 IP 192.168.1.10.57561 > sea15s01-in-f130.1e100.net.https: Flags [P.], seq 1:181, ack 1, win 115, options [nop,nop,TS val 115686 ecr 3888796265], length 180
03:28:52.343316 IP sea15s01-in-f130.1e100.net.https > 192.168.1.10.57560: Flags [.], ack 181, win 170, options [nop,nop,TS val 43203237 ecr 115683], length 0
03:28:52.351176 IP sea15s01-in-f130.1e100.net.https > 192.168.1.10.57560: Flags [.], seq 1:1349, ack 181, win 170, options [nop,nop,TS val 43203245 ecr 115683], length 1348
03:28:52.351229 IP sea15s01-in-f130.1e100.net.https > 192.168.1.10.57560: Flags [P.], seq 1349:2517, ack 181, win 170, options [nop,nop,TS val 43203245 ecr 115683], length 1168
03:28:52.360415 IP 192.168.1.10.57560 > sea15s01-in-f130.1e100.net.https: Flags [.], ack 1349, win 136, options [nop,nop,TS val 115688 ecr 43203245], length 0
03:28:52.360433 IP 192.168.1.10.57560 > sea15s01-in-f130.1e100.net.https: Flags [.], ack 2517, win 157, options [nop,nop,TS val 115688 ecr 43203245], length 0
03:28:52.375311 IP sea15s01-in-f130.1e100.net.https > 192.168.1.10.57561: Flags [.], ack 181, win 170, options [nop,nop,TS val 3888796501 ecr 115686], length 0
03:28:52.382808 IP sea15s01-in-f130.1e100.net.https > 192.168.1.10.57561: Flags [.], seq 1:1349, ack 181, win 170, options [nop,nop,TS val 3888796508 ecr 115686], length 1348
03:28:52.382907 IP sea15s01-in-f130.1e100.net.https > 192.168.1.10.57561: Flags [P.], seq 1349:2517, ack 181, win 170, options [nop,nop,TS val 3888796508 ecr 115686], length 1168
03:28:52.388855 IP 192.168.1.10.57561 > sea15s01-in-f130.1e100.net.https: Flags [.], ack 1349, win 136, options [nop,nop,TS val 115691 ecr 3888796508], length 0
03:28:52.388874 IP 192.168.1.10.57561 > sea15s01-in-f130.1e100.net.https: Flags [.], ack 2517, win 157, options [nop,nop,TS val 115691 ecr 3888796508], length 0
03:28:53.015986 IP 192.168.1.10.54450 > sea15s07-in-f67.1e100.net.https: Flags [S], seq 403190540, win 14600, options [mss 1460,sackOK,TS val 115753 ecr 0,nop,wscale 7], length 0
03:28:53.048415 IP sea15s07-in-f67.1e100.net.https > 192.168.1.10.54450: Flags [S.], seq 3298786885, ack 403190541, win 42408, options [mss 1360,sackOK,TS val 1481303606 ecr 115753,nop,wscale 8], length 0
03:28:53.080115 IP 192.168.1.10.54450 > sea15s07-in-f67.1e100.net.https: Flags [.], ack 1, win 115, options [nop,nop,TS val 115760 ecr 1481303606], length 0
03:28:53.346135 IP 192.168.1.10.58328 > ph-in-f188.1e100.net.5228: Flags [S], seq 2835460821, win 14600, options [mss 1460,sackOK,TS val 115786 ecr 0,nop,wscale 7], length 0
03:28:53.369208 IP ph-in-f188.1e100.net.5228 > 192.168.1.10.58328: Flags [S.], seq 698838901, ack 2835460822, win 42408, options [mss 1360,sackOK,TS val 4177209690 ecr 115786,nop,wscale 8], length 0
03:28:53.384713 IP 192.168.1.10.58328 > ph-in-f188.1e100.net.5228: Flags [.], ack 1, win 115, options [nop,nop,TS val 115790 ecr 4177209690], length 0
03:28:53.395557 IP 192.168.1.10.57761 > sea15s01-in-f138.1e100.net.https: Flags [S], seq 4235215770, win 14600, options [mss 1460,sackOK,TS val 115791 ecr 0,nop,wscale 7], length 0
03:28:53.399943 IP 192.168.1.10.58328 > ph-in-f188.1e100.net.5228: Flags [P.], seq 1:169, ack 1, win 115, options [nop,nop,TS val 115792 ecr 4177209690], length 168
03:28:53.423078 IP ph-in-f188.1e100.net.5228 > 192.168.1.10.58328: Flags [.], ack 169, win 170, options [nop,nop,TS val 4177209744 ecr 115792], length 0
03:28:53.423484 IP ph-in-f188.1e100.net.5228 > 192.168.1.10.58328: Flags [.], seq 1:1349, ack 169, win 170, options [nop,nop,TS val 4177209745 ecr 115792], length 1348
03:28:53.423542 IP ph-in-f188.1e100.net.5228 > 192.168.1.10.58328: Flags [.], seq 1349:2697, ack 169, win 170, options [nop,nop,TS val 4177209745 ecr 115792], length 1348
03:28:53.423573 IP ph-in-f188.1e100.net.5228 > 192.168.1.10.58328: Flags [.], seq 2697:4045, ack 169, win 170, options [nop,nop,TS val 4177209745 ecr 115792], length 1348
03:28:53.423603 IP ph-in-f188.1e100.net.5228 > 192.168.1.10.58328: Flags [P.], seq 4045:4112, ack 169, win 170, options [nop,nop,TS val 4177209745 ecr 115792], length 67
03:28:53.426125 IP sea15s01-in-f138.1e100.net.https > 192.168.1.10.57761: Flags [S.], seq 1109331236, ack 4235215771, win 42408, options [mss 1360,sackOK,TS val 2448697420 ecr 115791,nop,wscale 8], length 0
03:28:53.430014 IP 192.168.1.10.58328 > ph-in-f188.1e100.net.5228: Flags [.], ack 1349, win 136, options [nop,nop,TS val 115795 ecr 4177209745], length 0
03:28:53.430033 IP 192.168.1.10.58328 > ph-in-f188.1e100.net.5228: Flags [.], ack 2697, win 157, options [nop,nop,TS val 115795 ecr 4177209745], length 0
03:28:53.430044 IP 192.168.1.10.58328 > ph-in-f188.1e100.net.5228: Flags [.], ack 4045, win 178, options [nop,nop,TS val 115795 ecr 4177209745], length 0
03:28:53.430055 IP 192.168.1.10.58328 > ph-in-f188.1e100.net.5228: Flags [.], ack 4112, win 178, options [nop,nop,TS val 115795 ecr 4177209745], length 0
03:28:53.430065 IP 192.168.1.10.57761 > sea15s01-in-f138.1e100.net.https: Flags [.], ack 1, win 115, options [nop,nop,TS val 115795 ecr 2448697420], length 0
03:28:53.618577 IP 192.168.1.10.58328 > ph-in-f188.1e100.net.5228: Flags [P.], seq 169:254, ack 4112, win 178, options [nop,nop,TS val 115813 ecr 4177209745], length 85
03:28:53.637305 IP 192.168.1.10.57761 > sea15s01-in-f138.1e100.net.https: Flags [P.], seq 1:170, ack 1, win 115, options [nop,nop,TS val 115815 ecr 2448697420], length 169
03:28:53.641739 IP ph-in-f188.1e100.net.5228 > 192.168.1.10.58328: Flags [P.], seq 4112:4388, ack 254, win 170, options [nop,nop,TS val 4177209963 ecr 115813], length 276
03:28:53.647834 IP 192.168.1.10.58328 > ph-in-f188.1e100.net.5228: Flags [.], ack 4388, win 199, options [nop,nop,TS val 115816 ecr 4177209963], length 0
03:28:53.667674 IP sea15s01-in-f138.1e100.net.https > 192.168.1.10.57761: Flags [.], ack 170, win 170, options [nop,nop,TS val 2448697662 ecr 115815], length 0
03:28:53.676968 IP sea15s01-in-f138.1e100.net.https > 192.168.1.10.57761: Flags [P.], seq 2697:3236, ack 170, win 170, options [nop,nop,TS val 2448697671 ecr 115815], length 539
03:28:53.677145 IP sea15s01-in-f138.1e100.net.https > 192.168.1.10.57761: Flags [.], seq 1:1349, ack 170, win 170, options [nop,nop,TS val 2448697671 ecr 115815], length 1348
03:28:53.677212 IP sea15s01-in-f138.1e100.net.https > 192.168.1.10.57761: Flags [.], seq 1349:2697, ack 170, win 170, options [nop,nop,TS val 2448697671 ecr 115815], length 1348
03:28:53.691583 IP 192.168.1.10.57761 > sea15s01-in-f138.1e100.net.https: Flags [.], ack 1, win 115, options [nop,nop,TS val 115821 ecr 2448697662,nop,nop,sack 1 {2697:3236}], length 0
03:28:53.691601 IP 192.168.1.10.57761 > sea15s01-in-f138.1e100.net.https: Flags [.], ack 1349, win 136, options [nop,nop,TS val 115821 ecr 2448697671,nop,nop,sack 1 {2697:3236}], length 0
03:28:53.691612 IP 192.168.1.10.57761 > sea15s01-in-f138.1e100.net.https: Flags [.], ack 3236, win 157, options [nop,nop,TS val 115821 ecr 2448697671], length 0
03:28:53.818443 IP 192.168.1.10.54450 > sea15s07-in-f67.1e100.net.https: Flags [P.], seq 1:165, ack 1, win 115, options [nop,nop,TS val 115834 ecr 1481303606], length 164
03:28:53.850988 IP sea15s07-in-f67.1e100.net.https > 192.168.1.10.54450: Flags [.], ack 165, win 170, options [nop,nop,TS val 1481304408 ecr 115834], length 0
03:28:53.859040 IP sea15s07-in-f67.1e100.net.https > 192.168.1.10.54450: Flags [.], seq 1:1349, ack 165, win 170, options [nop,nop,TS val 1481304416 ecr 115834], length 1348
03:28:53.859156 IP sea15s07-in-f67.1e100.net.https > 192.168.1.10.54450: Flags [.], seq 1349:2697, ack 165, win 170, options [nop,nop,TS val 1481304416 ecr 115834], length 1348
03:28:53.859195 IP sea15s07-in-f67.1e100.net.https > 192.168.1.10.54450: Flags [.], seq 2697:4045, ack 165, win 170, options [nop,nop,TS val 1481304416 ecr 115834], length 1348
03:28:53.859224 IP sea15s07-in-f67.1e100.net.https > 192.168.1.10.54450: Flags [P.], seq 4045:4138, ack 165, win 170, options [nop,nop,TS val 1481304416 ecr 115834], length 93
03:28:53.865468 IP 192.168.1.10.54450 > sea15s07-in-f67.1e100.net.https: Flags [.], ack 1349, win 136, options [nop,nop,TS val 115838 ecr 1481304416], length 0
03:28:53.865487 IP 192.168.1.10.54450 > sea15s07-in-f67.1e100.net.https: Flags [.], ack 2697, win 157, options [nop,nop,TS val 115838 ecr 1481304416], length 0
03:28:53.865497 IP 192.168.1.10.54450 > sea15s07-in-f67.1e100.net.https: Flags [.], ack 4045, win 178, options [nop,nop,TS val 115838 ecr 1481304416], length 0
03:28:53.865509 IP 192.168.1.10.54450 > sea15s07-in-f67.1e100.net.https: Flags [.], ack 4138, win 178, options [nop,nop,TS val 115838 ecr 1481304416], length 0
03:28:53.909614 IP 192.168.1.10.58328 > ph-in-f188.1e100.net.5228: Flags [P.], seq 254:499, ack 4388, win 199, options [nop,nop,TS val 115843 ecr 4177209963], length 245
03:28:53.933276 IP ph-in-f188.1e100.net.5228 > 192.168.1.10.58328: Flags [P.], seq 4388:4410, ack 499, win 175, options [nop,nop,TS val 4177210254 ecr 115843], length 22
03:28:53.936230 IP ph-in-f188.1e100.net.5228 > 192.168.1.10.58328: Flags [P.], seq 4410:4516, ack 499, win 175, options [nop,nop,TS val 4177210257 ecr 115843], length 106
03:28:53.938884 IP ph-in-f188.1e100.net.5228 > 192.168.1.10.58328: Flags [P.], seq 4516:4633, ack 499, win 175, options [nop,nop,TS val 4177210260 ecr 115843], length 117
03:28:53.939125 IP 192.168.1.10.58328 > ph-in-f188.1e100.net.5228: Flags [.], ack 4410, win 199, options [nop,nop,TS val 115846 ecr 4177210254], length 0
03:28:53.939144 IP 192.168.1.10.58328 > ph-in-f188.1e100.net.5228: Flags [.], ack 4516, win 199, options [nop,nop,TS val 115846 ecr 4177210257], length 0
03:28:53.943305 IP 192.168.1.10.58328 > ph-in-f188.1e100.net.5228: Flags [.], ack 4633, win 199, options [nop,nop,TS val 115846 ecr 4177210260], length 0
03:28:54.104587 IP 192.168.1.10.57761 > sea15s01-in-f138.1e100.net.https: Flags [P.], seq 170:255, ack 3236, win 157, options [nop,nop,TS val 115862 ecr 2448697671], length 85
03:28:54.135500 IP sea15s01-in-f138.1e100.net.https > 192.168.1.10.57761: Flags [P.], seq 3236:3512, ack 255, win 170, options [nop,nop,TS val 2448698130 ecr 115862], length 276
03:28:54.141082 IP 192.168.1.10.57761 > sea15s01-in-f138.1e100.net.https: Flags [.], ack 3512, win 178, options [nop,nop,TS val 115866 ecr 2448698130], length 0
03:28:54.233015 IP 192.168.1.10.39926 > sea15s07-in-f10.1e100.net.https: Flags [S], seq 786042121, win 14600, options [mss 1460,sackOK,TS val 115875 ecr 0,nop,wscale 7], length 0
03:28:54.249434 IP 192.168.1.10.38008 > sea15s11-in-f170.1e100.net.https: Flags [S], seq 4243878319, win 14600, options [mss 1460,sackOK,TS val 115877 ecr 0,nop,wscale 7], length 0
03:28:54.264239 IP 192.168.1.10.57761 > sea15s01-in-f138.1e100.net.https: Flags [P.], seq 255:1260, ack 3512, win 178, options [nop,nop,TS val 115878 ecr 2448698130], length 1005
03:28:54.264692 IP sea15s07-in-f10.1e100.net.https > 192.168.1.10.39926: Flags [S.], seq 3339467008, ack 786042122, win 42408, options [mss 1360,sackOK,TS val 2780944559 ecr 115875,nop,wscale 8], length 0
03:28:54.268682 IP 192.168.1.10.39926 > sea15s07-in-f10.1e100.net.https: Flags [.], ack 1, win 115, options [nop,nop,TS val 115879 ecr 2780944559], length 0
03:28:54.272928 IP 192.168.1.10.39926 > sea15s07-in-f10.1e100.net.https: Flags [P.], seq 1:208, ack 1, win 115, options [nop,nop,TS val 115879 ecr 2780944559], length 207
03:28:54.280611 IP sea15s11-in-f170.1e100.net.https > 192.168.1.10.38008: Flags [S.], seq 544909073, ack 4243878320, win 42408, options [mss 1360,sackOK,TS val 2526994842 ecr 115877,nop,wscale 8], length 0
03:28:54.286232 IP 192.168.1.10.38008 > sea15s11-in-f170.1e100.net.https: Flags [.], ack 1, win 115, options [nop,nop,TS val 115880 ecr 2526994842], length 0
03:28:54.290604 IP 192.168.1.10.38008 > sea15s11-in-f170.1e100.net.https: Flags [P.], seq 1:174, ack 1, win 115, options [nop,nop,TS val 115881 ecr 2526994842], length 173
03:28:54.304229 IP sea15s07-in-f10.1e100.net.https > 192.168.1.10.39926: Flags [.], ack 208, win 170, options [nop,nop,TS val 2780944598 ecr 115879], length 0
03:28:54.311689 IP sea15s07-in-f10.1e100.net.https > 192.168.1.10.39926: Flags [.], seq 1:1349, ack 208, win 170, options [nop,nop,TS val 2780944606 ecr 115879], length 1348
03:28:54.311750 IP sea15s07-in-f10.1e100.net.https > 192.168.1.10.39926: Flags [.], seq 1349:2697, ack 208, win 170, options [nop,nop,TS val 2780944606 ecr 115879], length 1348
03:28:54.311782 IP sea15s07-in-f10.1e100.net.https > 192.168.1.10.39926: Flags [P.], seq 2697:3491, ack 208, win 170, options [nop,nop,TS val 2780944606 ecr 115879], length 794
03:28:54.318077 IP 192.168.1.10.39926 > sea15s07-in-f10.1e100.net.https: Flags [.], ack 1349, win 136, options [nop,nop,TS val 115883 ecr 2780944606], length 0
03:28:54.318094 IP 192.168.1.10.39926 > sea15s07-in-f10.1e100.net.https: Flags [.], ack 2697, win 157, options [nop,nop,TS val 115883 ecr 2780944606], length 0
03:28:54.318104 IP 192.168.1.10.39926 > sea15s07-in-f10.1e100.net.https: Flags [.], ack 3491, win 178, options [nop,nop,TS val 115883 ecr 2780944606], length 0
03:28:54.321708 IP sea15s11-in-f170.1e100.net.https > 192.168.1.10.38008: Flags [.], ack 174, win 170, options [nop,nop,TS val 2526994883 ecr 115881], length 0
03:28:54.328206 IP sea15s01-in-f138.1e100.net.https > 192.168.1.10.57761: Flags [P.], seq 3512:4860, ack 1260, win 178, options [nop,nop,TS val 2448698322 ecr 115878], length 1348
03:28:54.328342 IP sea15s01-in-f138.1e100.net.https > 192.168.1.10.57761: Flags [P.], seq 4860:6208, ack 1260, win 178, options [nop,nop,TS val 2448698322 ecr 115878], length 1348
03:28:54.329001 IP sea15s01-in-f138.1e100.net.https > 192.168.1.10.57761: Flags [.], seq 6208:7556, ack 1260, win 178, options [nop,nop,TS val 2448698322 ecr 115878], length 1348
03:28:54.329067 IP sea15s01-in-f138.1e100.net.https > 192.168.1.10.57761: Flags [P.], seq 7556:7880, ack 1260, win 178, options [nop,nop,TS val 2448698322 ecr 115878], length 324
03:28:54.329954 IP 192.168.1.10.57761 > sea15s01-in-f138.1e100.net.https: Flags [.], ack 4860, win 199, options [nop,nop,TS val 115885 ecr 2448698322], length 0
03:28:54.329979 IP 192.168.1.10.57761 > sea15s01-in-f138.1e100.net.https: Flags [.], ack 6208, win 220, options [nop,nop,TS val 115885 ecr 2448698322], length 0
03:28:54.330059 IP sea15s01-in-f138.1e100.net.https > 192.168.1.10.57761: Flags [P.], seq 7880:9228, ack 1260, win 178, options [nop,nop,TS val 2448698323 ecr 115878], length 1348
03:28:54.330335 IP 192.168.1.10.57761 > sea15s01-in-f138.1e100.net.https: Flags [.], ack 7556, win 241, options [nop,nop,TS val 115885 ecr 2448698322], length 0
03:28:54.330356 IP 192.168.1.10.57761 > sea15s01-in-f138.1e100.net.https: Flags [.], ack 7880, win 262, options [nop,nop,TS val 115885 ecr 2448698322], length 0
03:28:54.330966 IP sea15s01-in-f138.1e100.net.https > 192.168.1.10.57761: Flags [.], seq 9228:10576, ack 1260, win 178, options [nop,nop,TS val 2448698323 ecr 115878], length 1348
03:28:54.331040 IP sea15s01-in-f138.1e100.net.https > 192.168.1.10.57761: Flags [P.], seq 10576:11924, ack 1260, win 178, options [nop,nop,TS val 2448698323 ecr 115878], length 1348
03:28:54.331320 IP 192.168.1.10.57761 > sea15s01-in-f138.1e100.net.https: Flags [.], ack 9228, win 283, options [nop,nop,TS val 115885 ecr 2448698323], length 0
03:28:54.332312 IP 192.168.1.10.57761 > sea15s01-in-f138.1e100.net.https: Flags [.], ack 10576, win 304, options [nop,nop,TS val 115885 ecr 2448698323], length 0
03:28:54.332650 IP sea15s01-in-f138.1e100.net.https > 192.168.1.10.57761: Flags [P.], seq 11924:12173, ack 1260, win 178, options [nop,nop,TS val 2448698323 ecr 115878], length 249
03:28:54.332854 IP sea15s01-in-f138.1e100.net.https > 192.168.1.10.57761: Flags [P.], seq 12173:13521, ack 1260, win 178, options [nop,nop,TS val 2448698323 ecr 115878], length 1348
03:28:54.333462 IP 192.168.1.10.57761 > sea15s01-in-f138.1e100.net.https: Flags [.], ack 11924, win 325, options [nop,nop,TS val 115885 ecr 2448698323], length 0
03:28:54.333803 IP sea15s11-in-f170.1e100.net.https > 192.168.1.10.38008: Flags [.], seq 1:1349, ack 174, win 170, options [nop,nop,TS val 2526994890 ecr 115881], length 1348
03:28:54.333922 IP sea15s11-in-f170.1e100.net.https > 192.168.1.10.38008: Flags [.], seq 1349:2697, ack 174, win 170, options [nop,nop,TS val 2526994890 ecr 115881], length 1348
03:28:54.333964 IP sea15s11-in-f170.1e100.net.https > 192.168.1.10.38008: Flags [P.], seq 2697:3264, ack 174, win 170, options [nop,nop,TS val 2526994890 ecr 115881], length 567
03:28:54.334106 IP 192.168.1.10.57761 > sea15s01-in-f138.1e100.net.https: Flags [.], ack 12173, win 346, options [nop,nop,TS val 115885 ecr 2448698323], length 0
03:28:54.334366 IP 192.168.1.10.57761 > sea15s01-in-f138.1e100.net.https: Flags [.], ack 13521, win 367, options [nop,nop,TS val 115886 ecr 2448698323], length 0
03:28:54.335447 IP 192.168.1.10.38008 > sea15s11-in-f170.1e100.net.https: Flags [.], ack 1349, win 136, options [nop,nop,TS val 115886 ecr 2526994890], length 0
03:28:54.335896 IP sea15s01-in-f138.1e100.net.https > 192.168.1.10.57761: Flags [.], seq 13521:14869, ack 1260, win 178, options [nop,nop,TS val 2448698323 ecr 115878], length 1348
03:28:54.335959 IP sea15s01-in-f138.1e100.net.https > 192.168.1.10.57761: Flags [.], seq 14869:16217, ack 1260, win 178, options [nop,nop,TS val 2448698323 ecr 115878], length 1348
03:28:54.335825 IP 192.168.1.10.38008 > sea15s11-in-f170.1e100.net.https: Flags [.], ack 2697, win 157, options [nop,nop,TS val 115886 ecr 2526994890], length 0
03:28:54.335842 IP 192.168.1.10.38008 > sea15s11-in-f170.1e100.net.https: Flags [.], ack 3264, win 178, options [nop,nop,TS val 115886 ecr 2526994890], length 0
03:28:54.337183 IP 192.168.1.10.57761 > sea15s01-in-f138.1e100.net.https: Flags [.], ack 14869, win 388, options [nop,nop,TS val 115886 ecr 2448698323], length 0
03:28:54.337554 IP sea15s01-in-f138.1e100.net.https > 192.168.1.10.57761: Flags [P.], seq 16217:16456, ack 1260, win 178, options [nop,nop,TS val 2448698323 ecr 115878], length 239
03:28:54.337617 IP 192.168.1.10.57761 > sea15s01-in-f138.1e100.net.https: Flags [.], ack 16217, win 409, options [nop,nop,TS val 115886 ecr 2448698323], length 0
03:28:54.337732 IP sea15s01-in-f138.1e100.net.https > 192.168.1.10.57761: Flags [P.], seq 16456:17804, ack 1260, win 178, options [nop,nop,TS val 2448698323 ecr 115878], length 1348
03:28:54.338589 IP sea15s01-in-f138.1e100.net.https > 192.168.1.10.57761: Flags [.], seq 17804:19152, ack 1260, win 178, options [nop,nop,TS val 2448698323 ecr 115878], length 1348
03:28:54.338804 IP 192.168.1.10.57761 > sea15s01-in-f138.1e100.net.https: Flags [.], ack 16456, win 430, options [nop,nop,TS val 115886 ecr 2448698323], length 0
03:28:54.339058 IP 192.168.1.10.57761 > sea15s01-in-f138.1e100.net.https: Flags [.], ack 17804, win 452, options [nop,nop,TS val 115886 ecr 2448698323], length 0
03:28:54.339796 IP 192.168.1.10.57761 > sea15s01-in-f138.1e100.net.https: Flags [.], ack 19152, win 473, options [nop,nop,TS val 115886 ecr 2448698323], length 0
03:28:54.360638 IP sea15s01-in-f138.1e100.net.https > 192.168.1.10.57761: Flags [.], seq 19152:20500, ack 1260, win 178, options [nop,nop,TS val 2448698355 ecr 115885], length 1348
03:28:54.360699 IP sea15s01-in-f138.1e100.net.https > 192.168.1.10.57761: Flags [.], seq 20500:21848, ack 1260, win 178, options [nop,nop,TS val 2448698355 ecr 115885], length 1348
03:28:54.361828 IP sea15s01-in-f138.1e100.net.https > 192.168.1.10.57761: Flags [.], seq 21848:23196, ack 1260, win 178, options [nop,nop,TS val 2448698355 ecr 115885], length 1348
03:28:54.361873 IP sea15s01-in-f138.1e100.net.https > 192.168.1.10.57761: Flags [.], seq 23196:24544, ack 1260, win 178, options [nop,nop,TS val 2448698355 ecr 115885], length 1348
03:28:54.362090 IP 192.168.1.10.57761 > sea15s01-in-f138.1e100.net.https: Flags [.], ack 20500, win 494, options [nop,nop,TS val 115888 ecr 2448698355], length 0
03:28:54.362304 IP 192.168.1.10.57761 > sea15s01-in-f138.1e100.net.https: Flags [.], ack 21848, win 515, options [nop,nop,TS val 115888 ecr 2448698355], length 0
03:28:54.363182 IP 192.168.1.10.57761 > sea15s01-in-f138.1e100.net.https: Flags [.], ack 23196, win 536, options [nop,nop,TS val 115888 ecr 2448698355], length 0
03:28:54.363299 IP 192.168.1.10.57761 > sea15s01-in-f138.1e100.net.https: Flags [.], ack 24544, win 557, options [nop,nop,TS val 115888 ecr 2448698355], length 0
03:28:54.364659 IP sea15s01-in-f138.1e100.net.https > 192.168.1.10.57761: Flags [.], seq 24544:25892, ack 1260, win 178, options [nop,nop,TS val 2448698355 ecr 115885], length 1348
03:28:54.364704 IP sea15s01-in-f138.1e100.net.https > 192.168.1.10.57761: Flags [.], seq 25892:27240, ack 1260, win 178, options [nop,nop,TS val 2448698355 ecr 115885], length 1348
03:28:54.365417 IP sea15s01-in-f138.1e100.net.https > 192.168.1.10.57761: Flags [.], seq 27240:28588, ack 1260, win 178, options [nop,nop,TS val 2448698356 ecr 115885], length 1348
03:28:54.365459 IP sea15s01-in-f138.1e100.net.https > 192.168.1.10.57761: Flags [.], seq 28588:29936, ack 1260, win 178, options [nop,nop,TS val 2448698356 ecr 115885], length 1348
03:28:54.366677 IP 192.168.1.10.57761 > sea15s01-in-f138.1e100.net.https: Flags [.], ack 25892, win 578, options [nop,nop,TS val 115889 ecr 2448698355], length 0
03:28:54.366689 IP 192.168.1.10.57761 > sea15s01-in-f138.1e100.net.https: Flags [.], ack 27240, win 599, options [nop,nop,TS val 115889 ecr 2448698355], length 0
03:28:54.366703 IP 192.168.1.10.57761 > sea15s01-in-f138.1e100.net.https: Flags [.], ack 28588, win 620, options [nop,nop,TS val 115889 ecr 2448698356], length 0
03:28:54.366930 IP 192.168.1.10.57761 > sea15s01-in-f138.1e100.net.https: Flags [.], ack 29936, win 641, options [nop,nop,TS val 115889 ecr 2448698356], length 0
03:28:54.367399 IP sea15s01-in-f138.1e100.net.https > 192.168.1.10.57761: Flags [.], seq 29936:31284, ack 1260, win 178, options [nop,nop,TS val 2448698359 ecr 115885], length 1348
03:28:54.367442 IP sea15s01-in-f138.1e100.net.https > 192.168.1.10.57761: Flags [.], seq 31284:32632, ack 1260, win 178, options [nop,nop,TS val 2448698359 ecr 115885], length 1348
03:28:54.368802 IP 192.168.1.10.57761 > sea15s01-in-f138.1e100.net.https: Flags [.], ack 31284, win 662, options [nop,nop,TS val 115889 ecr 2448698359], length 0
03:28:54.369054 IP 192.168.1.10.57761 > sea15s01-in-f138.1e100.net.https: Flags [.], ack 32632, win 683, options [nop,nop,TS val 115889 ecr 2448698359], length 0
03:28:54.370159 IP sea15s01-in-f138.1e100.net.https > 192.168.1.10.57761: Flags [.], seq 32632:33980, ack 1260, win 178, options [nop,nop,TS val 2448698359 ecr 115885], length 1348
03:28:54.370206 IP sea15s01-in-f138.1e100.net.https > 192.168.1.10.57761: Flags [.], seq 33980:35328, ack 1260, win 178, options [nop,nop,TS val 2448698359 ecr 115885], length 1348
03:28:54.371556 IP 192.168.1.10.57761 > sea15s01-in-f138.1e100.net.https: Flags [.], ack 33980, win 704, options [nop,nop,TS val 115889 ecr 2448698359], length 0
03:28:54.371934 IP 192.168.1.10.57761 > sea15s01-in-f138.1e100.net.https: Flags [.], ack 35328, win 725, options [nop,nop,TS val 115889 ecr 2448698359], length 0
03:28:54.372581 IP sea15s01-in-f138.1e100.net.https > 192.168.1.10.57761: Flags [.], seq 35328:36676, ack 1260, win 178, options [nop,nop,TS val 2448698362 ecr 115886], length 1348
03:28:54.372628 IP sea15s01-in-f138.1e100.net.https > 192.168.1.10.57761: Flags [.], seq 36676:38024, ack 1260, win 178, options [nop,nop,TS val 2448698362 ecr 115886], length 1348
03:28:54.374057 IP 192.168.1.10.57761 > sea15s01-in-f138.1e100.net.https: Flags [.], ack 36676, win 746, options [nop,nop,TS val 115890 ecr 2448698362], length 0
03:28:54.374303 IP 192.168.1.10.57761 > sea15s01-in-f138.1e100.net.https: Flags [.], ack 38024, win 767, options [nop,nop,TS val 115890 ecr 2448698362], length 0
03:28:54.374981 IP sea15s01-in-f138.1e100.net.https > 192.168.1.10.57761: Flags [.], seq 38024:39372, ack 1260, win 178, options [nop,nop,TS val 2448698364 ecr 115886], length 1348
03:28:54.375040 IP sea15s01-in-f138.1e100.net.https > 192.168.1.10.57761: Flags [.], seq 39372:40720, ack 1260, win 178, options [nop,nop,TS val 2448698364 ecr 115886], length 1348
03:28:54.377392 IP sea15s01-in-f138.1e100.net.https > 192.168.1.10.57761: Flags [.], seq 40720:42068, ack 1260, win 178, options [nop,nop,TS val 2448698367 ecr 115886], length 1348
03:28:54.377433 IP sea15s01-in-f138.1e100.net.https > 192.168.1.10.57761: Flags [.], seq 42068:43416, ack 1260, win 178, options [nop,nop,TS val 2448698367 ecr 115886], length 1348
03:28:54.377514 IP 192.168.1.10.38008 > sea15s11-in-f170.1e100.net.https: Flags [P.], seq 174:259, ack 3264, win 178, options [nop,nop,TS val 115890 ecr 2526994890], length 85
03:28:54.378937 IP 192.168.1.10.57761 > sea15s01-in-f138.1e100.net.https: Flags [.], ack 39372, win 789, options [nop,nop,TS val 115890 ecr 2448698364], length 0
03:28:54.378947 IP 192.168.1.10.57761 > sea15s01-in-f138.1e100.net.https: Flags [.], ack 40720, win 810, options [nop,nop,TS val 115890 ecr 2448698364], length 0
03:28:54.378982 IP 192.168.1.10.57761 > sea15s01-in-f138.1e100.net.https: Flags [.], ack 42068, win 831, options [nop,nop,TS val 115890 ecr 2448698367], length 0
03:28:54.379268 IP 192.168.1.10.57761 > sea15s01-in-f138.1e100.net.https: Flags [.], ack 43416, win 852, options [nop,nop,TS val 115890 ecr 2448698367], length 0
03:28:54.379948 IP sea15s01-in-f138.1e100.net.https > 192.168.1.10.57761: Flags [.], seq 43416:44764, ack 1260, win 178, options [nop,nop,TS val 2448698369 ecr 115886], length 1348
03:28:54.380033 IP sea15s01-in-f138.1e100.net.https > 192.168.1.10.57761: Flags [.], seq 44764:46112, ack 1260, win 178, options [nop,nop,TS val 2448698369 ecr 115886], length 1348
03:28:54.380714 IP sea15s01-in-f138.1e100.net.https > 192.168.1.10.57761: Flags [.], seq 46112:47460, ack 1260, win 178, options [nop,nop,TS val 2448698372 ecr 115886], length 1348
03:28:54.380833 IP sea15s01-in-f138.1e100.net.https > 192.168.1.10.57761: Flags [.], seq 47460:48808, ack 1260, win 178, options [nop,nop,TS val 2448698372 ecr 115886], length 1348
03:28:54.381977 IP 192.168.1.10.57761 > sea15s01-in-f138.1e100.net.https: Flags [.], ack 44764, win 873, options [nop,nop,TS val 115890 ecr 2448698369], length 0
03:28:54.381991 IP 192.168.1.10.57761 > sea15s01-in-f138.1e100.net.https: Flags [.], ack 46112, win 894, options [nop,nop,TS val 115890 ecr 2448698369], length 0
03:28:54.382010 IP 192.168.1.10.57761 > sea15s01-in-f138.1e100.net.https: Flags [.], ack 47460, win 915, options [nop,nop,TS val 115890 ecr 2448698372], length 0
03:28:54.382503 IP sea15s01-in-f138.1e100.net.https > 192.168.1.10.57761: Flags [.], seq 48808:50156, ack 1260, win 178, options [nop,nop,TS val 2448698374 ecr 115886], length 1348
03:28:54.382573 IP sea15s01-in-f138.1e100.net.https > 192.168.1.10.57761: Flags [.], seq 50156:51504, ack 1260, win 178, options [nop,nop,TS val 2448698374 ecr 115886], length 1348
03:28:54.382652 IP 192.168.1.10.57761 > sea15s01-in-f138.1e100.net.https: Flags [.], ack 48808, win 936, options [nop,nop,TS val 115890 ecr 2448698372], length 0
03:28:54.384685 IP sea15s01-in-f138.1e100.net.https > 192.168.1.10.57761: Flags [.], seq 51504:52852, ack 1260, win 178, options [nop,nop,TS val 2448698374 ecr 115886], length 1348
03:28:54.384754 IP sea15s01-in-f138.1e100.net.https > 192.168.1.10.57761: Flags [.], seq 52852:54200, ack 1260, win 178, options [nop,nop,TS val 2448698374 ecr 115886], length 1348
03:28:54.384898 IP 192.168.1.10.57761 > sea15s01-in-f138.1e100.net.https: Flags [.], ack 50156, win 957, options [nop,nop,TS val 115891 ecr 2448698374], length 0
03:28:54.384924 IP 192.168.1.10.57761 > sea15s01-in-f138.1e100.net.https: Flags [.], ack 51504, win 978, options [nop,nop,TS val 115891 ecr 2448698374], length 0
03:28:54.387035 IP sea15s01-in-f138.1e100.net.https > 192.168.1.10.57761: Flags [.], seq 54200:55548, ack 1260, win 178, options [nop,nop,TS val 2448698376 ecr 115886], length 1348
03:28:54.387288 IP sea15s01-in-f138.1e100.net.https > 192.168.1.10.57761: Flags [.], seq 55548:56896, ack 1260, win 178, options [nop,nop,TS val 2448698376 ecr 115886], length 1348
03:28:54.389064 IP 192.168.1.10.57761 > sea15s01-in-f138.1e100.net.https: Flags [.], ack 52852, win 999, options [nop,nop,TS val 115891 ecr 2448698374], length 0
03:28:54.389086 IP 192.168.1.10.57761 > sea15s01-in-f138.1e100.net.https: Flags [.], ack 54200, win 1020, options [nop,nop,TS val 115891 ecr 2448698374], length 0
03:28:54.389117 IP 192.168.1.10.57761 > sea15s01-in-f138.1e100.net.https: Flags [.], ack 55548, win 1041, options [nop,nop,TS val 115891 ecr 2448698376], length 0
03:28:54.389392 IP 192.168.1.10.57761 > sea15s01-in-f138.1e100.net.https: Flags [.], ack 56896, win 1062, options [nop,nop,TS val 115891 ecr 2448698376], length 0
03:28:54.392465 IP sea15s01-in-f138.1e100.net.https > 192.168.1.10.57761: Flags [.], seq 56896:58244, ack 1260, win 178, options [nop,nop,TS val 2448698387 ecr 115888], length 1348
03:28:54.392533 IP sea15s01-in-f138.1e100.net.https > 192.168.1.10.57761: Flags [.], seq 58244:59592, ack 1260, win 178, options [nop,nop,TS val 2448698387 ecr 115888], length 1348
03:28:54.393373 IP sea15s01-in-f138.1e100.net.https > 192.168.1.10.57761: Flags [.], seq 59592:60940, ack 1260, win 178, options [nop,nop,TS val 2448698387 ecr 115888], length 1348
03:28:54.394050 IP sea15s01-in-f138.1e100.net.https > 192.168.1.10.57761: Flags [.], seq 60940:62288, ack 1260, win 178, options [nop,nop,TS val 2448698387 ecr 115888], length 1348
03:28:54.395137 IP sea15s01-in-f138.1e100.net.https > 192.168.1.10.57761: Flags [.], seq 62288:63636, ack 1260, win 178, options [nop,nop,TS val 2448698388 ecr 115888], length 1348
03:28:54.395184 IP sea15s01-in-f138.1e100.net.https > 192.168.1.10.57761: Flags [.], seq 63636:64984, ack 1260, win 178, options [nop,nop,TS val 2448698388 ecr 115888], length 1348
03:28:54.396831 IP sea15s01-in-f138.1e100.net.https > 192.168.1.10.57761: Flags [.], seq 64984:66332, ack 1260, win 178, options [nop,nop,TS val 2448698388 ecr 115888], length 1348
03:28:54.396882 IP sea15s01-in-f138.1e100.net.https > 192.168.1.10.57761: Flags [.], seq 66332:67680, ack 1260, win 178, options [nop,nop,TS val 2448698388 ecr 115888], length 1348
03:28:54.398421 IP sea15s01-in-f138.1e100.net.https > 192.168.1.10.57761: Flags [.], seq 67680:69028, ack 1260, win 178, options [nop,nop,TS val 2448698391 ecr 115889], length 1348
03:28:54.398469 IP sea15s01-in-f138.1e100.net.https > 192.168.1.10.57761: Flags [.], seq 69028:70376, ack 1260, win 178, options [nop,nop,TS val 2448698391 ecr 115889], length 1348
03:28:54.400097 IP sea15s01-in-f138.1e100.net.https > 192.168.1.10.57761: Flags [.], seq 70376:71724, ack 1260, win 178, options [nop,nop,TS val 2448698391 ecr 115889], length 1348
03:28:54.400140 IP sea15s01-in-f138.1e100.net.https > 192.168.1.10.57761: Flags [.], seq 71724:73072, ack 1260, win 178, options [nop,nop,TS val 2448698391 ecr 115889], length 1348
03:28:54.401814 IP sea15s01-in-f138.1e100.net.https > 192.168.1.10.57761: Flags [.], seq 73072:74420, ack 1260, win 178, options [nop,nop,TS val 2448698391 ecr 115889], length 1348
03:28:54.402674 IP sea15s01-in-f138.1e100.net.https > 192.168.1.10.57761: Flags [.], seq 74420:75768, ack 1260, win 178, options [nop,nop,TS val 2448698391 ecr 115889], length 1348
03:28:54.403558 IP sea15s01-in-f138.1e100.net.https > 192.168.1.10.57761: Flags [.], seq 75768:77116, ack 1260, win 178, options [nop,nop,TS val 2448698393 ecr 115889], length 1348
03:28:54.403599 IP sea15s01-in-f138.1e100.net.https > 192.168.1.10.57761: Flags [.], seq 77116:78464, ack 1260, win 178, options [nop,nop,TS val 2448698393 ecr 115889], length 1348
03:28:54.405316 IP sea15s01-in-f138.1e100.net.https > 192.168.1.10.57761: Flags [.], seq 78464:79812, ack 1260, win 178, options [nop,nop,TS val 2448698394 ecr 115889], length 1348
03:28:54.405389 IP sea15s01-in-f138.1e100.net.https > 192.168.1.10.57761: Flags [.], seq 79812:81160, ack 1260, win 178, options [nop,nop,TS val 2448698394 ecr 115889], length 1348
03:28:54.407093 IP sea15s01-in-f138.1e100.net.https > 192.168.1.10.57761: Flags [.], seq 81160:82508, ack 1260, win 178, options [nop,nop,TS val 2448698396 ecr 115889], length 1348
03:28:54.407199 IP sea15s01-in-f138.1e100.net.https > 192.168.1.10.57761: Flags [.], seq 82508:83856, ack 1260, win 178, options [nop,nop,TS val 2448698396 ecr 115889], length 1348
03:28:54.408915 IP sea15s01-in-f138.1e100.net.https > 192.168.1.10.57761: Flags [.], seq 83856:85204, ack 1260, win 178, options [nop,nop,TS val 2448698398 ecr 115889], length 1348
03:28:54.408997 IP sea15s01-in-f138.1e100.net.https > 192.168.1.10.57761: Flags [.], seq 85204:86552, ack 1260, win 178, options [nop,nop,TS val 2448698398 ecr 115889], length 1348
03:28:54.408707 IP 192.168.1.10.57761 > sea15s01-in-f138.1e100.net.https: Flags [.], ack 58244, win 1083, options [nop,nop,TS val 115893 ecr 2448698387], length 0
03:28:54.408721 IP 192.168.1.10.57761 > sea15s01-in-f138.1e100.net.https: Flags [.], ack 59592, win 1104, options [nop,nop,TS val 115893 ecr 2448698387], length 0
03:28:54.408735 IP 192.168.1.10.57761 > sea15s01-in-f138.1e100.net.https: Flags [.], ack 60940, win 1126, options [nop,nop,TS val 115893 ecr 2448698387], length 0
03:28:54.408744 IP 192.168.1.10.57761 > sea15s01-in-f138.1e100.net.https: Flags [.], ack 62288, win 1147, options [nop,nop,TS val 115893 ecr 2448698387], length 0
03:28:54.408753 IP 192.168.1.10.57761 > sea15s01-in-f138.1e100.net.https: Flags [.], ack 63636, win 1168, options [nop,nop,TS val 115893 ecr 2448698388], length 0
03:28:54.408762 IP 192.168.1.10.57761 > sea15s01-in-f138.1e100.net.https: Flags [.], ack 64984, win 1189, options [nop,nop,TS val 115893 ecr 2448698388], length 0
03:28:54.408772 IP 192.168.1.10.57761 > sea15s01-in-f138.1e100.net.https: Flags [.], ack 66332, win 1210, options [nop,nop,TS val 115893 ecr 2448698388], length 0
03:28:54.408827 IP 192.168.1.10.57761 > sea15s01-in-f138.1e100.net.https: Flags [.], ack 67680, win 1231, options [nop,nop,TS val 115893 ecr 2448698388], length 0
03:28:54.408846 IP 192.168.1.10.57761 > sea15s01-in-f138.1e100.net.https: Flags [.], ack 69028, win 1252, options [nop,nop,TS val 115893 ecr 2448698391], length 0
03:28:54.410479 IP sea15s01-in-f138.1e100.net.https > 192.168.1.10.57761: Flags [.], seq 86552:87900, ack 1260, win 178, options [nop,nop,TS val 2448698399 ecr 115890], length 1348
03:28:54.410550 IP sea15s01-in-f138.1e100.net.https > 192.168.1.10.57761: Flags [.], seq 87900:89248, ack 1260, win 178, options [nop,nop,TS val 2448698399 ecr 115890], length 1348
03:28:54.412203 IP sea15s01-in-f138.1e100.net.https > 192.168.1.10.57761: Flags [.], seq 89248:90596, ack 1260, win 178, options [nop,nop,TS val 2448698401 ecr 115890], length 1348
03:28:54.412272 IP sea15s01-in-f138.1e100.net.https > 192.168.1.10.57761: Flags [.], seq 90596:91944, ack 1260, win 178, options [nop,nop,TS val 2448698401 ecr 115890], length 1348
03:28:54.413022 IP 192.168.1.10.57761 > sea15s01-in-f138.1e100.net.https: Flags [.], ack 70376, win 1273, options [nop,nop,TS val 115893 ecr 2448698391], length 0
03:28:54.413038 IP 192.168.1.10.57761 > sea15s01-in-f138.1e100.net.https: Flags [.], ack 71724, win 1294, options [nop,nop,TS val 115893 ecr 2448698391], length 0
03:28:54.413048 IP 192.168.1.10.57761 > sea15s01-in-f138.1e100.net.https: Flags [.], ack 73072, win 1315, options [nop,nop,TS val 115893 ecr 2448698391], length 0
03:28:54.413065 IP 192.168.1.10.57761 > sea15s01-in-f138.1e100.net.https: Flags [.], ack 74420, win 1336, options [nop,nop,TS val 115893 ecr 2448698391], length 0
03:28:54.413905 IP sea15s11-in-f170.1e100.net.https > 192.168.1.10.38008: Flags [P.], seq 3264:3307, ack 259, win 170, options [nop,nop,TS val 2526994970 ecr 115890], length 43
03:28:54.414050 IP sea15s01-in-f138.1e100.net.https > 192.168.1.10.57761: Flags [.], seq 91944:93292, ack 1260, win 178, options [nop,nop,TS val 2448698403 ecr 115890], length 1348
03:28:54.414092 IP sea15s01-in-f138.1e100.net.https > 192.168.1.10.57761: Flags [.], seq 93292:94640, ack 1260, win 178, options [nop,nop,TS val 2448698403 ecr 115890], length 1348
03:28:54.414627 IP 192.168.1.10.57761 > sea15s01-in-f138.1e100.net.https: Flags [.], ack 75768, win 1357, options [nop,nop,TS val 115893 ecr 2448698391], length 0
03:28:54.414640 IP 192.168.1.10.57761 > sea15s01-in-f138.1e100.net.https: Flags [.], ack 77116, win 1378, options [nop,nop,TS val 115893 ecr 2448698393], length 0
03:28:54.414649 IP 192.168.1.10.57761 > sea15s01-in-f138.1e100.net.https: Flags [.], ack 78464, win 1399, options [nop,nop,TS val 115893 ecr 2448698393], length 0
03:28:54.414658 IP 192.168.1.10.57761 > sea15s01-in-f138.1e100.net.https: Flags [.], ack 79812, win 1420, options [nop,nop,TS val 115893 ecr 2448698394], length 0
03:28:54.414669 IP 192.168.1.10.57761 > sea15s01-in-f138.1e100.net.https: Flags [.], ack 81160, win 1441, options [nop,nop,TS val 115893 ecr 2448698394], length 0
03:28:54.414679 IP 192.168.1.10.57761 > sea15s01-in-f138.1e100.net.https: Flags [.], ack 82508, win 1463, options [nop,nop,TS val 115893 ecr 2448698396], length 0
03:28:54.414688 IP 192.168.1.10.57761 > sea15s01-in-f138.1e100.net.https: Flags [.], ack 83856, win 1484, options [nop,nop,TS val 115893 ecr 2448698396], length 0
