tcpdump: verbose output suppressed, use -v or -vv for full protocol decode
listening on wlan0, link-type EN10MB (Ethernet), capture size 262144 bytes
20:15:49.683493 IP 192.168.1.10.43207 > 74.125.197.108.587: Flags [S], seq 2734519257, win 14600, options [mss 1460,sackOK,TS val 2792063 ecr 0,nop,wscale 7], length 0
20:15:49.718860 IP 74.125.197.108.587 > 192.168.1.10.43207: Flags [S.], seq 2714197543, ack 2734519258, win 42408, options [mss 1360,sackOK,TS val 3119771008 ecr 2792063,nop,wscale 8], length 0
20:15:49.725075 IP 192.168.1.10.43207 > 74.125.197.108.587: Flags [.], ack 1, win 115, options [nop,nop,TS val 2792067 ecr 3119771008], length 0
20:15:49.772261 IP 74.125.197.108.587 > 192.168.1.10.43207: Flags [P.], seq 1:56, ack 1, win 166, options [nop,nop,TS val 3119771061 ecr 2792067], length 55
20:15:49.788612 IP 192.168.1.10.43207 > 74.125.197.108.587: Flags [.], ack 56, win 115, options [nop,nop,TS val 2792073 ecr 3119771061], length 0
20:15:49.792968 IP 192.168.1.10.43207 > 74.125.197.108.587: Flags [F.], seq 1, ack 56, win 115, options [nop,nop,TS val 2792073 ecr 3119771061], length 0
20:15:49.805065 IP 192.168.1.10.51302 > ec2-54-205-161-210.compute-1.amazonaws.com.https: Flags [S], seq 3613791228, win 14600, options [mss 1460,sackOK,TS val 2792075 ecr 0,nop,wscale 7], length 0
20:15:49.828218 IP 74.125.197.108.587 > 192.168.1.10.43207: Flags [.], ack 2, win 166, options [nop,nop,TS val 3119771117 ecr 2792073], length 0
20:15:49.828859 IP 74.125.197.108.587 > 192.168.1.10.43207: Flags [F.], seq 56, ack 2, win 166, options [nop,nop,TS val 3119771118 ecr 2792073], length 0
20:15:49.838950 IP 192.168.1.10.43207 > 74.125.197.108.587: Flags [.], ack 57, win 115, options [nop,nop,TS val 2792078 ecr 3119771118], length 0
20:15:50.165352 IP 192.168.1.10.47535 > sea15s11-in-f174.1e100.net.https: Flags [S], seq 3364212677, win 14600, options [mss 1460,sackOK,TS val 2792111 ecr 0,nop,wscale 7], length 0
20:15:50.195668 IP sea15s11-in-f174.1e100.net.https > 192.168.1.10.47535: Flags [S.], seq 2142541855, ack 3364212678, win 42408, options [mss 1360,sackOK,TS val 2302031145 ecr 2792111,nop,wscale 8], length 0
20:15:50.208978 IP 192.168.1.10.47535 > sea15s11-in-f174.1e100.net.https: Flags [.], ack 1, win 115, options [nop,nop,TS val 2792115 ecr 2302031145], length 0
20:15:50.242728 IP 192.168.1.10.47535 > sea15s11-in-f174.1e100.net.https: Flags [P.], seq 1:174, ack 1, win 115, options [nop,nop,TS val 2792118 ecr 2302031145], length 173
20:15:50.273046 IP sea15s11-in-f174.1e100.net.https > 192.168.1.10.47535: Flags [.], ack 174, win 170, options [nop,nop,TS val 2302031222 ecr 2792118], length 0
20:15:50.281123 IP sea15s11-in-f174.1e100.net.https > 192.168.1.10.47535: Flags [.], seq 1:1349, ack 174, win 170, options [nop,nop,TS val 2302031230 ecr 2792118], length 1348
20:15:50.281235 IP sea15s11-in-f174.1e100.net.https > 192.168.1.10.47535: Flags [.], seq 1349:2697, ack 174, win 170, options [nop,nop,TS val 2302031230 ecr 2792118], length 1348
20:15:50.281272 IP sea15s11-in-f174.1e100.net.https > 192.168.1.10.47535: Flags [.], seq 2697:4045, ack 174, win 170, options [nop,nop,TS val 2302031230 ecr 2792118], length 1348
20:15:50.281304 IP sea15s11-in-f174.1e100.net.https > 192.168.1.10.47535: Flags [P.], seq 4045:4138, ack 174, win 170, options [nop,nop,TS val 2302031230 ecr 2792118], length 93
20:15:50.289604 IP 192.168.1.10.47535 > sea15s11-in-f174.1e100.net.https: Flags [.], ack 1349, win 136, options [nop,nop,TS val 2792124 ecr 2302031230], length 0
20:15:50.289623 IP 192.168.1.10.47535 > sea15s11-in-f174.1e100.net.https: Flags [.], ack 2697, win 157, options [nop,nop,TS val 2792124 ecr 2302031230], length 0
20:15:50.289636 IP 192.168.1.10.47535 > sea15s11-in-f174.1e100.net.https: Flags [.], ack 4045, win 178, options [nop,nop,TS val 2792124 ecr 2302031230], length 0
20:15:50.289647 IP 192.168.1.10.47535 > sea15s11-in-f174.1e100.net.https: Flags [.], ack 4138, win 178, options [nop,nop,TS val 2792124 ecr 2302031230], length 0
20:15:50.384483 IP 192.168.1.10.47535 > sea15s11-in-f174.1e100.net.https: Flags [P.], seq 174:259, ack 4138, win 178, options [nop,nop,TS val 2792133 ecr 2302031230], length 85
20:15:50.415269 IP sea15s11-in-f174.1e100.net.https > 192.168.1.10.47535: Flags [P.], seq 4138:4181, ack 259, win 170, options [nop,nop,TS val 2302031365 ecr 2792133], length 43
20:15:50.423848 IP 192.168.1.10.47535 > sea15s11-in-f174.1e100.net.https: Flags [.], ack 4181, win 178, options [nop,nop,TS val 2792137 ecr 2302031365], length 0
20:15:50.476894 IP 192.168.1.10.47535 > sea15s11-in-f174.1e100.net.https: Flags [P.], seq 259:814, ack 4181, win 178, options [nop,nop,TS val 2792142 ecr 2302031365], length 555
20:15:50.547383 IP sea15s11-in-f174.1e100.net.https > 192.168.1.10.47535: Flags [.], ack 814, win 175, options [nop,nop,TS val 2302031456 ecr 2792142], length 0
20:15:50.573367 IP sea15s11-in-f174.1e100.net.https > 192.168.1.10.47535: Flags [P.], seq 4181:4685, ack 814, win 175, options [nop,nop,TS val 2302031523 ecr 2792142], length 504
20:15:50.573540 IP sea15s11-in-f174.1e100.net.https > 192.168.1.10.47535: Flags [P.], seq 4685:4977, ack 814, win 175, options [nop,nop,TS val 2302031523 ecr 2792142], length 292
20:15:50.573618 IP sea15s11-in-f174.1e100.net.https > 192.168.1.10.47535: Flags [P.], seq 4977:5003, ack 814, win 175, options [nop,nop,TS val 2302031523 ecr 2792142], length 26
20:15:50.581463 IP 192.168.1.10.47535 > sea15s11-in-f174.1e100.net.https: Flags [.], ack 4685, win 199, options [nop,nop,TS val 2792153 ecr 2302031523], length 0
20:15:50.630730 IP 192.168.1.10.47535 > sea15s11-in-f174.1e100.net.https: Flags [.], ack 4977, win 220, options [nop,nop,TS val 2792153 ecr 2302031523], length 0
20:15:50.630747 IP 192.168.1.10.47535 > sea15s11-in-f174.1e100.net.https: Flags [.], ack 5003, win 220, options [nop,nop,TS val 2792155 ecr 2302031523], length 0
20:15:50.798846 IP 192.168.1.10.51302 > ec2-54-205-161-210.compute-1.amazonaws.com.https: Flags [S], seq 3613791228, win 14600, options [mss 1460,sackOK,TS val 2792175 ecr 0,nop,wscale 7], length 0
20:15:50.974135 IP 192.168.1.10.34519 > sea15s01-in-f14.1e100.net.www: Flags [S], seq 771655961, win 14600, options [mss 1460,sackOK,TS val 2792191 ecr 0,nop,wscale 7], length 0
20:15:50.982557 IP sea15s01-in-f14.1e100.net.www > 192.168.1.10.34519: Flags [S.], seq 3450660577, ack 771655962, win 26960, options [mss 1360,sackOK,TS val 3174802125 ecr 2792191,nop,wscale 7], length 0
20:15:50.989733 IP 192.168.1.10.34519 > sea15s01-in-f14.1e100.net.www: Flags [.], ack 1, win 115, options [nop,nop,TS val 2792193 ecr 3174802125], length 0
20:15:50.989751 IP 192.168.1.10.50845 > sea15s11-in-f170.1e100.net.https: Flags [S], seq 2178113966, win 14600, options [mss 1460,sackOK,TS val 2792194 ecr 0,nop,wscale 7], length 0
20:15:51.020029 IP sea15s11-in-f170.1e100.net.https > 192.168.1.10.50845: Flags [S.], seq 1910835558, ack 2178113967, win 42408, options [mss 1360,sackOK,TS val 3605677991 ecr 2792194,nop,wscale 8], length 0
20:15:51.038122 IP 192.168.1.10.34519 > sea15s01-in-f14.1e100.net.www: Flags [P.], seq 1:187, ack 1, win 115, options [nop,nop,TS val 2792197 ecr 3174802125], length 186: HTTP: GET /generate_204 HTTP/1.1
20:15:51.038138 IP 192.168.1.10.50845 > sea15s11-in-f170.1e100.net.https: Flags [.], ack 1, win 115, options [nop,nop,TS val 2792199 ecr 3605677991], length 0
20:15:51.046489 IP sea15s01-in-f14.1e100.net.www > 192.168.1.10.34519: Flags [.], ack 187, win 219, options [nop,nop,TS val 3174802141 ecr 2792197], length 0
20:15:51.047985 IP 192.168.1.10.50845 > sea15s11-in-f170.1e100.net.https: Flags [P.], seq 1:170, ack 1, win 115, options [nop,nop,TS val 2792199 ecr 3605677991], length 169
20:15:51.078155 IP sea15s11-in-f170.1e100.net.https > 192.168.1.10.50845: Flags [.], ack 170, win 170, options [nop,nop,TS val 3605678049 ecr 2792199], length 0
20:15:51.087502 IP sea15s11-in-f170.1e100.net.https > 192.168.1.10.50845: Flags [.], seq 1:1349, ack 170, win 170, options [nop,nop,TS val 3605678058 ecr 2792199], length 1348
20:15:51.087560 IP sea15s11-in-f170.1e100.net.https > 192.168.1.10.50845: Flags [.], seq 1349:2697, ack 170, win 170, options [nop,nop,TS val 3605678058 ecr 2792199], length 1348
20:15:51.087591 IP sea15s11-in-f170.1e100.net.https > 192.168.1.10.50845: Flags [P.], seq 2697:3236, ack 170, win 170, options [nop,nop,TS val 3605678058 ecr 2792199], length 539
20:15:51.093992 IP 192.168.1.10.50845 > sea15s11-in-f170.1e100.net.https: Flags [.], ack 1349, win 136, options [nop,nop,TS val 2792204 ecr 3605678058], length 0
20:15:51.094010 IP 192.168.1.10.50845 > sea15s11-in-f170.1e100.net.https: Flags [.], ack 2697, win 157, options [nop,nop,TS val 2792204 ecr 3605678058], length 0
20:15:51.094023 IP 192.168.1.10.50845 > sea15s11-in-f170.1e100.net.https: Flags [.], ack 3236, win 178, options [nop,nop,TS val 2792204 ecr 3605678058], length 0
20:15:51.168252 IP 192.168.1.10.50846 > sea15s11-in-f170.1e100.net.https: Flags [S], seq 113547145, win 14600, options [mss 1460,sackOK,TS val 2792211 ecr 0,nop,wscale 7], length 0
20:15:51.172482 IP sea15s01-in-f14.1e100.net.www > 192.168.1.10.34519: Flags [P.], seq 1:227, ack 187, win 219, options [nop,nop,TS val 3174802173 ecr 2792197], length 226: HTTP: HTTP/1.1 204 No Content
20:15:51.172700 IP 192.168.1.10.50847 > sea15s11-in-f170.1e100.net.https: Flags [S], seq 3363623180, win 14600, options [mss 1460,sackOK,TS val 2792212 ecr 0,nop,wscale 7], length 0
20:15:51.177005 IP 192.168.1.10.34519 > sea15s01-in-f14.1e100.net.www: Flags [.], ack 227, win 123, options [nop,nop,TS val 2792212 ecr 3174802173], length 0
20:15:51.200427 IP sea15s11-in-f170.1e100.net.https > 192.168.1.10.50846: Flags [S.], seq 1368660988, ack 113547146, win 42408, options [mss 1360,sackOK,TS val 802142818 ecr 2792211,nop,wscale 8], length 0
20:15:51.202081 IP sea15s11-in-f170.1e100.net.https > 192.168.1.10.50847: Flags [S.], seq 145156270, ack 3363623181, win 42408, options [mss 1360,sackOK,TS val 16756101 ecr 2792212,nop,wscale 8], length 0
20:15:51.210360 IP 192.168.1.10.50846 > sea15s11-in-f170.1e100.net.https: Flags [.], ack 1, win 115, options [nop,nop,TS val 2792216 ecr 802142818], length 0
20:15:51.210376 IP 192.168.1.10.50847 > sea15s11-in-f170.1e100.net.https: Flags [.], ack 1, win 115, options [nop,nop,TS val 2792216 ecr 16756101], length 0
20:15:51.214750 IP 192.168.1.10.50846 > sea15s11-in-f170.1e100.net.https: Flags [P.], seq 1:170, ack 1, win 115, options [nop,nop,TS val 2792216 ecr 802142818], length 169
20:15:51.219110 IP 192.168.1.10.50847 > sea15s11-in-f170.1e100.net.https: Flags [P.], seq 1:170, ack 1, win 115, options [nop,nop,TS val 2792217 ecr 16756101], length 169
20:15:51.246868 IP sea15s11-in-f170.1e100.net.https > 192.168.1.10.50846: Flags [.], ack 170, win 170, options [nop,nop,TS val 802142864 ecr 2792216], length 0
20:15:51.248440 IP sea15s11-in-f170.1e100.net.https > 192.168.1.10.50847: Flags [.], ack 170, win 170, options [nop,nop,TS val 16756148 ecr 2792217], length 0
20:15:51.254081 IP sea15s11-in-f170.1e100.net.https > 192.168.1.10.50846: Flags [.], seq 1:1349, ack 170, win 170, options [nop,nop,TS val 802142871 ecr 2792216], length 1348
20:15:51.254136 IP sea15s11-in-f170.1e100.net.https > 192.168.1.10.50846: Flags [.], seq 1349:2697, ack 170, win 170, options [nop,nop,TS val 802142871 ecr 2792216], length 1348
20:15:51.254166 IP sea15s11-in-f170.1e100.net.https > 192.168.1.10.50846: Flags [P.], seq 2697:3237, ack 170, win 170, options [nop,nop,TS val 802142871 ecr 2792216], length 540
20:15:51.256660 IP sea15s11-in-f170.1e100.net.https > 192.168.1.10.50847: Flags [.], seq 1:1349, ack 170, win 170, options [nop,nop,TS val 16756156 ecr 2792217], length 1348
20:15:51.256715 IP sea15s11-in-f170.1e100.net.https > 192.168.1.10.50847: Flags [.], seq 1349:2697, ack 170, win 170, options [nop,nop,TS val 16756156 ecr 2792217], length 1348
20:15:51.256747 IP sea15s11-in-f170.1e100.net.https > 192.168.1.10.50847: Flags [P.], seq 2697:3235, ack 170, win 170, options [nop,nop,TS val 16756156 ecr 2792217], length 538
20:15:51.262741 IP 192.168.1.10.50846 > sea15s11-in-f170.1e100.net.https: Flags [.], ack 1349, win 136, options [nop,nop,TS val 2792221 ecr 802142871], length 0
20:15:51.262757 IP 192.168.1.10.50846 > sea15s11-in-f170.1e100.net.https: Flags [.], ack 2697, win 157, options [nop,nop,TS val 2792221 ecr 802142871], length 0
20:15:51.262770 IP 192.168.1.10.50846 > sea15s11-in-f170.1e100.net.https: Flags [.], ack 3237, win 178, options [nop,nop,TS val 2792221 ecr 802142871], length 0
20:15:51.262781 IP 192.168.1.10.50847 > sea15s11-in-f170.1e100.net.https: Flags [.], ack 1349, win 136, options [nop,nop,TS val 2792221 ecr 16756156], length 0
20:15:51.262792 IP 192.168.1.10.50847 > sea15s11-in-f170.1e100.net.https: Flags [.], ack 2697, win 157, options [nop,nop,TS val 2792221 ecr 16756156], length 0
20:15:51.262802 IP 192.168.1.10.50847 > sea15s11-in-f170.1e100.net.https: Flags [.], ack 3235, win 178, options [nop,nop,TS val 2792221 ecr 16756156], length 0
20:15:51.357994 IP 192.168.1.10.50845 > sea15s11-in-f170.1e100.net.https: Flags [P.], seq 170:255, ack 3236, win 178, options [nop,nop,TS val 2792230 ecr 3605678058], length 85
20:15:51.388552 IP sea15s11-in-f170.1e100.net.https > 192.168.1.10.50845: Flags [P.], seq 3236:3512, ack 255, win 170, options [nop,nop,TS val 3605678359 ecr 2792230], length 276
20:15:51.394367 IP 192.168.1.10.50845 > sea15s11-in-f170.1e100.net.https: Flags [.], ack 3512, win 199, options [nop,nop,TS val 2792234 ecr 3605678359], length 0
20:15:51.414235 IP 192.168.1.10.50846 > sea15s11-in-f170.1e100.net.https: Flags [P.], seq 170:255, ack 3237, win 178, options [nop,nop,TS val 2792236 ecr 802142871], length 85
20:15:51.426111 IP 192.168.1.10.50847 > sea15s11-in-f170.1e100.net.https: Flags [P.], seq 170:255, ack 3235, win 178, options [nop,nop,TS val 2792237 ecr 16756156], length 85
20:15:51.446842 IP sea15s11-in-f170.1e100.net.https > 192.168.1.10.50846: Flags [P.], seq 3237:3513, ack 255, win 170, options [nop,nop,TS val 802143064 ecr 2792236], length 276
20:15:51.452756 IP 192.168.1.10.50846 > sea15s11-in-f170.1e100.net.https: Flags [.], ack 3513, win 199, options [nop,nop,TS val 2792240 ecr 802143064], length 0
20:15:51.452778 IP 192.168.1.10.50845 > sea15s11-in-f170.1e100.net.https: Flags [P.], seq 255:1223, ack 3512, win 199, options [nop,nop,TS val 2792240 ecr 3605678359], length 968
20:15:51.456067 IP sea15s11-in-f170.1e100.net.https > 192.168.1.10.50847: Flags [P.], seq 3235:3511, ack 255, win 170, options [nop,nop,TS val 16756355 ecr 2792237], length 276
20:15:51.461735 IP 192.168.1.10.50847 > sea15s11-in-f170.1e100.net.https: Flags [.], ack 3511, win 199, options [nop,nop,TS val 2792241 ecr 16756355], length 0
20:15:51.507079 IP 192.168.1.10.50847 > sea15s11-in-f170.1e100.net.https: Flags [P.], seq 255:1250, ack 3511, win 199, options [nop,nop,TS val 2792245 ecr 16756355], length 995
20:15:51.511486 IP 192.168.1.10.50846 > sea15s11-in-f170.1e100.net.https: Flags [P.], seq 255:1250, ack 3513, win 199, options [nop,nop,TS val 2792246 ecr 802143064], length 995
20:15:51.513986 IP sea15s11-in-f170.1e100.net.https > 192.168.1.10.50845: Flags [P.], seq 3512:4860, ack 1223, win 178, options [nop,nop,TS val 3605678485 ecr 2792240], length 1348
20:15:51.514167 IP sea15s11-in-f170.1e100.net.https > 192.168.1.10.50845: Flags [P.], seq 4860:6208, ack 1223, win 178, options [nop,nop,TS val 3605678485 ecr 2792240], length 1348
20:15:51.514316 IP sea15s11-in-f170.1e100.net.https > 192.168.1.10.50845: Flags [.], seq 6208:7556, ack 1223, win 178, options [nop,nop,TS val 3605678485 ecr 2792240], length 1348
20:15:51.514364 IP sea15s11-in-f170.1e100.net.https > 192.168.1.10.50845: Flags [P.], seq 7556:7799, ack 1223, win 178, options [nop,nop,TS val 3605678485 ecr 2792240], length 243
20:15:51.514870 IP sea15s11-in-f170.1e100.net.https > 192.168.1.10.50845: Flags [P.], seq 7799:9147, ack 1223, win 178, options [nop,nop,TS val 3605678486 ecr 2792240], length 1348
20:15:51.515015 IP sea15s11-in-f170.1e100.net.https > 192.168.1.10.50845: Flags [.], seq 9147:10495, ack 1223, win 178, options [nop,nop,TS val 3605678486 ecr 2792240], length 1348
20:15:51.515056 IP sea15s11-in-f170.1e100.net.https > 192.168.1.10.50845: Flags [P.], seq 10495:11843, ack 1223, win 178, options [nop,nop,TS val 3605678486 ecr 2792240], length 1348
20:15:51.515129 IP sea15s11-in-f170.1e100.net.https > 192.168.1.10.50845: Flags [P.], seq 11843:12066, ack 1223, win 178, options [nop,nop,TS val 3605678486 ecr 2792240], length 223
20:15:51.515215 IP sea15s11-in-f170.1e100.net.https > 192.168.1.10.50845: Flags [P.], seq 12066:13414, ack 1223, win 178, options [nop,nop,TS val 3605678486 ecr 2792240], length 1348
20:15:51.515324 IP sea15s11-in-f170.1e100.net.https > 192.168.1.10.50845: Flags [.], seq 13414:14762, ack 1223, win 178, options [nop,nop,TS val 3605678486 ecr 2792240], length 1348
20:15:51.515341 IP sea15s11-in-f170.1e100.net.https > 192.168.1.10.50845: Flags [.], seq 14762:16110, ack 1223, win 178, options [nop,nop,TS val 3605678486 ecr 2792240], length 1348
20:15:51.518839 IP sea15s11-in-f170.1e100.net.https > 192.168.1.10.50845: Flags [P.], seq 16110:16443, ack 1223, win 178, options [nop,nop,TS val 3605678486 ecr 2792240], length 333
20:15:51.518985 IP sea15s11-in-f170.1e100.net.https > 192.168.1.10.50845: Flags [P.], seq 16443:17791, ack 1223, win 178, options [nop,nop,TS val 3605678486 ecr 2792240], length 1348
20:15:51.519107 IP sea15s11-in-f170.1e100.net.https > 192.168.1.10.50845: Flags [.], seq 17791:19139, ack 1223, win 178, options [nop,nop,TS val 3605678486 ecr 2792240], length 1348
20:15:51.521732 IP 192.168.1.10.50845 > sea15s11-in-f170.1e100.net.https: Flags [.], ack 4860, win 220, options [nop,nop,TS val 2792247 ecr 3605678485], length 0
20:15:51.521758 IP 192.168.1.10.50845 > sea15s11-in-f170.1e100.net.https: Flags [.], ack 6208, win 241, options [nop,nop,TS val 2792247 ecr 3605678485], length 0
20:15:51.521768 IP 192.168.1.10.50845 > sea15s11-in-f170.1e100.net.https: Flags [.], ack 7556, win 262, options [nop,nop,TS val 2792247 ecr 3605678485], length 0
20:15:51.521779 IP 192.168.1.10.50845 > sea15s11-in-f170.1e100.net.https: Flags [.], ack 7799, win 283, options [nop,nop,TS val 2792247 ecr 3605678485], length 0
20:15:51.521790 IP 192.168.1.10.50845 > sea15s11-in-f170.1e100.net.https: Flags [.], ack 9147, win 304, options [nop,nop,TS val 2792247 ecr 3605678486], length 0
20:15:51.521802 IP 192.168.1.10.50845 > sea15s11-in-f170.1e100.net.https: Flags [.], ack 10495, win 325, options [nop,nop,TS val 2792247 ecr 3605678486], length 0
20:15:51.521813 IP 192.168.1.10.50845 > sea15s11-in-f170.1e100.net.https: Flags [.], ack 11843, win 346, options [nop,nop,TS val 2792247 ecr 3605678486], length 0
20:15:51.521825 IP 192.168.1.10.50845 > sea15s11-in-f170.1e100.net.https: Flags [.], ack 12066, win 367, options [nop,nop,TS val 2792247 ecr 3605678486], length 0
20:15:51.521836 IP 192.168.1.10.50845 > sea15s11-in-f170.1e100.net.https: Flags [.], ack 13414, win 388, options [nop,nop,TS val 2792247 ecr 3605678486], length 0
20:15:51.526076 IP 192.168.1.10.50845 > sea15s11-in-f170.1e100.net.https: Flags [.], ack 14762, win 409, options [nop,nop,TS val 2792247 ecr 3605678486], length 0
20:15:51.526091 IP 192.168.1.10.50845 > sea15s11-in-f170.1e100.net.https: Flags [.], ack 16110, win 430, options [nop,nop,TS val 2792247 ecr 3605678486], length 0
20:15:51.526103 IP 192.168.1.10.50845 > sea15s11-in-f170.1e100.net.https: Flags [.], ack 16443, win 452, options [nop,nop,TS val 2792247 ecr 3605678486], length 0
20:15:51.526113 IP 192.168.1.10.50845 > sea15s11-in-f170.1e100.net.https: Flags [.], ack 17791, win 473, options [nop,nop,TS val 2792247 ecr 3605678486], length 0
20:15:51.526123 IP 192.168.1.10.50845 > sea15s11-in-f170.1e100.net.https: Flags [.], ack 19139, win 494, options [nop,nop,TS val 2792247 ecr 3605678486], length 0
20:15:51.552153 IP sea15s11-in-f170.1e100.net.https > 192.168.1.10.50845: Flags [.], seq 19139:20487, ack 1223, win 178, options [nop,nop,TS val 3605678523 ecr 2792247], length 1348
20:15:51.552265 IP sea15s11-in-f170.1e100.net.https > 192.168.1.10.50845: Flags [.], seq 20487:21835, ack 1223, win 178, options [nop,nop,TS val 3605678523 ecr 2792247], length 1348
20:15:51.554038 IP sea15s11-in-f170.1e100.net.https > 192.168.1.10.50845: Flags [.], seq 21835:23183, ack 1223, win 178, options [nop,nop,TS val 3605678523 ecr 2792247], length 1348
20:15:51.554081 IP sea15s11-in-f170.1e100.net.https > 192.168.1.10.50845: Flags [.], seq 23183:24531, ack 1223, win 178, options [nop,nop,TS val 3605678523 ecr 2792247], length 1348
20:15:51.557521 IP sea15s11-in-f170.1e100.net.https > 192.168.1.10.50845: Flags [.], seq 24531:25879, ack 1223, win 178, options [nop,nop,TS val 3605678523 ecr 2792247], length 1348
20:15:51.557613 IP sea15s11-in-f170.1e100.net.https > 192.168.1.10.50845: Flags [.], seq 25879:27227, ack 1223, win 178, options [nop,nop,TS val 3605678523 ecr 2792247], length 1348
20:15:51.557749 IP sea15s11-in-f170.1e100.net.https > 192.168.1.10.50845: Flags [.], seq 27227:28575, ack 1223, win 178, options [nop,nop,TS val 3605678525 ecr 2792247], length 1348
20:15:51.557816 IP sea15s11-in-f170.1e100.net.https > 192.168.1.10.50845: Flags [.], seq 28575:29923, ack 1223, win 178, options [nop,nop,TS val 3605678525 ecr 2792247], length 1348
20:15:51.558220 IP 192.168.1.10.50845 > sea15s11-in-f170.1e100.net.https: Flags [.], ack 20487, win 515, options [nop,nop,TS val 2792250 ecr 3605678523], length 0
20:15:51.558237 IP 192.168.1.10.50845 > sea15s11-in-f170.1e100.net.https: Flags [.], ack 21835, win 536, options [nop,nop,TS val 2792250 ecr 3605678523], length 0
20:15:51.558248 IP 192.168.1.10.50845 > sea15s11-in-f170.1e100.net.https: Flags [.], ack 23183, win 557, options [nop,nop,TS val 2792251 ecr 3605678523], length 0
20:15:51.558260 IP 192.168.1.10.50845 > sea15s11-in-f170.1e100.net.https: Flags [.], ack 24531, win 578, options [nop,nop,TS val 2792251 ecr 3605678523], length 0
20:15:51.559849 IP sea15s11-in-f170.1e100.net.https > 192.168.1.10.50845: Flags [.], seq 29923:31271, ack 1223, win 178, options [nop,nop,TS val 3605678528 ecr 2792247], length 1348
20:15:51.562310 IP sea15s11-in-f170.1e100.net.https > 192.168.1.10.50845: Flags [.], seq 31271:32619, ack 1223, win 178, options [nop,nop,TS val 3605678528 ecr 2792247], length 1348
20:15:51.562354 IP sea15s11-in-f170.1e100.net.https > 192.168.1.10.50845: Flags [.], seq 32619:33967, ack 1223, win 178, options [nop,nop,TS val 3605678528 ecr 2792247], length 1348
20:15:51.562576 IP 192.168.1.10.50845 > sea15s11-in-f170.1e100.net.https: Flags [.], ack 25879, win 599, options [nop,nop,TS val 2792251 ecr 3605678523], length 0
20:15:51.562591 IP 192.168.1.10.50845 > sea15s11-in-f170.1e100.net.https: Flags [.], ack 27227, win 620, options [nop,nop,TS val 2792251 ecr 3605678523], length 0
20:15:51.562602 IP 192.168.1.10.50845 > sea15s11-in-f170.1e100.net.https: Flags [.], ack 28575, win 641, options [nop,nop,TS val 2792251 ecr 3605678525], length 0
20:15:51.562626 IP 192.168.1.10.50845 > sea15s11-in-f170.1e100.net.https: Flags [.], ack 29923, win 662, options [nop,nop,TS val 2792251 ecr 3605678525], length 0
20:15:51.562649 IP 192.168.1.10.50845 > sea15s11-in-f170.1e100.net.https: Flags [.], ack 31271, win 683, options [nop,nop,TS val 2792251 ecr 3605678528], length 0
20:15:51.564732 IP sea15s11-in-f170.1e100.net.https > 192.168.1.10.50845: Flags [.], seq 33967:35315, ack 1223, win 178, options [nop,nop,TS val 3605678528 ecr 2792247], length 1348
20:15:51.564816 IP sea15s11-in-f170.1e100.net.https > 192.168.1.10.50845: Flags [.], seq 35315:36663, ack 1223, win 178, options [nop,nop,TS val 3605678528 ecr 2792247], length 1348
20:15:51.564937 IP sea15s11-in-f170.1e100.net.https > 192.168.1.10.50845: Flags [.], seq 36663:38011, ack 1223, win 178, options [nop,nop,TS val 3605678533 ecr 2792247], length 1348
20:15:51.564978 IP sea15s11-in-f170.1e100.net.https > 192.168.1.10.50845: Flags [.], seq 38011:39359, ack 1223, win 178, options [nop,nop,TS val 3605678533 ecr 2792247], length 1348
20:15:51.566948 IP 192.168.1.10.50845 > sea15s11-in-f170.1e100.net.https: Flags [.], ack 32619, win 704, options [nop,nop,TS val 2792251 ecr 3605678528], length 0
20:15:51.566962 IP 192.168.1.10.50845 > sea15s11-in-f170.1e100.net.https: Flags [.], ack 33967, win 725, options [nop,nop,TS val 2792251 ecr 3605678528], length 0
20:15:51.566974 IP 192.168.1.10.50845 > sea15s11-in-f170.1e100.net.https: Flags [.], ack 35315, win 746, options [nop,nop,TS val 2792252 ecr 3605678528], length 0
20:15:51.567261 IP sea15s11-in-f170.1e100.net.https > 192.168.1.10.50845: Flags [.], seq 39359:40707, ack 1223, win 178, options [nop,nop,TS val 3605678536 ecr 2792247], length 1348
20:15:51.567320 IP sea15s11-in-f170.1e100.net.https > 192.168.1.10.50845: Flags [.], seq 40707:42055, ack 1223, win 178, options [nop,nop,TS val 3605678536 ecr 2792247], length 1348
20:15:51.569590 IP sea15s11-in-f170.1e100.net.https > 192.168.1.10.50845: Flags [.], seq 42055:43403, ack 1223, win 178, options [nop,nop,TS val 3605678536 ecr 2792247], length 1348
20:15:51.571447 IP 192.168.1.10.50845 > sea15s11-in-f170.1e100.net.https: Flags [.], ack 36663, win 767, options [nop,nop,TS val 2792252 ecr 3605678528], length 0
20:15:51.571461 IP 192.168.1.10.50845 > sea15s11-in-f170.1e100.net.https: Flags [.], ack 38011, win 789, options [nop,nop,TS val 2792252 ecr 3605678533], length 0
20:15:51.571473 IP 192.168.1.10.50845 > sea15s11-in-f170.1e100.net.https: Flags [.], ack 39359, win 810, options [nop,nop,TS val 2792252 ecr 3605678533], length 0
20:15:51.571483 IP 192.168.1.10.50845 > sea15s11-in-f170.1e100.net.https: Flags [.], ack 40707, win 831, options [nop,nop,TS val 2792252 ecr 3605678536], length 0
20:15:51.571495 IP 192.168.1.10.50845 > sea15s11-in-f170.1e100.net.https: Flags [.], ack 42055, win 852, options [nop,nop,TS val 2792252 ecr 3605678536], length 0
20:15:51.572073 IP sea15s11-in-f170.1e100.net.https > 192.168.1.10.50845: Flags [.], seq 43403:44751, ack 1223, win 178, options [nop,nop,TS val 3605678536 ecr 2792247], length 1348
20:15:51.572119 IP sea15s11-in-f170.1e100.net.https > 192.168.1.10.50845: Flags [.], seq 44751:46099, ack 1223, win 178, options [nop,nop,TS val 3605678536 ecr 2792247], length 1348
20:15:51.572221 IP sea15s11-in-f170.1e100.net.https > 192.168.1.10.50845: Flags [.], seq 46099:47447, ack 1223, win 178, options [nop,nop,TS val 3605678538 ecr 2792247], length 1348
20:15:51.572258 IP sea15s11-in-f170.1e100.net.https > 192.168.1.10.50845: Flags [.], seq 47447:48795, ack 1223, win 178, options [nop,nop,TS val 3605678538 ecr 2792247], length 1348
20:15:51.574494 IP sea15s11-in-f170.1e100.net.https > 192.168.1.10.50845: Flags [.], seq 48795:50143, ack 1223, win 178, options [nop,nop,TS val 3605678543 ecr 2792247], length 1348
20:15:51.574535 IP sea15s11-in-f170.1e100.net.https > 192.168.1.10.50845: Flags [.], seq 50143:51491, ack 1223, win 178, options [nop,nop,TS val 3605678543 ecr 2792247], length 1348
20:15:51.574916 IP sea15s11-in-f170.1e100.net.https > 192.168.1.10.50847: Flags [P.], seq 3511:4859, ack 1250, win 178, options [nop,nop,TS val 16756474 ecr 2792245], length 1348
20:15:51.574993 IP sea15s11-in-f170.1e100.net.https > 192.168.1.10.50847: Flags [P.], seq 4859:6207, ack 1250, win 178, options [nop,nop,TS val 16756474 ecr 2792245], length 1348
20:15:51.575094 IP sea15s11-in-f170.1e100.net.https > 192.168.1.10.50847: Flags [.], seq 6207:7555, ack 1250, win 178, options [nop,nop,TS val 16756474 ecr 2792245], length 1348
20:15:51.575133 IP sea15s11-in-f170.1e100.net.https > 192.168.1.10.50847: Flags [P.], seq 7555:7806, ack 1250, win 178, options [nop,nop,TS val 16756474 ecr 2792245], length 251
20:15:51.575345 IP sea15s11-in-f170.1e100.net.https > 192.168.1.10.50847: Flags [P.], seq 7806:9154, ack 1250, win 178, options [nop,nop,TS val 16756474 ecr 2792245], length 1348
20:15:51.575467 IP sea15s11-in-f170.1e100.net.https > 192.168.1.10.50847: Flags [.], seq 9154:10502, ack 1250, win 178, options [nop,nop,TS val 16756475 ecr 2792245], length 1348
20:15:51.575506 IP sea15s11-in-f170.1e100.net.https > 192.168.1.10.50847: Flags [P.], seq 10502:11850, ack 1250, win 178, options [nop,nop,TS val 16756475 ecr 2792245], length 1348
20:15:51.575581 IP sea15s11-in-f170.1e100.net.https > 192.168.1.10.50847: Flags [P.], seq 11850:12202, ack 1250, win 178, options [nop,nop,TS val 16756475 ecr 2792245], length 352
20:15:51.575630 IP sea15s11-in-f170.1e100.net.https > 192.168.1.10.50847: Flags [P.], seq 12202:13550, ack 1250, win 178, options [nop,nop,TS val 16756475 ecr 2792245], length 1348
20:15:51.575757 IP sea15s11-in-f170.1e100.net.https > 192.168.1.10.50847: Flags [.], seq 13550:14898, ack 1250, win 178, options [nop,nop,TS val 16756475 ecr 2792245], length 1348
20:15:51.575788 IP sea15s11-in-f170.1e100.net.https > 192.168.1.10.50847: Flags [P.], seq 14898:16246, ack 1250, win 178, options [nop,nop,TS val 16756475 ecr 2792245], length 1348
20:15:51.576027 IP 192.168.1.10.50845 > sea15s11-in-f170.1e100.net.https: Flags [.], ack 43403, win 873, options [nop,nop,TS val 2792252 ecr 3605678536], length 0
20:15:51.576045 IP 192.168.1.10.50845 > sea15s11-in-f170.1e100.net.https: Flags [.], ack 44751, win 894, options [nop,nop,TS val 2792252 ecr 3605678536], length 0
20:15:51.576057 IP 192.168.1.10.50845 > sea15s11-in-f170.1e100.net.https: Flags [.], ack 46099, win 915, options [nop,nop,TS val 2792252 ecr 3605678536], length 0
20:15:51.576068 IP 192.168.1.10.50845 > sea15s11-in-f170.1e100.net.https: Flags [.], ack 47447, win 936, options [nop,nop,TS val 2792253 ecr 3605678538], length 0
20:15:51.576079 IP 192.168.1.10.50845 > sea15s11-in-f170.1e100.net.https: Flags [.], ack 48795, win 957, options [nop,nop,TS val 2792253 ecr 3605678538], length 0
20:15:51.576946 IP sea15s11-in-f170.1e100.net.https > 192.168.1.10.50845: Flags [.], seq 51491:52839, ack 1223, win 178, options [nop,nop,TS val 3605678543 ecr 2792247], length 1348
20:15:51.577005 IP sea15s11-in-f170.1e100.net.https > 192.168.1.10.50845: Flags [.], seq 52839:54187, ack 1223, win 178, options [nop,nop,TS val 3605678543 ecr 2792247], length 1348
20:15:51.577437 IP sea15s11-in-f170.1e100.net.https > 192.168.1.10.50846: Flags [P.], seq 3513:4861, ack 1250, win 178, options [nop,nop,TS val 802143195 ecr 2792246], length 1348
20:15:51.577513 IP sea15s11-in-f170.1e100.net.https > 192.168.1.10.50846: Flags [P.], seq 4861:6209, ack 1250, win 178, options [nop,nop,TS val 802143195 ecr 2792246], length 1348
20:15:51.577633 IP sea15s11-in-f170.1e100.net.https > 192.168.1.10.50846: Flags [.], seq 6209:7557, ack 1250, win 178, options [nop,nop,TS val 802143195 ecr 2792246], length 1348
20:15:51.577681 IP sea15s11-in-f170.1e100.net.https > 192.168.1.10.50846: Flags [P.], seq 7557:7846, ack 1250, win 178, options [nop,nop,TS val 802143195 ecr 2792246], length 289
20:15:51.578495 IP sea15s11-in-f170.1e100.net.https > 192.168.1.10.50846: Flags [P.], seq 7846:9194, ack 1250, win 178, options [nop,nop,TS val 802143196 ecr 2792246], length 1348
20:15:51.578696 IP sea15s11-in-f170.1e100.net.https > 192.168.1.10.50846: Flags [.], seq 9194:10542, ack 1250, win 178, options [nop,nop,TS val 802143196 ecr 2792246], length 1348
20:15:51.578745 IP sea15s11-in-f170.1e100.net.https > 192.168.1.10.50846: Flags [P.], seq 10542:11890, ack 1250, win 178, options [nop,nop,TS val 802143196 ecr 2792246], length 1348
20:15:51.578908 IP sea15s11-in-f170.1e100.net.https > 192.168.1.10.50846: Flags [P.], seq 11890:12282, ack 1250, win 178, options [nop,nop,TS val 802143196 ecr 2792246], length 392
20:15:51.579029 IP sea15s11-in-f170.1e100.net.https > 192.168.1.10.50847: Flags [P.], seq 16246:16619, ack 1250, win 178, options [nop,nop,TS val 16756475 ecr 2792245], length 373
20:15:51.579107 IP sea15s11-in-f170.1e100.net.https > 192.168.1.10.50846: Flags [P.], seq 12282:13630, ack 1250, win 178, options [nop,nop,TS val 802143196 ecr 2792246], length 1348
20:15:51.579170 IP sea15s11-in-f170.1e100.net.https > 192.168.1.10.50847: Flags [P.], seq 16619:17967, ack 1250, win 178, options [nop,nop,TS val 16756475 ecr 2792245], length 1348
20:15:51.579274 IP sea15s11-in-f170.1e100.net.https > 192.168.1.10.50846: Flags [.], seq 13630:14978, ack 1250, win 178, options [nop,nop,TS val 802143196 ecr 2792246], length 1348
20:15:51.579300 IP sea15s11-in-f170.1e100.net.https > 192.168.1.10.50846: Flags [P.], seq 14978:16326, ack 1250, win 178, options [nop,nop,TS val 802143196 ecr 2792246], length 1348
20:15:51.579441 IP sea15s11-in-f170.1e100.net.https > 192.168.1.10.50847: Flags [.], seq 17967:19315, ack 1250, win 178, options [nop,nop,TS val 16756475 ecr 2792245], length 1348
20:15:51.579497 IP sea15s11-in-f170.1e100.net.https > 192.168.1.10.50845: Flags [.], seq 54187:55535, ack 1223, win 178, options [nop,nop,TS val 3605678545 ecr 2792247], length 1348
20:15:51.580343 IP 192.168.1.10.50845 > sea15s11-in-f170.1e100.net.https: Flags [.], ack 50143, win 978, options [nop,nop,TS val 2792253 ecr 3605678543], length 0
20:15:51.582123 IP sea15s11-in-f170.1e100.net.https > 192.168.1.10.50846: Flags [.], seq 16326:17674, ack 1250, win 178, options [nop,nop,TS val 802143196 ecr 2792246], length 1348
20:15:51.582226 IP sea15s11-in-f170.1e100.net.https > 192.168.1.10.50846: Flags [.], seq 17674:19022, ack 1250, win 178, options [nop,nop,TS val 802143196 ecr 2792246], length 1348
20:15:51.585433 IP sea15s11-in-f170.1e100.net.https > 192.168.1.10.50846: Flags [.], seq 19022:20370, ack 1250, win 178, options [nop,nop,TS val 802143196 ecr 2792246], length 1348
20:15:51.588488 IP sea15s11-in-f170.1e100.net.https > 192.168.1.10.50845: Flags [.], seq 55535:56883, ack 1223, win 178, options [nop,nop,TS val 3605678559 ecr 2792250], length 1348
20:15:51.588552 IP sea15s11-in-f170.1e100.net.https > 192.168.1.10.50845: Flags [.], seq 56883:58231, ack 1223, win 178, options [nop,nop,TS val 3605678559 ecr 2792250], length 1348
20:15:51.588584 IP sea15s11-in-f170.1e100.net.https > 192.168.1.10.50845: Flags [.], seq 58231:59579, ack 1223, win 178, options [nop,nop,TS val 3605678559 ecr 2792250], length 1348
20:15:51.588613 IP sea15s11-in-f170.1e100.net.https > 192.168.1.10.50845: Flags [.], seq 59579:60927, ack 1223, win 178, options [nop,nop,TS val 3605678559 ecr 2792250], length 1348
20:15:51.589479 IP sea15s11-in-f170.1e100.net.https > 192.168.1.10.50845: Flags [.], seq 60927:62275, ack 1223, win 178, options [nop,nop,TS val 3605678559 ecr 2792251], length 1348
20:15:51.589523 IP sea15s11-in-f170.1e100.net.https > 192.168.1.10.50845: Flags [.], seq 62275:63623, ack 1223, win 178, options [nop,nop,TS val 3605678559 ecr 2792251], length 1348
20:15:51.590868 IP 192.168.1.10.50845 > sea15s11-in-f170.1e100.net.https: Flags [.], ack 51491, win 999, options [nop,nop,TS val 2792253 ecr 3605678543], length 0
20:15:51.590883 IP 192.168.1.10.50847 > sea15s11-in-f170.1e100.net.https: Flags [.], ack 4859, win 220, options [nop,nop,TS val 2792253 ecr 16756474], length 0
20:15:51.590894 IP 192.168.1.10.50847 > sea15s11-in-f170.1e100.net.https: Flags [.], ack 6207, win 241, options [nop,nop,TS val 2792253 ecr 16756474], length 0
20:15:51.590906 IP 192.168.1.10.50847 > sea15s11-in-f170.1e100.net.https: Flags [.], ack 7555, win 262, options [nop,nop,TS val 2792253 ecr 16756474], length 0
20:15:51.590918 IP 192.168.1.10.50847 > sea15s11-in-f170.1e100.net.https: Flags [.], ack 7806, win 283, options [nop,nop,TS val 2792253 ecr 16756474], length 0
20:15:51.590929 IP 192.168.1.10.50847 > sea15s11-in-f170.1e100.net.https: Flags [.], ack 9154, win 304, options [nop,nop,TS val 2792253 ecr 16756474], length 0
20:15:51.590940 IP 192.168.1.10.50847 > sea15s11-in-f170.1e100.net.https: Flags [.], ack 10502, win 325, options [nop,nop,TS val 2792253 ecr 16756475], length 0
20:15:51.590952 IP 192.168.1.10.50847 > sea15s11-in-f170.1e100.net.https: Flags [.], ack 11850, win 346, options [nop,nop,TS val 2792253 ecr 16756475], length 0
20:15:51.590962 IP 192.168.1.10.50847 > sea15s11-in-f170.1e100.net.https: Flags [.], ack 12202, win 367, options [nop,nop,TS val 2792253 ecr 16756475], length 0
20:15:51.590973 IP 192.168.1.10.50847 > sea15s11-in-f170.1e100.net.https: Flags [.], ack 13550, win 388, options [nop,nop,TS val 2792253 ecr 16756475], length 0
20:15:51.590996 IP 192.168.1.10.50847 > sea15s11-in-f170.1e100.net.https: Flags [.], ack 14898, win 409, options [nop,nop,TS val 2792253 ecr 16756475], length 0
20:15:51.591007 IP 192.168.1.10.50847 > sea15s11-in-f170.1e100.net.https: Flags [.], ack 16246, win 430, options [nop,nop,TS val 2792253 ecr 16756475], length 0
20:15:51.591695 IP sea15s11-in-f170.1e100.net.https > 192.168.1.10.50845: Flags [.], seq 63623:64971, ack 1223, win 178, options [nop,nop,TS val 3605678559 ecr 2792251], length 1348
20:15:51.591761 IP sea15s11-in-f170.1e100.net.https > 192.168.1.10.50845: Flags [.], seq 64971:66319, ack 1223, win 178, options [nop,nop,TS val 3605678559 ecr 2792251], length 1348
20:15:51.593282 IP sea15s11-in-f170.1e100.net.https > 192.168.1.10.50845: Flags [.], seq 66319:67667, ack 1223, win 178, options [nop,nop,TS val 3605678560 ecr 2792251], length 1348
20:15:51.593406 IP sea15s11-in-f170.1e100.net.https > 192.168.1.10.50845: Flags [.], seq 67667:69015, ack 1223, win 178, options [nop,nop,TS val 3605678564 ecr 2792251], length 1348
20:15:51.593446 IP sea15s11-in-f170.1e100.net.https > 192.168.1.10.50845: Flags [.], seq 69015:70363, ack 1223, win 178, options [nop,nop,TS val 3605678564 ecr 2792251], length 1348
20:15:51.595224 IP sea15s11-in-f170.1e100.net.https > 192.168.1.10.50845: Flags [.], seq 70363:71711, ack 1223, win 178, options [nop,nop,TS val 3605678564 ecr 2792251], length 1348
20:15:51.595267 IP sea15s11-in-f170.1e100.net.https > 192.168.1.10.50845: Flags [.], seq 71711:73059, ack 1223, win 178, options [nop,nop,TS val 3605678564 ecr 2792251], length 1348
20:15:51.595361 IP 192.168.1.10.50845 > sea15s11-in-f170.1e100.net.https: Flags [.], ack 52839, win 1020, options [nop,nop,TS val 2792253 ecr 3605678543], length 0
20:15:51.595376 IP 192.168.1.10.50845 > sea15s11-in-f170.1e100.net.https: Flags [.], ack 54187, win 1041, options [nop,nop,TS val 2792253 ecr 3605678543], length 0
20:15:51.595400 IP 192.168.1.10.50846 > sea15s11-in-f170.1e100.net.https: Flags [.], ack 4861, win 220, options [nop,nop,TS val 2792253 ecr 802143195], length 0
20:15:51.595411 IP 192.168.1.10.50846 > sea15s11-in-f170.1e100.net.https: Flags [.], ack 6209, win 241, options [nop,nop,TS val 2792253 ecr 802143195], length 0
20:15:51.595423 IP 192.168.1.10.50846 > sea15s11-in-f170.1e100.net.https: Flags [.], ack 7557, win 262, options [nop,nop,TS val 2792253 ecr 802143195], length 0
20:15:51.595435 IP 192.168.1.10.50846 > sea15s11-in-f170.1e100.net.https: Flags [.], ack 7846, win 283, options [nop,nop,TS val 2792253 ecr 802143195], length 0
20:15:51.597202 IP sea15s11-in-f170.1e100.net.https > 192.168.1.10.50845: Flags [.], seq 73059:74407, ack 1223, win 178, options [nop,nop,TS val 3605678564 ecr 2792251], length 1348
20:15:51.597251 IP sea15s11-in-f170.1e100.net.https > 192.168.1.10.50845: Flags [.], seq 74407:75755, ack 1223, win 178, options [nop,nop,TS val 3605678564 ecr 2792251], length 1348
20:15:51.599058 IP sea15s11-in-f170.1e100.net.https > 192.168.1.10.50845: Flags [.], seq 75755:77103, ack 1223, win 178, options [nop,nop,TS val 3605678566 ecr 2792251], length 1348
20:15:51.599104 IP sea15s11-in-f170.1e100.net.https > 192.168.1.10.50845: Flags [.], seq 77103:78451, ack 1223, win 178, options [nop,nop,TS val 3605678566 ecr 2792251], length 1348
20:15:51.599566 IP 192.168.1.10.50846 > sea15s11-in-f170.1e100.net.https: Flags [.], ack 9194, win 304, options [nop,nop,TS val 2792253 ecr 802143196], length 0
20:15:51.599581 IP 192.168.1.10.50846 > sea15s11-in-f170.1e100.net.https: Flags [.], ack 10542, win 325, options [nop,nop,TS val 2792253 ecr 802143196], length 0
