tcpdump: verbose output suppressed, use -v or -vv for full protocol decode
listening on wlan0, link-type EN10MB (Ethernet), capture size 262144 bytes
20:15:38.525782 IP 192.168.1.10.43158 > sea15s07-in-f78.1e100.net.www: Flags [S], seq 2626388705, win 14600, options [mss 1460,sackOK,TS val 2339628 ecr 0,nop,wscale 7], length 0
20:15:38.534090 IP sea15s07-in-f78.1e100.net.www > 192.168.1.10.43158: Flags [S.], seq 2876960170, ack 2626388706, win 26960, options [mss 1360,sackOK,TS val 3174799014 ecr 2339628,nop,wscale 7], length 0
20:15:38.539784 IP 192.168.1.10.43158 > sea15s07-in-f78.1e100.net.www: Flags [.], ack 1, win 115, options [nop,nop,TS val 2339630 ecr 3174799014], length 0
20:15:38.556021 IP 192.168.1.10.43158 > sea15s07-in-f78.1e100.net.www: Flags [P.], seq 1:175, ack 1, win 115, options [nop,nop,TS val 2339631 ecr 3174799014], length 174: HTTP: GET /generate_204 HTTP/1.1
20:15:38.564356 IP sea15s07-in-f78.1e100.net.www > 192.168.1.10.43158: Flags [.], ack 175, win 219, options [nop,nop,TS val 3174799021 ecr 2339631], length 0
20:15:38.614606 IP sea15s07-in-f78.1e100.net.www > 192.168.1.10.43158: Flags [P.], seq 1:227, ack 175, win 219, options [nop,nop,TS val 3174799034 ecr 2339631], length 226: HTTP: HTTP/1.1 204 No Content
20:15:38.620425 IP 192.168.1.10.43158 > sea15s07-in-f78.1e100.net.www: Flags [.], ack 227, win 123, options [nop,nop,TS val 2339638 ecr 3174799034], length 0
20:15:41.095039 IP 192.168.1.10.37293 > 213.71.30.150.www: Flags [S], seq 2334603580, win 14600, options [mss 1460,sackOK,TS val 2339885 ecr 0,nop,wscale 7], length 0
20:15:41.103545 IP 213.71.30.150.www > 192.168.1.10.37293: Flags [S.], seq 788177078, ack 2334603581, win 26960, options [mss 1360,sackOK,TS val 3174799656 ecr 2339885,nop,wscale 7], length 0
20:15:41.109297 IP 192.168.1.10.37293 > 213.71.30.150.www: Flags [.], ack 1, win 115, options [nop,nop,TS val 2339887 ecr 3174799656], length 0
20:15:41.113654 IP 192.168.1.10.37293 > 213.71.30.150.www: Flags [P.], seq 1:466, ack 1, win 115, options [nop,nop,TS val 2339887 ecr 3174799656], length 465: HTTP: GET /security/sso/initialize/time HTTP/1.1
20:15:41.122071 IP 213.71.30.150.www > 192.168.1.10.37293: Flags [.], ack 466, win 219, options [nop,nop,TS val 3174799661 ecr 2339887], length 0
20:15:41.605642 IP 213.71.30.150.www > 192.168.1.10.37293: Flags [P.], seq 1:354, ack 466, win 219, options [nop,nop,TS val 3174799781 ecr 2339887], length 353: HTTP: HTTP/1.1 200 OK
20:15:41.605802 IP 213.71.30.150.www > 192.168.1.10.37293: Flags [P.], seq 354:481, ack 466, win 219, options [nop,nop,TS val 3174799781 ecr 2339887], length 127: HTTP
20:15:41.637956 IP 213.71.30.150.www > 192.168.1.10.37293: Flags [P.], seq 354:481, ack 466, win 219, options [nop,nop,TS val 3174799790 ecr 2339887], length 127: HTTP
20:15:41.701111 IP 192.168.1.10.37293 > 213.71.30.150.www: Flags [.], ack 354, win 123, options [nop,nop,TS val 2339945 ecr 3174799781], length 0
20:15:41.802993 IP 192.168.1.10.37293 > 213.71.30.150.www: Flags [.], ack 481, win 123, options [nop,nop,TS val 2339956 ecr 3174799781], length 0
20:15:41.803007 IP 192.168.1.10.37293 > 213.71.30.150.www: Flags [.], ack 481, win 123, options [nop,nop,TS val 2339956 ecr 3174799790,nop,nop,sack 1 {354:481}], length 0
20:15:42.023272 IP 192.168.1.10.56001 > sea15s07-in-f74.1e100.net.https: Flags [S], seq 3488288645, win 14600, options [mss 1460,sackOK,TS val 2339978 ecr 0,nop,wscale 7], length 0
20:15:42.055525 IP sea15s07-in-f74.1e100.net.https > 192.168.1.10.56001: Flags [S.], seq 3824268870, ack 3488288646, win 42408, options [mss 1360,sackOK,TS val 1994429112 ecr 2339978,nop,wscale 8], length 0
20:15:42.062996 IP 192.168.1.10.56001 > sea15s07-in-f74.1e100.net.https: Flags [.], ack 1, win 115, options [nop,nop,TS val 2339982 ecr 1994429112], length 0
20:15:42.111536 IP 192.168.1.10.56001 > sea15s07-in-f74.1e100.net.https: Flags [P.], seq 1:174, ack 1, win 115, options [nop,nop,TS val 2339987 ecr 1994429112], length 173
20:15:42.131034 IP 192.168.1.10.48359 > sea15s11-in-f162.1e100.net.https: Flags [S], seq 92019984, win 14600, options [mss 1460,sackOK,TS val 2339989 ecr 0,nop,wscale 7], length 0
20:15:42.143693 IP sea15s07-in-f74.1e100.net.https > 192.168.1.10.56001: Flags [.], ack 174, win 170, options [nop,nop,TS val 1994429200 ecr 2339987], length 0
20:15:42.152155 IP sea15s07-in-f74.1e100.net.https > 192.168.1.10.56001: Flags [.], seq 1:1349, ack 174, win 170, options [nop,nop,TS val 1994429207 ecr 2339987], length 1348
20:15:42.152227 IP sea15s07-in-f74.1e100.net.https > 192.168.1.10.56001: Flags [.], seq 1349:2697, ack 174, win 170, options [nop,nop,TS val 1994429207 ecr 2339987], length 1348
20:15:42.152257 IP sea15s07-in-f74.1e100.net.https > 192.168.1.10.56001: Flags [P.], seq 2697:3264, ack 174, win 170, options [nop,nop,TS val 1994429207 ecr 2339987], length 567
20:15:42.158133 IP 192.168.1.10.56001 > sea15s07-in-f74.1e100.net.https: Flags [.], ack 1349, win 136, options [nop,nop,TS val 2339991 ecr 1994429207], length 0
20:15:42.158149 IP 192.168.1.10.56001 > sea15s07-in-f74.1e100.net.https: Flags [.], ack 2697, win 157, options [nop,nop,TS val 2339991 ecr 1994429207], length 0
20:15:42.158160 IP 192.168.1.10.56001 > sea15s07-in-f74.1e100.net.https: Flags [.], ack 3264, win 178, options [nop,nop,TS val 2339991 ecr 1994429207], length 0
20:15:42.162347 IP sea15s11-in-f162.1e100.net.https > 192.168.1.10.48359: Flags [S.], seq 1547690348, ack 92019985, win 42408, options [mss 1360,sackOK,TS val 2603754199 ecr 2339989,nop,wscale 8], length 0
20:15:42.168017 IP 192.168.1.10.48359 > sea15s11-in-f162.1e100.net.https: Flags [.], ack 1, win 115, options [nop,nop,TS val 2339992 ecr 2603754199], length 0
20:15:42.172410 IP 192.168.1.10.48359 > sea15s11-in-f162.1e100.net.https: Flags [P.], seq 1:181, ack 1, win 115, options [nop,nop,TS val 2339993 ecr 2603754199], length 180
20:15:42.203688 IP sea15s11-in-f162.1e100.net.https > 192.168.1.10.48359: Flags [.], ack 181, win 170, options [nop,nop,TS val 2603754241 ecr 2339993], length 0
20:15:42.210901 IP sea15s11-in-f162.1e100.net.https > 192.168.1.10.48359: Flags [.], seq 1:1349, ack 181, win 170, options [nop,nop,TS val 2603754248 ecr 2339993], length 1348
20:15:42.211041 IP sea15s11-in-f162.1e100.net.https > 192.168.1.10.48359: Flags [P.], seq 1349:2518, ack 181, win 170, options [nop,nop,TS val 2603754248 ecr 2339993], length 1169
20:15:42.219916 IP 192.168.1.10.48359 > sea15s11-in-f162.1e100.net.https: Flags [.], ack 1349, win 136, options [nop,nop,TS val 2339998 ecr 2603754248], length 0
20:15:42.219933 IP 192.168.1.10.48359 > sea15s11-in-f162.1e100.net.https: Flags [.], ack 2518, win 157, options [nop,nop,TS val 2339998 ecr 2603754248], length 0
20:15:42.298039 IP 192.168.1.10.56001 > sea15s07-in-f74.1e100.net.https: Flags [P.], seq 174:259, ack 3264, win 178, options [nop,nop,TS val 2340005 ecr 1994429207], length 85
20:15:42.330296 IP sea15s07-in-f74.1e100.net.https > 192.168.1.10.56001: Flags [P.], seq 3264:3307, ack 259, win 170, options [nop,nop,TS val 1994429386 ecr 2340005], length 43
20:15:42.336281 IP 192.168.1.10.56001 > sea15s07-in-f74.1e100.net.https: Flags [.], ack 3307, win 178, options [nop,nop,TS val 2340009 ecr 1994429386], length 0
20:15:42.384921 IP 192.168.1.10.56001 > sea15s07-in-f74.1e100.net.https: Flags [P.], seq 259:710, ack 3307, win 178, options [nop,nop,TS val 2340014 ecr 1994429386], length 451
20:15:42.457076 IP sea15s07-in-f74.1e100.net.https > 192.168.1.10.56001: Flags [.], ack 710, win 175, options [nop,nop,TS val 1994429473 ecr 2340014], length 0
20:15:42.475780 IP sea15s07-in-f74.1e100.net.https > 192.168.1.10.56001: Flags [P.], seq 3307:3857, ack 710, win 175, options [nop,nop,TS val 1994429532 ecr 2340014], length 550
20:15:42.479235 IP sea15s07-in-f74.1e100.net.https > 192.168.1.10.56001: Flags [P.], seq 3857:5205, ack 710, win 175, options [nop,nop,TS val 1994429535 ecr 2340014], length 1348
20:15:42.479340 IP sea15s07-in-f74.1e100.net.https > 192.168.1.10.56001: Flags [P.], seq 5205:5427, ack 710, win 175, options [nop,nop,TS val 1994429535 ecr 2340014], length 222
20:15:42.479414 IP sea15s07-in-f74.1e100.net.https > 192.168.1.10.56001: Flags [P.], seq 5427:5453, ack 710, win 175, options [nop,nop,TS val 1994429535 ecr 2340014], length 26
20:15:42.481414 IP 192.168.1.10.56001 > sea15s07-in-f74.1e100.net.https: Flags [.], ack 3857, win 199, options [nop,nop,TS val 2340024 ecr 1994429532], length 0
20:15:42.481427 IP 192.168.1.10.56001 > sea15s07-in-f74.1e100.net.https: Flags [.], ack 5205, win 220, options [nop,nop,TS val 2340024 ecr 1994429535], length 0
20:15:42.481439 IP 192.168.1.10.56001 > sea15s07-in-f74.1e100.net.https: Flags [.], ack 5427, win 241, options [nop,nop,TS val 2340024 ecr 1994429535], length 0
20:15:42.515806 IP 192.168.1.10.56001 > sea15s07-in-f74.1e100.net.https: Flags [.], ack 5453, win 241, options [nop,nop,TS val 2340027 ecr 1994429535], length 0
20:15:42.585096 IP 192.168.1.10.48360 > sea15s11-in-f162.1e100.net.https: Flags [S], seq 1855027469, win 14600, options [mss 1460,sackOK,TS val 2340034 ecr 0,nop,wscale 7], length 0
20:15:42.615603 IP sea15s11-in-f162.1e100.net.https > 192.168.1.10.48360: Flags [S.], seq 279070552, ack 1855027470, win 42408, options [mss 1360,sackOK,TS val 2603754652 ecr 2340034,nop,wscale 8], length 0
20:15:42.629485 IP 192.168.1.10.48360 > sea15s11-in-f162.1e100.net.https: Flags [.], ack 1, win 115, options [nop,nop,TS val 2340039 ecr 2603754652], length 0
20:15:42.698235 IP 192.168.1.10.48360 > sea15s11-in-f162.1e100.net.https: Flags [P.], seq 1:181, ack 1, win 115, options [nop,nop,TS val 2340045 ecr 2603754652], length 180
20:15:42.728756 IP sea15s11-in-f162.1e100.net.https > 192.168.1.10.48360: Flags [.], ack 181, win 170, options [nop,nop,TS val 2603754765 ecr 2340045], length 0
20:15:42.737471 IP sea15s11-in-f162.1e100.net.https > 192.168.1.10.48360: Flags [.], seq 1:1349, ack 181, win 170, options [nop,nop,TS val 2603754773 ecr 2340045], length 1348
20:15:42.737570 IP sea15s11-in-f162.1e100.net.https > 192.168.1.10.48360: Flags [P.], seq 1349:2517, ack 181, win 170, options [nop,nop,TS val 2603754773 ecr 2340045], length 1168
20:15:42.744821 IP 192.168.1.10.48360 > sea15s11-in-f162.1e100.net.https: Flags [.], ack 1349, win 136, options [nop,nop,TS val 2340050 ecr 2603754773], length 0
20:15:42.744840 IP 192.168.1.10.48360 > sea15s11-in-f162.1e100.net.https: Flags [.], ack 2517, win 157, options [nop,nop,TS val 2340050 ecr 2603754773], length 0
20:15:43.116920 IP 192.168.1.10.32907 > server-13-33-151-252.sea4.r.cloudfront.net.www: Flags [S], seq 2076024260, win 14600, options [mss 1460,sackOK,TS val 2340087 ecr 0,nop,wscale 7], length 0
20:15:43.125334 IP server-13-33-151-252.sea4.r.cloudfront.net.www > 192.168.1.10.32907: Flags [S.], seq 2112803267, ack 2076024261, win 26960, options [mss 1360,sackOK,TS val 3174800161 ecr 2340087,nop,wscale 7], length 0
20:15:43.132362 IP 192.168.1.10.32907 > server-13-33-151-252.sea4.r.cloudfront.net.www: Flags [.], ack 1, win 115, options [nop,nop,TS val 2340089 ecr 3174800161], length 0
20:15:43.179883 IP 192.168.1.10.32907 > server-13-33-151-252.sea4.r.cloudfront.net.www: Flags [P.], seq 1:482, ack 1, win 115, options [nop,nop,TS val 2340094 ecr 3174800161], length 481: HTTP: GET /firmware/BNN/SM-T530NU/version.xml HTTP/1.1
20:15:43.188463 IP server-13-33-151-252.sea4.r.cloudfront.net.www > 192.168.1.10.32907: Flags [.], ack 482, win 219, options [nop,nop,TS val 3174800177 ecr 2340094], length 0
20:15:43.325858 IP 192.168.1.10.57265 > sea15s11-in-f10.1e100.net.https: Flags [S], seq 3850641026, win 14600, options [mss 1460,sackOK,TS val 2340108 ecr 0,nop,wscale 7], length 0
20:15:43.355183 IP sea15s11-in-f10.1e100.net.https > 192.168.1.10.57265: Flags [S.], seq 294597228, ack 3850641027, win 42408, options [mss 1360,sackOK,TS val 1212656830 ecr 2340108,nop,wscale 8], length 0
20:15:43.360760 IP 192.168.1.10.57265 > sea15s11-in-f10.1e100.net.https: Flags [.], ack 1, win 115, options [nop,nop,TS val 2340112 ecr 1212656830], length 0
20:15:43.394770 IP 192.168.1.10.57265 > sea15s11-in-f10.1e100.net.https: Flags [P.], seq 1:170, ack 1, win 115, options [nop,nop,TS val 2340115 ecr 1212656830], length 169
20:15:43.424112 IP sea15s11-in-f10.1e100.net.https > 192.168.1.10.57265: Flags [.], ack 170, win 170, options [nop,nop,TS val 1212656898 ecr 2340115], length 0
20:15:43.431322 IP sea15s11-in-f10.1e100.net.https > 192.168.1.10.57265: Flags [.], seq 1:1349, ack 170, win 170, options [nop,nop,TS val 1212656906 ecr 2340115], length 1348
20:15:43.431383 IP sea15s11-in-f10.1e100.net.https > 192.168.1.10.57265: Flags [.], seq 1349:2697, ack 170, win 170, options [nop,nop,TS val 1212656906 ecr 2340115], length 1348
20:15:43.431416 IP sea15s11-in-f10.1e100.net.https > 192.168.1.10.57265: Flags [P.], seq 2697:3236, ack 170, win 170, options [nop,nop,TS val 1212656906 ecr 2340115], length 539
20:15:43.437278 IP 192.168.1.10.57265 > sea15s11-in-f10.1e100.net.https: Flags [.], ack 1349, win 136, options [nop,nop,TS val 2340119 ecr 1212656906], length 0
20:15:43.437295 IP 192.168.1.10.57265 > sea15s11-in-f10.1e100.net.https: Flags [.], ack 2697, win 157, options [nop,nop,TS val 2340119 ecr 1212656906], length 0
20:15:43.437308 IP 192.168.1.10.57265 > sea15s11-in-f10.1e100.net.https: Flags [.], ack 3236, win 178, options [nop,nop,TS val 2340119 ecr 1212656906], length 0
20:15:43.565945 IP 192.168.1.10.51520 > pf-in-f188.1e100.net.5228: Flags [S], seq 1261324920, win 14600, options [mss 1460,sackOK,TS val 2340132 ecr 0,nop,wscale 7], length 0
20:15:43.566623 IP server-13-33-151-252.sea4.r.cloudfront.net.www > 192.168.1.10.32907: Flags [.], seq 1:1349, ack 482, win 219, options [nop,nop,TS val 3174800272 ecr 2340094], length 1348: HTTP: HTTP/1.1 403 Forbidden
20:15:43.566713 IP server-13-33-151-252.sea4.r.cloudfront.net.www > 192.168.1.10.32907: Flags [.], seq 1349:2697, ack 482, win 219, options [nop,nop,TS val 3174800272 ecr 2340094], length 1348: HTTP
20:15:43.566748 IP server-13-33-151-252.sea4.r.cloudfront.net.www > 192.168.1.10.32907: Flags [.], seq 2697:4045, ack 482, win 219, options [nop,nop,TS val 3174800272 ecr 2340094], length 1348: HTTP
20:15:43.566778 IP server-13-33-151-252.sea4.r.cloudfront.net.www > 192.168.1.10.32907: Flags [P.], seq 4045:4081, ack 482, win 219, options [nop,nop,TS val 3174800272 ecr 2340094], length 36: HTTP
20:15:43.570295 IP 192.168.1.10.32907 > server-13-33-151-252.sea4.r.cloudfront.net.www: Flags [.], ack 1349, win 136, options [nop,nop,TS val 2340133 ecr 3174800272], length 0
20:15:43.570313 IP 192.168.1.10.32907 > server-13-33-151-252.sea4.r.cloudfront.net.www: Flags [.], ack 2697, win 157, options [nop,nop,TS val 2340133 ecr 3174800272], length 0
20:15:43.570325 IP 192.168.1.10.32907 > server-13-33-151-252.sea4.r.cloudfront.net.www: Flags [.], ack 4045, win 178, options [nop,nop,TS val 2340133 ecr 3174800272], length 0
20:15:43.570336 IP 192.168.1.10.32907 > server-13-33-151-252.sea4.r.cloudfront.net.www: Flags [.], ack 4081, win 178, options [nop,nop,TS val 2340133 ecr 3174800272], length 0
20:15:43.586879 IP pf-in-f188.1e100.net.5228 > 192.168.1.10.51520: Flags [S.], seq 3986180896, ack 1261324921, win 42408, options [mss 1360,sackOK,TS val 336023831 ecr 2340132,nop,wscale 8], length 0
20:15:43.592515 IP 192.168.1.10.51520 > pf-in-f188.1e100.net.5228: Flags [.], ack 1, win 115, options [nop,nop,TS val 2340135 ecr 336023831], length 0
20:15:43.592532 IP 192.168.1.10.51520 > pf-in-f188.1e100.net.5228: Flags [P.], seq 1:169, ack 1, win 115, options [nop,nop,TS val 2340135 ecr 336023831], length 168
20:15:43.613463 IP pf-in-f188.1e100.net.5228 > 192.168.1.10.51520: Flags [.], ack 169, win 170, options [nop,nop,TS val 336023858 ecr 2340135], length 0
20:15:43.613939 IP pf-in-f188.1e100.net.5228 > 192.168.1.10.51520: Flags [.], seq 1:1349, ack 169, win 170, options [nop,nop,TS val 336023858 ecr 2340135], length 1348
20:15:43.613995 IP pf-in-f188.1e100.net.5228 > 192.168.1.10.51520: Flags [.], seq 1349:2697, ack 169, win 170, options [nop,nop,TS val 336023858 ecr 2340135], length 1348
20:15:43.614083 IP pf-in-f188.1e100.net.5228 > 192.168.1.10.51520: Flags [.], seq 2697:4045, ack 169, win 170, options [nop,nop,TS val 336023858 ecr 2340135], length 1348
20:15:43.614116 IP pf-in-f188.1e100.net.5228 > 192.168.1.10.51520: Flags [P.], seq 4045:4110, ack 169, win 170, options [nop,nop,TS val 336023858 ecr 2340135], length 65
20:15:43.620179 IP 192.168.1.10.51520 > pf-in-f188.1e100.net.5228: Flags [.], ack 1349, win 136, options [nop,nop,TS val 2340138 ecr 336023858], length 0
20:15:43.620193 IP 192.168.1.10.51520 > pf-in-f188.1e100.net.5228: Flags [.], ack 2697, win 157, options [nop,nop,TS val 2340138 ecr 336023858], length 0
20:15:43.620204 IP 192.168.1.10.51520 > pf-in-f188.1e100.net.5228: Flags [.], ack 4045, win 178, options [nop,nop,TS val 2340138 ecr 336023858], length 0
20:15:43.620214 IP 192.168.1.10.51520 > pf-in-f188.1e100.net.5228: Flags [.], ack 4110, win 178, options [nop,nop,TS val 2340138 ecr 336023858], length 0
20:15:43.672425 IP 192.168.1.10.51520 > pf-in-f188.1e100.net.5228: Flags [P.], seq 169:254, ack 4110, win 178, options [nop,nop,TS val 2340143 ecr 336023858], length 85
20:15:43.693605 IP pf-in-f188.1e100.net.5228 > 192.168.1.10.51520: Flags [P.], seq 4110:4386, ack 254, win 170, options [nop,nop,TS val 336023938 ecr 2340143], length 276
20:15:43.694908 IP 192.168.1.10.51520 > pf-in-f188.1e100.net.5228: Flags [.], ack 4386, win 199, options [nop,nop,TS val 2340146 ecr 336023938], length 0
20:15:43.769326 IP 192.168.1.10.57265 > sea15s11-in-f10.1e100.net.https: Flags [P.], seq 170:255, ack 3236, win 178, options [nop,nop,TS val 2340153 ecr 1212656906], length 85
20:15:43.792218 IP 192.168.1.10.35943 > sea15s07-in-f67.1e100.net.https: Flags [S], seq 3971955284, win 14600, options [mss 1460,sackOK,TS val 2340155 ecr 0,nop,wscale 7], length 0
20:15:43.799226 IP sea15s11-in-f10.1e100.net.https > 192.168.1.10.57265: Flags [P.], seq 3236:3512, ack 255, win 170, options [nop,nop,TS val 1212657273 ecr 2340153], length 276
20:15:43.800449 IP 192.168.1.10.57265 > sea15s11-in-f10.1e100.net.https: Flags [.], ack 3512, win 199, options [nop,nop,TS val 2340156 ecr 1212657273], length 0
20:15:43.822649 IP sea15s07-in-f67.1e100.net.https > 192.168.1.10.35943: Flags [S.], seq 457144616, ack 3971955285, win 42408, options [mss 1360,sackOK,TS val 2398426148 ecr 2340155,nop,wscale 8], length 0
20:15:43.823943 IP 192.168.1.10.35943 > sea15s07-in-f67.1e100.net.https: Flags [.], ack 1, win 115, options [nop,nop,TS val 2340158 ecr 2398426148], length 0
20:15:43.935096 IP 192.168.1.10.57265 > sea15s11-in-f10.1e100.net.https: Flags [P.], seq 255:1260, ack 3512, win 199, options [nop,nop,TS val 2340169 ecr 1212657273], length 1005
20:15:43.996268 IP sea15s11-in-f10.1e100.net.https > 192.168.1.10.57265: Flags [P.], seq 3512:4860, ack 1260, win 178, options [nop,nop,TS val 1212657471 ecr 2340169], length 1348
20:15:43.996457 IP sea15s11-in-f10.1e100.net.https > 192.168.1.10.57265: Flags [P.], seq 4860:6208, ack 1260, win 178, options [nop,nop,TS val 1212657471 ecr 2340169], length 1348
20:15:43.997057 IP sea15s11-in-f10.1e100.net.https > 192.168.1.10.57265: Flags [.], seq 6208:7556, ack 1260, win 178, options [nop,nop,TS val 1212657471 ecr 2340169], length 1348
20:15:43.997122 IP sea15s11-in-f10.1e100.net.https > 192.168.1.10.57265: Flags [P.], seq 7556:7738, ack 1260, win 178, options [nop,nop,TS val 1212657471 ecr 2340169], length 182
20:15:43.998063 IP sea15s11-in-f10.1e100.net.https > 192.168.1.10.57265: Flags [.], seq 7738:9086, ack 1260, win 178, options [nop,nop,TS val 1212657471 ecr 2340169], length 1348
20:15:43.998131 IP sea15s11-in-f10.1e100.net.https > 192.168.1.10.57265: Flags [P.], seq 9086:10434, ack 1260, win 178, options [nop,nop,TS val 1212657471 ecr 2340169], length 1348
20:15:43.998255 IP 192.168.1.10.57265 > sea15s11-in-f10.1e100.net.https: Flags [.], ack 4860, win 220, options [nop,nop,TS val 2340176 ecr 1212657471], length 0
20:15:43.998447 IP 192.168.1.10.57265 > sea15s11-in-f10.1e100.net.https: Flags [.], ack 6208, win 241, options [nop,nop,TS val 2340176 ecr 1212657471], length 0
20:15:43.998660 IP 192.168.1.10.57265 > sea15s11-in-f10.1e100.net.https: Flags [.], ack 7556, win 262, options [nop,nop,TS val 2340176 ecr 1212657471], length 0
20:15:43.998675 IP 192.168.1.10.57265 > sea15s11-in-f10.1e100.net.https: Flags [.], ack 7738, win 283, options [nop,nop,TS val 2340176 ecr 1212657471], length 0
20:15:43.999446 IP 192.168.1.10.57265 > sea15s11-in-f10.1e100.net.https: Flags [.], ack 9086, win 304, options [nop,nop,TS val 2340176 ecr 1212657471], length 0
20:15:43.999683 IP 192.168.1.10.57265 > sea15s11-in-f10.1e100.net.https: Flags [.], ack 10434, win 325, options [nop,nop,TS val 2340176 ecr 1212657471], length 0
20:15:43.999764 IP sea15s11-in-f10.1e100.net.https > 192.168.1.10.57265: Flags [P.], seq 10434:11782, ack 1260, win 178, options [nop,nop,TS val 1212657471 ecr 2340169], length 1348
20:15:44.000625 IP sea15s11-in-f10.1e100.net.https > 192.168.1.10.57265: Flags [P.], seq 11782:11958, ack 1260, win 178, options [nop,nop,TS val 1212657471 ecr 2340169], length 176
20:15:44.000763 IP sea15s11-in-f10.1e100.net.https > 192.168.1.10.57265: Flags [P.], seq 11958:13306, ack 1260, win 178, options [nop,nop,TS val 1212657471 ecr 2340169], length 1348
20:15:44.001048 IP 192.168.1.10.57265 > sea15s11-in-f10.1e100.net.https: Flags [.], ack 11782, win 346, options [nop,nop,TS val 2340176 ecr 1212657471], length 0
20:15:44.001680 IP sea15s11-in-f10.1e100.net.https > 192.168.1.10.57265: Flags [.], seq 13306:14654, ack 1260, win 178, options [nop,nop,TS val 1212657471 ecr 2340169], length 1348
20:15:44.001745 IP sea15s11-in-f10.1e100.net.https > 192.168.1.10.57265: Flags [P.], seq 14654:16002, ack 1260, win 178, options [nop,nop,TS val 1212657471 ecr 2340169], length 1348
20:15:44.001829 IP 192.168.1.10.57265 > sea15s11-in-f10.1e100.net.https: Flags [.], ack 11958, win 367, options [nop,nop,TS val 2340176 ecr 1212657471], length 0
20:15:44.002116 IP 192.168.1.10.57265 > sea15s11-in-f10.1e100.net.https: Flags [.], ack 13306, win 388, options [nop,nop,TS val 2340176 ecr 1212657471], length 0
20:15:44.002909 IP 192.168.1.10.57265 > sea15s11-in-f10.1e100.net.https: Flags [.], ack 14654, win 409, options [nop,nop,TS val 2340176 ecr 1212657471], length 0
20:15:44.003152 IP 192.168.1.10.57265 > sea15s11-in-f10.1e100.net.https: Flags [.], ack 16002, win 430, options [nop,nop,TS val 2340176 ecr 1212657471], length 0
20:15:44.003378 IP sea15s11-in-f10.1e100.net.https > 192.168.1.10.57265: Flags [.], seq 16002:17350, ack 1260, win 178, options [nop,nop,TS val 1212657471 ecr 2340169], length 1348
20:15:44.003428 IP sea15s11-in-f10.1e100.net.https > 192.168.1.10.57265: Flags [.], seq 17350:18698, ack 1260, win 178, options [nop,nop,TS val 1212657471 ecr 2340169], length 1348
20:15:44.004779 IP 192.168.1.10.57265 > sea15s11-in-f10.1e100.net.https: Flags [.], ack 17350, win 452, options [nop,nop,TS val 2340177 ecr 1212657471], length 0
20:15:44.004916 IP 192.168.1.10.57265 > sea15s11-in-f10.1e100.net.https: Flags [.], ack 18698, win 473, options [nop,nop,TS val 2340177 ecr 1212657471], length 0
20:15:44.005075 IP sea15s11-in-f10.1e100.net.https > 192.168.1.10.57265: Flags [.], seq 18698:20046, ack 1260, win 178, options [nop,nop,TS val 1212657471 ecr 2340169], length 1348
20:15:44.006274 IP 192.168.1.10.57265 > sea15s11-in-f10.1e100.net.https: Flags [.], ack 20046, win 494, options [nop,nop,TS val 2340177 ecr 1212657471], length 0
20:15:44.027605 IP sea15s11-in-f10.1e100.net.https > 192.168.1.10.57265: Flags [.], seq 20046:21394, ack 1260, win 178, options [nop,nop,TS val 1212657502 ecr 2340176], length 1348
20:15:44.027714 IP sea15s11-in-f10.1e100.net.https > 192.168.1.10.57265: Flags [.], seq 21394:22742, ack 1260, win 178, options [nop,nop,TS val 1212657502 ecr 2340176], length 1348
20:15:44.028885 IP sea15s11-in-f10.1e100.net.https > 192.168.1.10.57265: Flags [.], seq 22742:24090, ack 1260, win 178, options [nop,nop,TS val 1212657502 ecr 2340176], length 1348
20:15:44.029180 IP sea15s11-in-f10.1e100.net.https > 192.168.1.10.57265: Flags [.], seq 24090:25438, ack 1260, win 178, options [nop,nop,TS val 1212657502 ecr 2340176], length 1348
20:15:44.029312 IP 192.168.1.10.57265 > sea15s11-in-f10.1e100.net.https: Flags [.], ack 21394, win 515, options [nop,nop,TS val 2340179 ecr 1212657502], length 0
20:15:44.030163 IP 192.168.1.10.57265 > sea15s11-in-f10.1e100.net.https: Flags [.], ack 22742, win 536, options [nop,nop,TS val 2340179 ecr 1212657502], length 0
20:15:44.030286 IP 192.168.1.10.57265 > sea15s11-in-f10.1e100.net.https: Flags [.], ack 24090, win 557, options [nop,nop,TS val 2340179 ecr 1212657502], length 0
20:15:44.030525 IP 192.168.1.10.57265 > sea15s11-in-f10.1e100.net.https: Flags [.], ack 25438, win 578, options [nop,nop,TS val 2340179 ecr 1212657502], length 0
20:15:44.031724 IP sea15s11-in-f10.1e100.net.https > 192.168.1.10.57265: Flags [.], seq 25438:26786, ack 1260, win 178, options [nop,nop,TS val 1212657502 ecr 2340176], length 1348
20:15:44.031773 IP sea15s11-in-f10.1e100.net.https > 192.168.1.10.57265: Flags [.], seq 26786:28134, ack 1260, win 178, options [nop,nop,TS val 1212657502 ecr 2340176], length 1348
20:15:44.034620 IP sea15s11-in-f10.1e100.net.https > 192.168.1.10.57265: Flags [.], seq 28134:29482, ack 1260, win 178, options [nop,nop,TS val 1212657503 ecr 2340176], length 1348
20:15:44.034679 IP sea15s11-in-f10.1e100.net.https > 192.168.1.10.57265: Flags [.], seq 29482:30830, ack 1260, win 178, options [nop,nop,TS val 1212657503 ecr 2340176], length 1348
20:15:44.034443 IP 192.168.1.10.57265 > sea15s11-in-f10.1e100.net.https: Flags [.], ack 26786, win 599, options [nop,nop,TS val 2340179 ecr 1212657502], length 0
20:15:44.034918 IP 192.168.1.10.57265 > sea15s11-in-f10.1e100.net.https: Flags [.], ack 28134, win 620, options [nop,nop,TS val 2340179 ecr 1212657502], length 0
20:15:44.036228 IP 192.168.1.10.57265 > sea15s11-in-f10.1e100.net.https: Flags [.], ack 29482, win 641, options [nop,nop,TS val 2340180 ecr 1212657503], length 0
20:15:44.036506 IP 192.168.1.10.57265 > sea15s11-in-f10.1e100.net.https: Flags [.], ack 30830, win 662, options [nop,nop,TS val 2340180 ecr 1212657503], length 0
20:15:44.036858 IP sea15s11-in-f10.1e100.net.https > 192.168.1.10.57265: Flags [P.], seq 30830:32178, ack 1260, win 178, options [nop,nop,TS val 1212657506 ecr 2340176], length 1348
20:15:44.037063 IP sea15s11-in-f10.1e100.net.https > 192.168.1.10.57265: Flags [.], seq 32178:33526, ack 1260, win 178, options [nop,nop,TS val 1212657506 ecr 2340176], length 1348
20:15:44.037135 IP sea15s11-in-f10.1e100.net.https > 192.168.1.10.57265: Flags [.], seq 33526:34874, ack 1260, win 178, options [nop,nop,TS val 1212657506 ecr 2340176], length 1348
20:15:44.038700 IP 192.168.1.10.57265 > sea15s11-in-f10.1e100.net.https: Flags [.], ack 32178, win 683, options [nop,nop,TS val 2340180 ecr 1212657506], length 0
20:15:44.038725 IP 192.168.1.10.57265 > sea15s11-in-f10.1e100.net.https: Flags [.], ack 33526, win 704, options [nop,nop,TS val 2340180 ecr 1212657506], length 0
20:15:44.039183 IP sea15s11-in-f10.1e100.net.https > 192.168.1.10.57265: Flags [.], seq 34874:36222, ack 1260, win 178, options [nop,nop,TS val 1212657509 ecr 2340177], length 1348
20:15:44.039258 IP sea15s11-in-f10.1e100.net.https > 192.168.1.10.57265: Flags [.], seq 36222:37570, ack 1260, win 178, options [nop,nop,TS val 1212657509 ecr 2340177], length 1348
20:15:44.039333 IP 192.168.1.10.57265 > sea15s11-in-f10.1e100.net.https: Flags [.], ack 34874, win 725, options [nop,nop,TS val 2340180 ecr 1212657506], length 0
20:15:44.040706 IP 192.168.1.10.57265 > sea15s11-in-f10.1e100.net.https: Flags [.], ack 36222, win 746, options [nop,nop,TS val 2340180 ecr 1212657509], length 0
20:15:44.040980 IP 192.168.1.10.57265 > sea15s11-in-f10.1e100.net.https: Flags [.], ack 37570, win 767, options [nop,nop,TS val 2340180 ecr 1212657509], length 0
20:15:44.041404 IP sea15s11-in-f10.1e100.net.https > 192.168.1.10.57265: Flags [.], seq 37570:38918, ack 1260, win 178, options [nop,nop,TS val 1212657511 ecr 2340177], length 1348
20:15:44.041488 IP sea15s11-in-f10.1e100.net.https > 192.168.1.10.57265: Flags [.], seq 38918:40266, ack 1260, win 178, options [nop,nop,TS val 1212657511 ecr 2340177], length 1348
20:15:44.042828 IP 192.168.1.10.57265 > sea15s11-in-f10.1e100.net.https: Flags [.], ack 38918, win 789, options [nop,nop,TS val 2340180 ecr 1212657511], length 0
20:15:44.043054 IP 192.168.1.10.57265 > sea15s11-in-f10.1e100.net.https: Flags [.], ack 40266, win 810, options [nop,nop,TS val 2340180 ecr 1212657511], length 0
20:15:44.043655 IP sea15s11-in-f10.1e100.net.https > 192.168.1.10.57265: Flags [.], seq 40266:41614, ack 1260, win 178, options [nop,nop,TS val 1212657513 ecr 2340177], length 1348
20:15:44.043722 IP sea15s11-in-f10.1e100.net.https > 192.168.1.10.57265: Flags [.], seq 41614:42962, ack 1260, win 178, options [nop,nop,TS val 1212657513 ecr 2340177], length 1348
20:15:44.044392 IP sea15s11-in-f10.1e100.net.https > 192.168.1.10.57265: Flags [.], seq 42962:44310, ack 1260, win 178, options [nop,nop,TS val 1212657516 ecr 2340177], length 1348
20:15:44.045311 IP 192.168.1.10.57265 > sea15s11-in-f10.1e100.net.https: Flags [.], ack 41614, win 831, options [nop,nop,TS val 2340181 ecr 1212657513], length 0
20:15:44.045334 IP 192.168.1.10.57265 > sea15s11-in-f10.1e100.net.https: Flags [.], ack 42962, win 852, options [nop,nop,TS val 2340181 ecr 1212657513], length 0
20:15:44.045601 IP 192.168.1.10.57265 > sea15s11-in-f10.1e100.net.https: Flags [.], ack 44310, win 873, options [nop,nop,TS val 2340181 ecr 1212657516], length 0
20:15:44.045854 IP sea15s11-in-f10.1e100.net.https > 192.168.1.10.57265: Flags [.], seq 44310:45658, ack 1260, win 178, options [nop,nop,TS val 1212657516 ecr 2340177], length 1348
20:15:44.046125 IP sea15s11-in-f10.1e100.net.https > 192.168.1.10.57265: Flags [.], seq 45658:47006, ack 1260, win 178, options [nop,nop,TS val 1212657516 ecr 2340177], length 1348
20:15:44.047215 IP 192.168.1.10.57265 > sea15s11-in-f10.1e100.net.https: Flags [.], ack 45658, win 894, options [nop,nop,TS val 2340181 ecr 1212657516], length 0
20:15:44.047445 IP 192.168.1.10.57265 > sea15s11-in-f10.1e100.net.https: Flags [.], ack 47006, win 915, options [nop,nop,TS val 2340181 ecr 1212657516], length 0
20:15:44.048186 IP sea15s11-in-f10.1e100.net.https > 192.168.1.10.57265: Flags [.], seq 47006:48354, ack 1260, win 178, options [nop,nop,TS val 1212657518 ecr 2340177], length 1348
20:15:44.048269 IP sea15s11-in-f10.1e100.net.https > 192.168.1.10.57265: Flags [.], seq 48354:49702, ack 1260, win 178, options [nop,nop,TS val 1212657518 ecr 2340177], length 1348
20:15:44.050480 IP sea15s11-in-f10.1e100.net.https > 192.168.1.10.57265: Flags [.], seq 49702:51050, ack 1260, win 178, options [nop,nop,TS val 1212657520 ecr 2340177], length 1348
20:15:44.050580 IP sea15s11-in-f10.1e100.net.https > 192.168.1.10.57265: Flags [.], seq 51050:52398, ack 1260, win 178, options [nop,nop,TS val 1212657520 ecr 2340177], length 1348
20:15:44.052721 IP sea15s11-in-f10.1e100.net.https > 192.168.1.10.57265: Flags [.], seq 52398:53746, ack 1260, win 178, options [nop,nop,TS val 1212657522 ecr 2340177], length 1348
20:15:44.052804 IP sea15s11-in-f10.1e100.net.https > 192.168.1.10.57265: Flags [.], seq 53746:55094, ack 1260, win 178, options [nop,nop,TS val 1212657522 ecr 2340177], length 1348
20:15:44.053445 IP sea15s11-in-f10.1e100.net.https > 192.168.1.10.57265: Flags [.], seq 55094:56442, ack 1260, win 178, options [nop,nop,TS val 1212657525 ecr 2340177], length 1348
20:15:44.058574 IP sea15s11-in-f10.1e100.net.https > 192.168.1.10.57265: Flags [.], seq 56442:57790, ack 1260, win 178, options [nop,nop,TS val 1212657533 ecr 2340179], length 1348
20:15:44.058624 IP sea15s11-in-f10.1e100.net.https > 192.168.1.10.57265: Flags [.], seq 57790:59138, ack 1260, win 178, options [nop,nop,TS val 1212657533 ecr 2340179], length 1348
20:15:44.059425 IP sea15s11-in-f10.1e100.net.https > 192.168.1.10.57265: Flags [.], seq 59138:60486, ack 1260, win 178, options [nop,nop,TS val 1212657534 ecr 2340179], length 1348
20:15:44.059471 IP sea15s11-in-f10.1e100.net.https > 192.168.1.10.57265: Flags [.], seq 60486:61834, ack 1260, win 178, options [nop,nop,TS val 1212657534 ecr 2340179], length 1348
20:15:44.061198 IP sea15s11-in-f10.1e100.net.https > 192.168.1.10.57265: Flags [.], seq 61834:63182, ack 1260, win 178, options [nop,nop,TS val 1212657534 ecr 2340179], length 1348
20:15:44.061260 IP sea15s11-in-f10.1e100.net.https > 192.168.1.10.57265: Flags [.], seq 63182:64530, ack 1260, win 178, options [nop,nop,TS val 1212657534 ecr 2340179], length 1348
20:15:44.061290 IP sea15s11-in-f10.1e100.net.https > 192.168.1.10.57265: Flags [.], seq 64530:65878, ack 1260, win 178, options [nop,nop,TS val 1212657534 ecr 2340179], length 1348
20:15:44.061315 IP sea15s11-in-f10.1e100.net.https > 192.168.1.10.57265: Flags [.], seq 65878:67226, ack 1260, win 178, options [nop,nop,TS val 1212657534 ecr 2340179], length 1348
20:15:44.061440 IP 192.168.1.10.57265 > sea15s11-in-f10.1e100.net.https: Flags [.], ack 48354, win 936, options [nop,nop,TS val 2340182 ecr 1212657518], length 0
20:15:44.061455 IP 192.168.1.10.57265 > sea15s11-in-f10.1e100.net.https: Flags [.], ack 49702, win 957, options [nop,nop,TS val 2340182 ecr 1212657518], length 0
20:15:44.061474 IP 192.168.1.10.57265 > sea15s11-in-f10.1e100.net.https: Flags [.], ack 51050, win 978, options [nop,nop,TS val 2340182 ecr 1212657520], length 0
20:15:44.061524 IP 192.168.1.10.57265 > sea15s11-in-f10.1e100.net.https: Flags [.], ack 52398, win 999, options [nop,nop,TS val 2340182 ecr 1212657520], length 0
20:15:44.061534 IP 192.168.1.10.57265 > sea15s11-in-f10.1e100.net.https: Flags [.], ack 53746, win 1020, options [nop,nop,TS val 2340182 ecr 1212657522], length 0
20:15:44.061543 IP 192.168.1.10.57265 > sea15s11-in-f10.1e100.net.https: Flags [.], ack 55094, win 1041, options [nop,nop,TS val 2340182 ecr 1212657522], length 0
20:15:44.061554 IP 192.168.1.10.57265 > sea15s11-in-f10.1e100.net.https: Flags [.], ack 56442, win 1062, options [nop,nop,TS val 2340182 ecr 1212657525], length 0
20:15:44.061985 IP 192.168.1.10.57265 > sea15s11-in-f10.1e100.net.https: Flags [.], ack 57790, win 1083, options [nop,nop,TS val 2340182 ecr 1212657533], length 0
20:15:44.064400 IP 192.168.1.10.57265 > sea15s11-in-f10.1e100.net.https: Flags [.], ack 59138, win 1104, options [nop,nop,TS val 2340182 ecr 1212657533], length 0
20:15:44.064412 IP 192.168.1.10.57265 > sea15s11-in-f10.1e100.net.https: Flags [.], ack 60486, win 1126, options [nop,nop,TS val 2340182 ecr 1212657534], length 0
20:15:44.064421 IP 192.168.1.10.57265 > sea15s11-in-f10.1e100.net.https: Flags [.], ack 61834, win 1147, options [nop,nop,TS val 2340182 ecr 1212657534], length 0
20:15:44.064430 IP 192.168.1.10.57265 > sea15s11-in-f10.1e100.net.https: Flags [.], ack 63182, win 1168, options [nop,nop,TS val 2340182 ecr 1212657534], length 0
20:15:44.064439 IP 192.168.1.10.57265 > sea15s11-in-f10.1e100.net.https: Flags [.], ack 64530, win 1189, options [nop,nop,TS val 2340182 ecr 1212657534], length 0
20:15:44.064453 IP 192.168.1.10.57265 > sea15s11-in-f10.1e100.net.https: Flags [.], ack 65878, win 1210, options [nop,nop,TS val 2340182 ecr 1212657534], length 0
20:15:44.064575 IP sea15s11-in-f10.1e100.net.https > 192.168.1.10.57265: Flags [.], seq 67226:68574, ack 1260, win 178, options [nop,nop,TS val 1212657535 ecr 2340179], length 1348
20:15:44.064871 IP 192.168.1.10.57265 > sea15s11-in-f10.1e100.net.https: Flags [.], ack 67226, win 1231, options [nop,nop,TS val 2340182 ecr 1212657534], length 0
20:15:44.065354 IP sea15s11-in-f10.1e100.net.https > 192.168.1.10.57265: Flags [.], seq 68574:69922, ack 1260, win 178, options [nop,nop,TS val 1212657538 ecr 2340179], length 1348
20:15:44.065902 IP 192.168.1.10.57265 > sea15s11-in-f10.1e100.net.https: Flags [.], ack 68574, win 1252, options [nop,nop,TS val 2340183 ecr 1212657535], length 0
20:15:44.066217 IP sea15s11-in-f10.1e100.net.https > 192.168.1.10.57265: Flags [.], seq 69922:71270, ack 1260, win 178, options [nop,nop,TS val 1212657538 ecr 2340179], length 1348
20:15:44.066658 IP 192.168.1.10.57265 > sea15s11-in-f10.1e100.net.https: Flags [.], ack 69922, win 1273, options [nop,nop,TS val 2340183 ecr 1212657538], length 0
20:15:44.067113 IP sea15s11-in-f10.1e100.net.https > 192.168.1.10.57265: Flags [.], seq 71270:72618, ack 1260, win 178, options [nop,nop,TS val 1212657538 ecr 2340179], length 1348
20:15:44.067165 IP sea15s11-in-f10.1e100.net.https > 192.168.1.10.57265: Flags [.], seq 72618:73966, ack 1260, win 178, options [nop,nop,TS val 1212657538 ecr 2340179], length 1348
20:15:44.067428 IP 192.168.1.10.57265 > sea15s11-in-f10.1e100.net.https: Flags [.], ack 71270, win 1294, options [nop,nop,TS val 2340183 ecr 1212657538], length 0
20:15:44.068421 IP 192.168.1.10.57265 > sea15s11-in-f10.1e100.net.https: Flags [.], ack 72618, win 1315, options [nop,nop,TS val 2340183 ecr 1212657538], length 0
20:15:44.068841 IP sea15s11-in-f10.1e100.net.https > 192.168.1.10.57265: Flags [.], seq 73966:75314, ack 1260, win 178, options [nop,nop,TS val 1212657540 ecr 2340180], length 1348
20:15:44.068891 IP sea15s11-in-f10.1e100.net.https > 192.168.1.10.57265: Flags [.], seq 75314:76662, ack 1260, win 178, options [nop,nop,TS val 1212657540 ecr 2340180], length 1348
20:15:44.068793 IP 192.168.1.10.57265 > sea15s11-in-f10.1e100.net.https: Flags [.], ack 73966, win 1336, options [nop,nop,TS val 2340183 ecr 1212657538], length 0
20:15:44.070288 IP 192.168.1.10.57265 > sea15s11-in-f10.1e100.net.https: Flags [.], ack 75314, win 1357, options [nop,nop,TS val 2340183 ecr 1212657540], length 0
20:15:44.070548 IP sea15s11-in-f10.1e100.net.https > 192.168.1.10.57265: Flags [.], seq 76662:78010, ack 1260, win 178, options [nop,nop,TS val 1212657540 ecr 2340180], length 1348
20:15:44.070588 IP sea15s11-in-f10.1e100.net.https > 192.168.1.10.57265: Flags [.], seq 78010:79358, ack 1260, win 178, options [nop,nop,TS val 1212657540 ecr 2340180], length 1348
20:15:44.070642 IP 192.168.1.10.57265 > sea15s11-in-f10.1e100.net.https: Flags [.], ack 76662, win 1378, options [nop,nop,TS val 2340183 ecr 1212657540], length 0
20:15:44.072037 IP 192.168.1.10.57265 > sea15s11-in-f10.1e100.net.https: Flags [.], ack 78010, win 1399, options [nop,nop,TS val 2340183 ecr 1212657540], length 0
20:15:44.072268 IP sea15s11-in-f10.1e100.net.https > 192.168.1.10.57265: Flags [.], seq 79358:80706, ack 1260, win 178, options [nop,nop,TS val 1212657542 ecr 2340180], length 1348
20:15:44.072505 IP 192.168.1.10.57265 > sea15s11-in-f10.1e100.net.https: Flags [.], ack 79358, win 1420, options [nop,nop,TS val 2340183 ecr 1212657540], length 0
20:15:44.073140 IP sea15s11-in-f10.1e100.net.https > 192.168.1.10.57265: Flags [.], seq 80706:82054, ack 1260, win 178, options [nop,nop,TS val 1212657542 ecr 2340180], length 1348
20:15:44.073183 IP sea15s11-in-f10.1e100.net.https > 192.168.1.10.57265: Flags [.], seq 82054:83402, ack 1260, win 178, options [nop,nop,TS val 1212657542 ecr 2340180], length 1348
20:15:44.073533 IP 192.168.1.10.57265 > sea15s11-in-f10.1e100.net.https: Flags [.], ack 80706, win 1441, options [nop,nop,TS val 2340183 ecr 1212657542], length 0
20:15:44.074538 IP 192.168.1.10.57265 > sea15s11-in-f10.1e100.net.https: Flags [.], ack 82054, win 1463, options [nop,nop,TS val 2340183 ecr 1212657542], length 0
20:15:44.074899 IP sea15s11-in-f10.1e100.net.https > 192.168.1.10.57265: Flags [.], seq 83402:84750, ack 1260, win 178, options [nop,nop,TS val 1212657543 ecr 2340180], length 1348
20:15:44.074943 IP sea15s11-in-f10.1e100.net.https > 192.168.1.10.57265: Flags [.], seq 84750:86098, ack 1260, win 178, options [nop,nop,TS val 1212657543 ecr 2340180], length 1348
