tcpdump: verbose output suppressed, use -v or -vv for full protocol decode
listening on wlan0, link-type EN10MB (Ethernet), capture size 262144 bytes
20:16:10.118832 IP 192.168.1.10.39888 > sea15s02-in-f14.1e100.net.https: Flags [S], seq 921831294, win 14600, options [mss 1460,sackOK,TS val 677411 ecr 0,nop,wscale 7], length 0
20:16:10.149062 IP sea15s02-in-f14.1e100.net.https > 192.168.1.10.39888: Flags [S.], seq 3007092010, ack 921831295, win 42408, options [mss 1360,sackOK,TS val 3375199453 ecr 677411,nop,wscale 8], length 0
20:16:10.154824 IP 192.168.1.10.39888 > sea15s02-in-f14.1e100.net.https: Flags [.], ack 1, win 115, options [nop,nop,TS val 677415 ecr 3375199453], length 0
20:16:10.194168 IP 192.168.1.10.39888 > sea15s02-in-f14.1e100.net.https: Flags [P.], seq 1:174, ack 1, win 115, options [nop,nop,TS val 677419 ecr 3375199453], length 173
20:16:10.197462 IP 192.168.1.10.60931 > sea15s11-in-f10.1e100.net.https: Flags [S], seq 1144432722, win 14600, options [mss 1460,sackOK,TS val 677419 ecr 0,nop,wscale 7], length 0
20:16:10.224426 IP sea15s02-in-f14.1e100.net.https > 192.168.1.10.39888: Flags [.], ack 174, win 170, options [nop,nop,TS val 3375199528 ecr 677419], length 0
20:16:10.226744 IP sea15s11-in-f10.1e100.net.https > 192.168.1.10.60931: Flags [S.], seq 2815481557, ack 1144432723, win 42408, options [mss 1360,sackOK,TS val 2728623877 ecr 677419,nop,wscale 8], length 0
20:16:10.232106 IP sea15s02-in-f14.1e100.net.https > 192.168.1.10.39888: Flags [.], seq 1:1349, ack 174, win 170, options [nop,nop,TS val 3375199536 ecr 677419], length 1348
20:16:10.232203 IP sea15s02-in-f14.1e100.net.https > 192.168.1.10.39888: Flags [.], seq 1349:2697, ack 174, win 170, options [nop,nop,TS val 3375199536 ecr 677419], length 1348
20:16:10.232236 IP sea15s02-in-f14.1e100.net.https > 192.168.1.10.39888: Flags [.], seq 2697:4045, ack 174, win 170, options [nop,nop,TS val 3375199536 ecr 677419], length 1348
20:16:10.232265 IP sea15s02-in-f14.1e100.net.https > 192.168.1.10.39888: Flags [P.], seq 4045:4140, ack 174, win 170, options [nop,nop,TS val 3375199536 ecr 677419], length 95
20:16:10.238722 IP 192.168.1.10.60931 > sea15s11-in-f10.1e100.net.https: Flags [.], ack 1, win 115, options [nop,nop,TS val 677423 ecr 2728623877], length 0
20:16:10.239436 IP 192.168.1.10.39888 > sea15s02-in-f14.1e100.net.https: Flags [.], ack 1349, win 136, options [nop,nop,TS val 677423 ecr 3375199536], length 0
20:16:10.241913 IP 192.168.1.10.60931 > sea15s11-in-f10.1e100.net.https: Flags [P.], seq 1:170, ack 1, win 115, options [nop,nop,TS val 677424 ecr 2728623877], length 169
20:16:10.250510 IP 192.168.1.10.39888 > sea15s02-in-f14.1e100.net.https: Flags [.], ack 2697, win 157, options [nop,nop,TS val 677424 ecr 3375199536], length 0
20:16:10.250953 IP 192.168.1.10.39888 > sea15s02-in-f14.1e100.net.https: Flags [.], ack 4045, win 178, options [nop,nop,TS val 677425 ecr 3375199536], length 0
20:16:10.258207 IP 192.168.1.10.39888 > sea15s02-in-f14.1e100.net.https: Flags [.], ack 4140, win 178, options [nop,nop,TS val 677425 ecr 3375199536], length 0
20:16:10.264220 IP 192.168.1.10.40939 > sea15s12-in-f202.1e100.net.https: Flags [S], seq 2636437014, win 14600, options [mss 1460,sackOK,TS val 677426 ecr 0,nop,wscale 7], length 0
20:16:10.271062 IP sea15s11-in-f10.1e100.net.https > 192.168.1.10.60931: Flags [.], ack 170, win 170, options [nop,nop,TS val 2728623921 ecr 677424], length 0
20:16:10.278406 IP sea15s11-in-f10.1e100.net.https > 192.168.1.10.60931: Flags [.], seq 1:1349, ack 170, win 170, options [nop,nop,TS val 2728623929 ecr 677424], length 1348
20:16:10.278509 IP sea15s11-in-f10.1e100.net.https > 192.168.1.10.60931: Flags [.], seq 1349:2697, ack 170, win 170, options [nop,nop,TS val 2728623929 ecr 677424], length 1348
20:16:10.278541 IP sea15s11-in-f10.1e100.net.https > 192.168.1.10.60931: Flags [P.], seq 2697:3236, ack 170, win 170, options [nop,nop,TS val 2728623929 ecr 677424], length 539
20:16:10.287210 IP 192.168.1.10.60931 > sea15s11-in-f10.1e100.net.https: Flags [.], ack 1349, win 136, options [nop,nop,TS val 677428 ecr 2728623929], length 0
20:16:10.287437 IP 192.168.1.10.60931 > sea15s11-in-f10.1e100.net.https: Flags [.], ack 2697, win 157, options [nop,nop,TS val 677428 ecr 2728623929], length 0
20:16:10.293546 IP 192.168.1.10.60931 > sea15s11-in-f10.1e100.net.https: Flags [.], ack 3236, win 178, options [nop,nop,TS val 677429 ecr 2728623929], length 0
20:16:10.295428 IP sea15s12-in-f202.1e100.net.https > 192.168.1.10.40939: Flags [S.], seq 4079347158, ack 2636437015, win 42408, options [mss 1360,sackOK,TS val 3360306396 ecr 677426,nop,wscale 8], length 0
20:16:10.308330 IP 192.168.1.10.40939 > sea15s12-in-f202.1e100.net.https: Flags [.], ack 1, win 115, options [nop,nop,TS val 677430 ecr 3360306396], length 0
20:16:10.308352 IP 192.168.1.10.40939 > sea15s12-in-f202.1e100.net.https: Flags [P.], seq 1:174, ack 1, win 115, options [nop,nop,TS val 677430 ecr 3360306396], length 173
20:16:10.336828 IP 192.168.1.10.39888 > sea15s02-in-f14.1e100.net.https: Flags [P.], seq 174:259, ack 4140, win 178, options [nop,nop,TS val 677433 ecr 3375199536], length 85
20:16:10.339589 IP sea15s12-in-f202.1e100.net.https > 192.168.1.10.40939: Flags [.], ack 174, win 170, options [nop,nop,TS val 3360306440 ecr 677430], length 0
20:16:10.347669 IP sea15s12-in-f202.1e100.net.https > 192.168.1.10.40939: Flags [.], seq 1:1349, ack 174, win 170, options [nop,nop,TS val 3360306448 ecr 677430], length 1348
20:16:10.347779 IP sea15s12-in-f202.1e100.net.https > 192.168.1.10.40939: Flags [.], seq 1349:2697, ack 174, win 170, options [nop,nop,TS val 3360306448 ecr 677430], length 1348
20:16:10.347814 IP sea15s12-in-f202.1e100.net.https > 192.168.1.10.40939: Flags [P.], seq 2697:3263, ack 174, win 170, options [nop,nop,TS val 3360306448 ecr 677430], length 566
20:16:10.360340 IP 192.168.1.10.40939 > sea15s12-in-f202.1e100.net.https: Flags [.], ack 1349, win 136, options [nop,nop,TS val 677435 ecr 3360306448], length 0
20:16:10.360546 IP 192.168.1.10.40939 > sea15s12-in-f202.1e100.net.https: Flags [.], ack 2697, win 157, options [nop,nop,TS val 677436 ecr 3360306448], length 0
20:16:10.366335 IP 192.168.1.10.40939 > sea15s12-in-f202.1e100.net.https: Flags [.], ack 3263, win 178, options [nop,nop,TS val 677436 ecr 3360306448], length 0
20:16:10.367192 IP sea15s02-in-f14.1e100.net.https > 192.168.1.10.39888: Flags [P.], seq 4140:4183, ack 259, win 170, options [nop,nop,TS val 3375199671 ecr 677433], length 43
20:16:10.377718 IP 192.168.1.10.39888 > sea15s02-in-f14.1e100.net.https: Flags [.], ack 4183, win 178, options [nop,nop,TS val 677437 ecr 3375199671], length 0
20:16:10.395942 IP 192.168.1.10.60931 > sea15s11-in-f10.1e100.net.https: Flags [P.], seq 170:255, ack 3236, win 178, options [nop,nop,TS val 677439 ecr 2728623929], length 85
20:16:10.396419 IP 192.168.1.10.40939 > sea15s12-in-f202.1e100.net.https: Flags [P.], seq 174:259, ack 3263, win 178, options [nop,nop,TS val 677439 ecr 3360306448], length 85
20:16:10.425561 IP sea15s11-in-f10.1e100.net.https > 192.168.1.10.60931: Flags [P.], seq 3236:3512, ack 255, win 170, options [nop,nop,TS val 2728624076 ecr 677439], length 276
20:16:10.427560 IP sea15s12-in-f202.1e100.net.https > 192.168.1.10.40939: Flags [P.], seq 3263:3306, ack 259, win 170, options [nop,nop,TS val 3360306528 ecr 677439], length 43
20:16:10.449665 IP 192.168.1.10.60931 > sea15s11-in-f10.1e100.net.https: Flags [.], ack 3512, win 199, options [nop,nop,TS val 677444 ecr 2728624076], length 0
20:16:10.490085 IP 192.168.1.10.40939 > sea15s12-in-f202.1e100.net.https: Flags [.], ack 3306, win 178, options [nop,nop,TS val 677449 ecr 3360306528], length 0
20:16:10.546100 IP 192.168.1.10.40939 > sea15s12-in-f202.1e100.net.https: Flags [P.], seq 259:709, ack 3306, win 178, options [nop,nop,TS val 677454 ecr 3360306528], length 450
20:16:10.617622 IP sea15s12-in-f202.1e100.net.https > 192.168.1.10.40939: Flags [.], ack 709, win 175, options [nop,nop,TS val 3360306677 ecr 677454], length 0
20:16:10.767470 IP 192.168.1.10.60931 > sea15s11-in-f10.1e100.net.https: Flags [P.], seq 255:1203, ack 3512, win 199, options [nop,nop,TS val 677476 ecr 2728624076], length 948
20:16:10.769052 IP sea15s12-in-f202.1e100.net.https > 192.168.1.10.40939: Flags [P.], seq 3306:3856, ack 709, win 175, options [nop,nop,TS val 3360306869 ecr 677454], length 550
20:16:10.769604 IP sea15s12-in-f202.1e100.net.https > 192.168.1.10.40939: Flags [P.], seq 3856:5204, ack 709, win 175, options [nop,nop,TS val 3360306870 ecr 677454], length 1348
20:16:10.769707 IP sea15s12-in-f202.1e100.net.https > 192.168.1.10.40939: Flags [P.], seq 5204:5312, ack 709, win 175, options [nop,nop,TS val 3360306870 ecr 677454], length 108
20:16:10.769917 IP sea15s12-in-f202.1e100.net.https > 192.168.1.10.40939: Flags [P.], seq 5312:5408, ack 709, win 175, options [nop,nop,TS val 3360306870 ecr 677454], length 96
20:16:10.769995 IP sea15s12-in-f202.1e100.net.https > 192.168.1.10.40939: Flags [P.], seq 5408:5434, ack 709, win 175, options [nop,nop,TS val 3360306870 ecr 677454], length 26
20:16:10.775848 IP 192.168.1.10.57106 > agentportal.flurry.vip.gq1.yahoo.com.www: Flags [S], seq 3837240521, win 14600, options [mss 1460,sackOK,TS val 677477 ecr 0,nop,wscale 7], length 0
20:16:10.784078 IP 192.168.1.10.40939 > sea15s12-in-f202.1e100.net.https: Flags [.], ack 3856, win 199, options [nop,nop,TS val 677478 ecr 3360306869], length 0
20:16:10.784450 IP agentportal.flurry.vip.gq1.yahoo.com.www > 192.168.1.10.57106: Flags [S.], seq 3066101579, ack 3837240522, win 26960, options [mss 1360,sackOK,TS val 3174807803 ecr 677477,nop,wscale 7], length 0
20:16:10.793268 IP 192.168.1.10.40939 > sea15s12-in-f202.1e100.net.https: Flags [.], ack 5204, win 220, options [nop,nop,TS val 677479 ecr 3360306870], length 0
20:16:10.793283 IP 192.168.1.10.40939 > sea15s12-in-f202.1e100.net.https: Flags [.], ack 5312, win 220, options [nop,nop,TS val 677479 ecr 3360306870], length 0
20:16:10.793301 IP 192.168.1.10.40939 > sea15s12-in-f202.1e100.net.https: Flags [.], ack 5408, win 220, options [nop,nop,TS val 677479 ecr 3360306870], length 0
20:16:10.793312 IP 192.168.1.10.40939 > sea15s12-in-f202.1e100.net.https: Flags [.], ack 5434, win 220, options [nop,nop,TS val 677479 ecr 3360306870], length 0
20:16:10.798087 IP 192.168.1.10.57106 > agentportal.flurry.vip.gq1.yahoo.com.www: Flags [.], ack 1, win 115, options [nop,nop,TS val 677479 ecr 3174807803], length 0
20:16:10.798665 IP 192.168.1.10.57106 > agentportal.flurry.vip.gq1.yahoo.com.www: Flags [P.], seq 1:134, ack 1, win 115, options [nop,nop,TS val 677479 ecr 3174807803], length 133: HTTP: POST /aap.do HTTP/1.1
20:16:10.799541 IP 192.168.1.10.57106 > agentportal.flurry.vip.gq1.yahoo.com.www: Flags [P.], seq 134:406, ack 1, win 115, options [nop,nop,TS val 677479 ecr 3174807803], length 272: HTTP
20:16:10.806899 IP agentportal.flurry.vip.gq1.yahoo.com.www > 192.168.1.10.57106: Flags [.], ack 134, win 219, options [nop,nop,TS val 3174807809 ecr 677479], length 0
20:16:10.807743 IP agentportal.flurry.vip.gq1.yahoo.com.www > 192.168.1.10.57106: Flags [.], ack 406, win 228, options [nop,nop,TS val 3174807809 ecr 677479], length 0
20:16:10.828589 IP 192.168.1.10.39888 > sea15s02-in-f14.1e100.net.https: Flags [P.], seq 259:675, ack 4183, win 178, options [nop,nop,TS val 677482 ecr 3375199671], length 416
20:16:10.828916 IP sea15s11-in-f10.1e100.net.https > 192.168.1.10.60931: Flags [P.], seq 4860:6208, ack 1203, win 178, options [nop,nop,TS val 2728624479 ecr 677476], length 1348
20:16:10.829066 IP sea15s11-in-f10.1e100.net.https > 192.168.1.10.60931: Flags [P.], seq 3512:4860, ack 1203, win 178, options [nop,nop,TS val 2728624479 ecr 677476], length 1348
20:16:10.829256 IP sea15s11-in-f10.1e100.net.https > 192.168.1.10.60931: Flags [.], seq 6208:7556, ack 1203, win 178, options [nop,nop,TS val 2728624479 ecr 677476], length 1348
20:16:10.829302 IP sea15s11-in-f10.1e100.net.https > 192.168.1.10.60931: Flags [P.], seq 7556:7878, ack 1203, win 178, options [nop,nop,TS val 2728624479 ecr 677476], length 322
20:16:10.830277 IP sea15s11-in-f10.1e100.net.https > 192.168.1.10.60931: Flags [P.], seq 7878:9226, ack 1203, win 178, options [nop,nop,TS val 2728624481 ecr 677476], length 1348
20:16:10.830556 IP sea15s11-in-f10.1e100.net.https > 192.168.1.10.60931: Flags [.], seq 9226:10574, ack 1203, win 178, options [nop,nop,TS val 2728624481 ecr 677476], length 1348
20:16:10.830661 IP sea15s11-in-f10.1e100.net.https > 192.168.1.10.60931: Flags [P.], seq 10574:11922, ack 1203, win 178, options [nop,nop,TS val 2728624481 ecr 677476], length 1348
20:16:10.830785 IP sea15s11-in-f10.1e100.net.https > 192.168.1.10.60931: Flags [P.], seq 11922:12156, ack 1203, win 178, options [nop,nop,TS val 2728624481 ecr 677476], length 234
20:16:10.830925 IP sea15s11-in-f10.1e100.net.https > 192.168.1.10.60931: Flags [P.], seq 12156:13504, ack 1203, win 178, options [nop,nop,TS val 2728624481 ecr 677476], length 1348
20:16:10.831046 IP sea15s11-in-f10.1e100.net.https > 192.168.1.10.60931: Flags [.], seq 13504:14852, ack 1203, win 178, options [nop,nop,TS val 2728624481 ecr 677476], length 1348
20:16:10.831064 IP sea15s11-in-f10.1e100.net.https > 192.168.1.10.60931: Flags [P.], seq 14852:16200, ack 1203, win 178, options [nop,nop,TS val 2728624481 ecr 677476], length 1348
20:16:10.833830 IP sea15s11-in-f10.1e100.net.https > 192.168.1.10.60931: Flags [.], seq 16200:17548, ack 1203, win 178, options [nop,nop,TS val 2728624481 ecr 677476], length 1348
20:16:10.833927 IP sea15s11-in-f10.1e100.net.https > 192.168.1.10.60931: Flags [.], seq 17548:18896, ack 1203, win 178, options [nop,nop,TS val 2728624481 ecr 677476], length 1348
20:16:10.834312 IP 192.168.1.10.60931 > sea15s11-in-f10.1e100.net.https: Flags [.], ack 3512, win 199, options [nop,nop,TS val 677483 ecr 2728624076,nop,nop,sack 1 {4860:6208}], length 0
20:16:10.834328 IP 192.168.1.10.60931 > sea15s11-in-f10.1e100.net.https: Flags [.], ack 6208, win 220, options [nop,nop,TS val 677483 ecr 2728624479], length 0
20:16:10.834339 IP 192.168.1.10.60931 > sea15s11-in-f10.1e100.net.https: Flags [.], ack 7556, win 241, options [nop,nop,TS val 677483 ecr 2728624479], length 0
20:16:10.834348 IP 192.168.1.10.60931 > sea15s11-in-f10.1e100.net.https: Flags [.], ack 9226, win 283, options [nop,nop,TS val 677483 ecr 2728624481], length 0
20:16:10.834358 IP 192.168.1.10.60931 > sea15s11-in-f10.1e100.net.https: Flags [.], ack 10574, win 304, options [nop,nop,TS val 677483 ecr 2728624481], length 0
20:16:10.834367 IP 192.168.1.10.60931 > sea15s11-in-f10.1e100.net.https: Flags [.], ack 12156, win 346, options [nop,nop,TS val 677483 ecr 2728624481], length 0
20:16:10.834391 IP 192.168.1.10.60931 > sea15s11-in-f10.1e100.net.https: Flags [.], ack 13504, win 367, options [nop,nop,TS val 677483 ecr 2728624481], length 0
20:16:10.834851 IP 192.168.1.10.60931 > sea15s11-in-f10.1e100.net.https: Flags [.], ack 16200, win 409, options [nop,nop,TS val 677483 ecr 2728624481], length 0
20:16:10.835980 IP 192.168.1.10.60931 > sea15s11-in-f10.1e100.net.https: Flags [.], ack 17548, win 430, options [nop,nop,TS val 677483 ecr 2728624481], length 0
20:16:10.836176 IP 192.168.1.10.60931 > sea15s11-in-f10.1e100.net.https: Flags [.], ack 18896, win 452, options [nop,nop,TS val 677483 ecr 2728624481], length 0
20:16:10.837089 IP sea15s11-in-f10.1e100.net.https > 192.168.1.10.60931: Flags [.], seq 18896:20244, ack 1203, win 178, options [nop,nop,TS val 2728624481 ecr 677476], length 1348
20:16:10.842720 IP 192.168.1.10.60931 > sea15s11-in-f10.1e100.net.https: Flags [.], ack 20244, win 473, options [nop,nop,TS val 677483 ecr 2728624481], length 0
20:16:10.863933 IP sea15s11-in-f10.1e100.net.https > 192.168.1.10.60931: Flags [.], seq 20244:21592, ack 1203, win 178, options [nop,nop,TS val 2728624514 ecr 677483], length 1348
20:16:10.864045 IP sea15s11-in-f10.1e100.net.https > 192.168.1.10.60931: Flags [.], seq 21592:22940, ack 1203, win 178, options [nop,nop,TS val 2728624514 ecr 677483], length 1348
20:16:10.865552 IP sea15s11-in-f10.1e100.net.https > 192.168.1.10.60931: Flags [.], seq 22940:24288, ack 1203, win 178, options [nop,nop,TS val 2728624514 ecr 677483], length 1348
20:16:10.865618 IP sea15s11-in-f10.1e100.net.https > 192.168.1.10.60931: Flags [.], seq 24288:25636, ack 1203, win 178, options [nop,nop,TS val 2728624514 ecr 677483], length 1348
20:16:10.865925 IP 192.168.1.10.60931 > sea15s11-in-f10.1e100.net.https: Flags [.], ack 21592, win 494, options [nop,nop,TS val 677486 ecr 2728624514], length 0
20:16:10.866068 IP 192.168.1.10.60931 > sea15s11-in-f10.1e100.net.https: Flags [.], ack 22940, win 515, options [nop,nop,TS val 677486 ecr 2728624514], length 0
20:16:10.867215 IP 192.168.1.10.60931 > sea15s11-in-f10.1e100.net.https: Flags [.], ack 24288, win 536, options [nop,nop,TS val 677486 ecr 2728624514], length 0
20:16:10.867563 IP 192.168.1.10.60931 > sea15s11-in-f10.1e100.net.https: Flags [.], ack 25636, win 557, options [nop,nop,TS val 677486 ecr 2728624514], length 0
20:16:10.867854 IP sea15s11-in-f10.1e100.net.https > 192.168.1.10.60931: Flags [.], seq 25636:26984, ack 1203, win 178, options [nop,nop,TS val 2728624514 ecr 677483], length 1348
20:16:10.867989 IP sea15s11-in-f10.1e100.net.https > 192.168.1.10.60931: Flags [.], seq 26984:28332, ack 1203, win 178, options [nop,nop,TS val 2728624514 ecr 677483], length 1348
20:16:10.869840 IP 192.168.1.10.60931 > sea15s11-in-f10.1e100.net.https: Flags [.], ack 26984, win 578, options [nop,nop,TS val 677486 ecr 2728624514], length 0
20:16:10.870181 IP sea15s11-in-f10.1e100.net.https > 192.168.1.10.60931: Flags [.], seq 28332:29680, ack 1203, win 178, options [nop,nop,TS val 2728624518 ecr 677483], length 1348
20:16:10.870259 IP sea15s11-in-f10.1e100.net.https > 192.168.1.10.60931: Flags [.], seq 29680:31028, ack 1203, win 178, options [nop,nop,TS val 2728624518 ecr 677483], length 1348
20:16:10.870335 IP 192.168.1.10.60931 > sea15s11-in-f10.1e100.net.https: Flags [.], ack 28332, win 599, options [nop,nop,TS val 677486 ecr 2728624514], length 0
20:16:10.872075 IP 192.168.1.10.60931 > sea15s11-in-f10.1e100.net.https: Flags [.], ack 29680, win 620, options [nop,nop,TS val 677487 ecr 2728624518], length 0
20:16:10.872286 IP sea15s11-in-f10.1e100.net.https > 192.168.1.10.60931: Flags [P.], seq 31028:32376, ack 1203, win 178, options [nop,nop,TS val 2728624518 ecr 677483], length 1348
20:16:10.872475 IP sea15s11-in-f10.1e100.net.https > 192.168.1.10.60931: Flags [.], seq 32376:33724, ack 1203, win 178, options [nop,nop,TS val 2728624518 ecr 677483], length 1348
20:16:10.872540 IP sea15s11-in-f10.1e100.net.https > 192.168.1.10.60931: Flags [.], seq 33724:35072, ack 1203, win 178, options [nop,nop,TS val 2728624518 ecr 677483], length 1348
20:16:10.872607 IP 192.168.1.10.60931 > sea15s11-in-f10.1e100.net.https: Flags [.], ack 31028, win 641, options [nop,nop,TS val 677487 ecr 2728624518], length 0
20:16:10.874637 IP sea15s11-in-f10.1e100.net.https > 192.168.1.10.60931: Flags [.], seq 35072:36420, ack 1203, win 178, options [nop,nop,TS val 2728624520 ecr 677483], length 1348
20:16:10.874728 IP sea15s11-in-f10.1e100.net.https > 192.168.1.10.60931: Flags [.], seq 36420:37768, ack 1203, win 178, options [nop,nop,TS val 2728624520 ecr 677483], length 1348
20:16:10.874900 IP 192.168.1.10.60931 > sea15s11-in-f10.1e100.net.https: Flags [.], ack 33724, win 683, options [nop,nop,TS val 677487 ecr 2728624518], length 0
20:16:10.874919 IP 192.168.1.10.60931 > sea15s11-in-f10.1e100.net.https: Flags [.], ack 35072, win 704, options [nop,nop,TS val 677487 ecr 2728624518], length 0
20:16:10.876886 IP sea15s11-in-f10.1e100.net.https > 192.168.1.10.60931: Flags [.], seq 37768:39116, ack 1203, win 178, options [nop,nop,TS val 2728624523 ecr 677483], length 1348
20:16:10.876971 IP sea15s11-in-f10.1e100.net.https > 192.168.1.10.60931: Flags [.], seq 39116:40464, ack 1203, win 178, options [nop,nop,TS val 2728624523 ecr 677483], length 1348
20:16:10.876727 IP 192.168.1.10.60931 > sea15s11-in-f10.1e100.net.https: Flags [.], ack 36420, win 725, options [nop,nop,TS val 677487 ecr 2728624520], length 0
20:16:10.877440 IP 192.168.1.10.52566 > 208.91.255.230.www: Flags [S], seq 670016590, win 14600, options [mss 1460,sackOK,TS val 677487 ecr 0,nop,wscale 7], length 0
20:16:10.877455 IP 192.168.1.10.60931 > sea15s11-in-f10.1e100.net.https: Flags [.], ack 37768, win 746, options [nop,nop,TS val 677487 ecr 2728624520], length 0
20:16:10.878674 IP 192.168.1.10.60931 > sea15s11-in-f10.1e100.net.https: Flags [.], ack 39116, win 767, options [nop,nop,TS val 677487 ecr 2728624523], length 0
20:16:10.878904 IP 192.168.1.10.60931 > sea15s11-in-f10.1e100.net.https: Flags [.], ack 40464, win 789, options [nop,nop,TS val 677487 ecr 2728624523], length 0
20:16:10.879095 IP sea15s11-in-f10.1e100.net.https > 192.168.1.10.60931: Flags [.], seq 40464:41812, ack 1203, win 178, options [nop,nop,TS val 2728624525 ecr 677483], length 1348
20:16:10.879154 IP sea15s11-in-f10.1e100.net.https > 192.168.1.10.60931: Flags [.], seq 41812:43160, ack 1203, win 178, options [nop,nop,TS val 2728624525 ecr 677483], length 1348
20:16:10.881484 IP sea15s11-in-f10.1e100.net.https > 192.168.1.10.60931: Flags [.], seq 43160:44508, ack 1203, win 178, options [nop,nop,TS val 2728624527 ecr 677483], length 1348
20:16:10.881582 IP sea15s11-in-f10.1e100.net.https > 192.168.1.10.60931: Flags [.], seq 44508:45856, ack 1203, win 178, options [nop,nop,TS val 2728624527 ecr 677483], length 1348
20:16:10.881615 IP sea15s11-in-f10.1e100.net.https > 192.168.1.10.60931: Flags [.], seq 45856:47204, ack 1203, win 178, options [nop,nop,TS val 2728624527 ecr 677483], length 1348
20:16:10.883778 IP sea15s11-in-f10.1e100.net.https > 192.168.1.10.60931: Flags [.], seq 47204:48552, ack 1203, win 178, options [nop,nop,TS val 2728624529 ecr 677483], length 1348
20:16:10.883873 IP sea15s11-in-f10.1e100.net.https > 192.168.1.10.60931: Flags [.], seq 48552:49900, ack 1203, win 178, options [nop,nop,TS val 2728624529 ecr 677483], length 1348
20:16:10.884606 IP 192.168.1.10.60931 > sea15s11-in-f10.1e100.net.https: Flags [.], ack 41812, win 810, options [nop,nop,TS val 677488 ecr 2728624525], length 0
20:16:10.885801 IP 208.91.255.230.www > 192.168.1.10.52566: Flags [S.], seq 2785642867, ack 670016591, win 26960, options [mss 1360,sackOK,TS val 3174807829 ecr 677487,nop,wscale 7], length 0
20:16:10.886028 IP sea15s11-in-f10.1e100.net.https > 192.168.1.10.60931: Flags [.], seq 49900:51248, ack 1203, win 178, options [nop,nop,TS val 2728624532 ecr 677483], length 1348
20:16:10.886078 IP sea15s11-in-f10.1e100.net.https > 192.168.1.10.60931: Flags [.], seq 51248:52596, ack 1203, win 178, options [nop,nop,TS val 2728624532 ecr 677483], length 1348
20:16:10.888188 IP sea15s11-in-f10.1e100.net.https > 192.168.1.10.60931: Flags [.], seq 52596:53944, ack 1203, win 178, options [nop,nop,TS val 2728624534 ecr 677483], length 1348
20:16:10.888302 IP sea15s11-in-f10.1e100.net.https > 192.168.1.10.60931: Flags [.], seq 53944:55292, ack 1203, win 178, options [nop,nop,TS val 2728624534 ecr 677483], length 1348
20:16:10.888591 IP sea15s11-in-f10.1e100.net.https > 192.168.1.10.60931: Flags [.], seq 55292:56640, ack 1203, win 178, options [nop,nop,TS val 2728624536 ecr 677483], length 1348
20:16:10.894988 IP 192.168.1.10.60931 > sea15s11-in-f10.1e100.net.https: Flags [.], ack 43160, win 831, options [nop,nop,TS val 677489 ecr 2728624525], length 0
20:16:10.895413 IP sea15s11-in-f10.1e100.net.https > 192.168.1.10.60931: Flags [.], seq 56640:57988, ack 1203, win 178, options [nop,nop,TS val 2728624546 ecr 677486], length 1348
20:16:10.895499 IP sea15s11-in-f10.1e100.net.https > 192.168.1.10.60931: Flags [.], seq 57988:59336, ack 1203, win 178, options [nop,nop,TS val 2728624546 ecr 677486], length 1348
20:16:10.896285 IP sea15s11-in-f10.1e100.net.https > 192.168.1.10.60931: Flags [.], seq 59336:60684, ack 1203, win 178, options [nop,nop,TS val 2728624546 ecr 677486], length 1348
20:16:10.896417 IP sea15s11-in-f10.1e100.net.https > 192.168.1.10.60931: Flags [.], seq 60684:62032, ack 1203, win 178, options [nop,nop,TS val 2728624546 ecr 677486], length 1348
20:16:10.898164 IP sea15s11-in-f10.1e100.net.https > 192.168.1.10.60931: Flags [.], seq 62032:63380, ack 1203, win 178, options [nop,nop,TS val 2728624547 ecr 677486], length 1348
20:16:10.898255 IP sea15s11-in-f10.1e100.net.https > 192.168.1.10.60931: Flags [.], seq 63380:64728, ack 1203, win 178, options [nop,nop,TS val 2728624547 ecr 677486], length 1348
20:16:10.898285 IP sea15s11-in-f10.1e100.net.https > 192.168.1.10.60931: Flags [.], seq 64728:66076, ack 1203, win 178, options [nop,nop,TS val 2728624547 ecr 677486], length 1348
20:16:10.898312 IP sea15s11-in-f10.1e100.net.https > 192.168.1.10.60931: Flags [.], seq 66076:67424, ack 1203, win 178, options [nop,nop,TS val 2728624547 ecr 677486], length 1348
20:16:10.898728 IP sea15s02-in-f14.1e100.net.https > 192.168.1.10.39888: Flags [.], ack 675, win 175, options [nop,nop,TS val 3375200162 ecr 677482], length 0
20:16:10.899788 IP sea15s11-in-f10.1e100.net.https > 192.168.1.10.60931: Flags [.], seq 67424:68772, ack 1203, win 178, options [nop,nop,TS val 2728624548 ecr 677486], length 1348
20:16:10.901549 IP sea15s11-in-f10.1e100.net.https > 192.168.1.10.60931: Flags [.], seq 68772:70120, ack 1203, win 178, options [nop,nop,TS val 2728624549 ecr 677486], length 1348
20:16:10.901578 IP sea15s11-in-f10.1e100.net.https > 192.168.1.10.60931: Flags [.], seq 70120:71468, ack 1203, win 178, options [nop,nop,TS val 2728624549 ecr 677486], length 1348
20:16:10.903302 IP sea15s11-in-f10.1e100.net.https > 192.168.1.10.60931: Flags [.], seq 71468:72816, ack 1203, win 178, options [nop,nop,TS val 2728624550 ecr 677486], length 1348
20:16:10.903396 IP sea15s11-in-f10.1e100.net.https > 192.168.1.10.60931: Flags [.], seq 72816:74164, ack 1203, win 178, options [nop,nop,TS val 2728624550 ecr 677486], length 1348
20:16:10.904994 IP sea15s11-in-f10.1e100.net.https > 192.168.1.10.60931: Flags [.], seq 74164:75512, ack 1203, win 178, options [nop,nop,TS val 2728624552 ecr 677487], length 1348
20:16:10.905041 IP sea15s11-in-f10.1e100.net.https > 192.168.1.10.60931: Flags [.], seq 75512:76860, ack 1203, win 178, options [nop,nop,TS val 2728624552 ecr 677487], length 1348
20:16:10.905163 IP sea15s11-in-f10.1e100.net.https > 192.168.1.10.60931: Flags [.], seq 76860:78208, ack 1203, win 178, options [nop,nop,TS val 2728624554 ecr 677487], length 1348
20:16:10.905183 IP sea15s11-in-f10.1e100.net.https > 192.168.1.10.60931: Flags [.], seq 78208:79556, ack 1203, win 178, options [nop,nop,TS val 2728624554 ecr 677487], length 1348
20:16:10.906689 IP sea15s11-in-f10.1e100.net.https > 192.168.1.10.60931: Flags [.], seq 79556:80904, ack 1203, win 178, options [nop,nop,TS val 2728624555 ecr 677487], length 1348
20:16:10.908444 IP sea15s11-in-f10.1e100.net.https > 192.168.1.10.60931: Flags [.], seq 80904:82252, ack 1203, win 178, options [nop,nop,TS val 2728624555 ecr 677487], length 1348
20:16:10.908481 IP sea15s11-in-f10.1e100.net.https > 192.168.1.10.60931: Flags [.], seq 82252:83600, ack 1203, win 178, options [nop,nop,TS val 2728624555 ecr 677487], length 1348
20:16:10.910109 IP sea15s11-in-f10.1e100.net.https > 192.168.1.10.60931: Flags [.], seq 83600:84948, ack 1203, win 178, options [nop,nop,TS val 2728624555 ecr 677487], length 1348
20:16:10.910151 IP sea15s11-in-f10.1e100.net.https > 192.168.1.10.60931: Flags [.], seq 84948:86296, ack 1203, win 178, options [nop,nop,TS val 2728624555 ecr 677487], length 1348
20:16:10.910263 IP sea15s11-in-f10.1e100.net.https > 192.168.1.10.60931: Flags [.], seq 86296:87644, ack 1203, win 178, options [nop,nop,TS val 2728624559 ecr 677487], length 1348
20:16:10.910283 IP sea15s11-in-f10.1e100.net.https > 192.168.1.10.60931: Flags [.], seq 87644:88992, ack 1203, win 178, options [nop,nop,TS val 2728624559 ecr 677487], length 1348
20:16:10.911771 IP sea15s11-in-f10.1e100.net.https > 192.168.1.10.60931: Flags [.], seq 88992:90340, ack 1203, win 178, options [nop,nop,TS val 2728624560 ecr 677487], length 1348
20:16:10.911796 IP sea15s11-in-f10.1e100.net.https > 192.168.1.10.60931: Flags [.], seq 90340:91688, ack 1203, win 178, options [nop,nop,TS val 2728624560 ecr 677487], length 1348
20:16:10.913384 IP sea15s11-in-f10.1e100.net.https > 192.168.1.10.60931: Flags [.], seq 91688:93036, ack 1203, win 178, options [nop,nop,TS val 2728624560 ecr 677487], length 1348
20:16:10.915126 IP sea15s11-in-f10.1e100.net.https > 192.168.1.10.60931: Flags [.], seq 93036:94384, ack 1203, win 178, options [nop,nop,TS val 2728624560 ecr 677487], length 1348
20:16:10.915155 IP sea15s11-in-f10.1e100.net.https > 192.168.1.10.60931: Flags [.], seq 94384:95732, ack 1203, win 178, options [nop,nop,TS val 2728624560 ecr 677487], length 1348
20:16:10.915272 IP sea15s11-in-f10.1e100.net.https > 192.168.1.10.60931: Flags [.], seq 95732:97080, ack 1203, win 178, options [nop,nop,TS val 2728624562 ecr 677487], length 1348
20:16:10.915292 IP sea15s11-in-f10.1e100.net.https > 192.168.1.10.60931: Flags [.], seq 97080:98428, ack 1203, win 178, options [nop,nop,TS val 2728624562 ecr 677487], length 1348
20:16:10.916906 IP sea15s11-in-f10.1e100.net.https > 192.168.1.10.60931: Flags [.], seq 98428:99776, ack 1203, win 178, options [nop,nop,TS val 2728624565 ecr 677488], length 1348
20:16:10.916955 IP sea15s11-in-f10.1e100.net.https > 192.168.1.10.60931: Flags [.], seq 99776:101124, ack 1203, win 178, options [nop,nop,TS val 2728624565 ecr 677488], length 1348
20:16:10.924492 IP sea15s11-in-f10.1e100.net.https > 192.168.1.10.60931: Flags [.], seq 101124:102472, ack 1203, win 178, options [nop,nop,TS val 2728624575 ecr 677489], length 1348
20:16:10.924543 IP sea15s11-in-f10.1e100.net.https > 192.168.1.10.60931: Flags [.], seq 102472:103820, ack 1203, win 178, options [nop,nop,TS val 2728624575 ecr 677489], length 1348
20:16:10.929440 IP 192.168.1.10.60931 > sea15s11-in-f10.1e100.net.https: Flags [.], ack 45856, win 873, options [nop,nop,TS val 677489 ecr 2728624527], length 0
20:16:10.929459 IP 192.168.1.10.60931 > sea15s11-in-f10.1e100.net.https: Flags [.], ack 47204, win 894, options [nop,nop,TS val 677489 ecr 2728624527], length 0
20:16:10.929471 IP 192.168.1.10.60931 > sea15s11-in-f10.1e100.net.https: Flags [.], ack 48552, win 915, options [nop,nop,TS val 677489 ecr 2728624529], length 0
20:16:10.929480 IP 192.168.1.10.60931 > sea15s11-in-f10.1e100.net.https: Flags [.], ack 49900, win 936, options [nop,nop,TS val 677489 ecr 2728624529], length 0
20:16:10.929489 IP 192.168.1.10.52566 > 208.91.255.230.www: Flags [.], ack 1, win 115, options [nop,nop,TS val 677490 ecr 3174807829], length 0
20:16:10.929499 IP 192.168.1.10.60931 > sea15s11-in-f10.1e100.net.https: Flags [.], ack 52596, win 978, options [nop,nop,TS val 677492 ecr 2728624532], length 0
20:16:10.929507 IP 192.168.1.10.60931 > sea15s11-in-f10.1e100.net.https: Flags [.], ack 53944, win 999, options [nop,nop,TS val 677492 ecr 2728624534], length 0
20:16:10.929524 IP 192.168.1.10.60931 > sea15s11-in-f10.1e100.net.https: Flags [.], ack 55292, win 1020, options [nop,nop,TS val 677492 ecr 2728624534], length 0
20:16:10.934460 IP 192.168.1.10.60931 > sea15s11-in-f10.1e100.net.https: Flags [.], ack 56640, win 1041, options [nop,nop,TS val 677493 ecr 2728624536], length 0
20:16:10.934491 IP 192.168.1.10.60931 > sea15s11-in-f10.1e100.net.https: Flags [.], ack 57988, win 1062, options [nop,nop,TS val 677493 ecr 2728624546], length 0
20:16:10.934502 IP 192.168.1.10.60931 > sea15s11-in-f10.1e100.net.https: Flags [.], ack 59336, win 1083, options [nop,nop,TS val 677493 ecr 2728624546], length 0
20:16:10.934521 IP 192.168.1.10.60931 > sea15s11-in-f10.1e100.net.https: Flags [.], ack 60684, win 1104, options [nop,nop,TS val 677493 ecr 2728624546], length 0
20:16:10.934533 IP 192.168.1.10.60931 > sea15s11-in-f10.1e100.net.https: Flags [.], ack 62032, win 1126, options [nop,nop,TS val 677493 ecr 2728624546], length 0
20:16:10.934903 IP 192.168.1.10.60931 > sea15s11-in-f10.1e100.net.https: Flags [.], ack 63380, win 1147, options [nop,nop,TS val 677493 ecr 2728624547], length 0
20:16:10.945481 IP 192.168.1.10.60931 > sea15s11-in-f10.1e100.net.https: Flags [.], ack 64728, win 1168, options [nop,nop,TS val 677493 ecr 2728624547], length 0
20:16:10.945496 IP 192.168.1.10.60931 > sea15s11-in-f10.1e100.net.https: Flags [.], ack 66076, win 1189, options [nop,nop,TS val 677493 ecr 2728624547], length 0
20:16:10.945506 IP 192.168.1.10.60931 > sea15s11-in-f10.1e100.net.https: Flags [.], ack 67424, win 1210, options [nop,nop,TS val 677493 ecr 2728624547], length 0
20:16:10.945518 IP 192.168.1.10.39888 > sea15s02-in-f14.1e100.net.https: Flags [P.], seq 675:1900, ack 4183, win 178, options [nop,nop,TS val 677493 ecr 3375200162], length 1225
20:16:10.945526 IP 192.168.1.10.60931 > sea15s11-in-f10.1e100.net.https: Flags [.], ack 68772, win 1231, options [nop,nop,TS val 677493 ecr 2728624548], length 0
20:16:10.945535 IP 192.168.1.10.60931 > sea15s11-in-f10.1e100.net.https: Flags [.], ack 70120, win 1252, options [nop,nop,TS val 677493 ecr 2728624549], length 0
20:16:10.945544 IP 192.168.1.10.60931 > sea15s11-in-f10.1e100.net.https: Flags [.], ack 71468, win 1273, options [nop,nop,TS val 677493 ecr 2728624549], length 0
20:16:10.945553 IP 192.168.1.10.60931 > sea15s11-in-f10.1e100.net.https: Flags [.], ack 72816, win 1294, options [nop,nop,TS val 677493 ecr 2728624550], length 0
20:16:10.945562 IP 192.168.1.10.60931 > sea15s11-in-f10.1e100.net.https: Flags [.], ack 74164, win 1315, options [nop,nop,TS val 677493 ecr 2728624550], length 0
20:16:10.945571 IP 192.168.1.10.60931 > sea15s11-in-f10.1e100.net.https: Flags [.], ack 75512, win 1336, options [nop,nop,TS val 677493 ecr 2728624552], length 0
20:16:10.945579 IP 192.168.1.10.60931 > sea15s11-in-f10.1e100.net.https: Flags [.], ack 76860, win 1357, options [nop,nop,TS val 677494 ecr 2728624552], length 0
20:16:10.945588 IP 192.168.1.10.60931 > sea15s11-in-f10.1e100.net.https: Flags [.], ack 78208, win 1378, options [nop,nop,TS val 677494 ecr 2728624554], length 0
20:16:10.945597 IP 192.168.1.10.60931 > sea15s11-in-f10.1e100.net.https: Flags [.], ack 79556, win 1399, options [nop,nop,TS val 677494 ecr 2728624554], length 0
20:16:10.945605 IP 192.168.1.10.60931 > sea15s11-in-f10.1e100.net.https: Flags [.], ack 80904, win 1420, options [nop,nop,TS val 677494 ecr 2728624555], length 0
20:16:10.945615 IP 192.168.1.10.60931 > sea15s11-in-f10.1e100.net.https: Flags [.], ack 82252, win 1441, options [nop,nop,TS val 677494 ecr 2728624555], length 0
20:16:10.945632 IP 192.168.1.10.60931 > sea15s11-in-f10.1e100.net.https: Flags [.], ack 83600, win 1463, options [nop,nop,TS val 677494 ecr 2728624555], length 0
20:16:10.945644 IP 192.168.1.10.60931 > sea15s11-in-f10.1e100.net.https: Flags [.], ack 84948, win 1484, options [nop,nop,TS val 677494 ecr 2728624555], length 0
20:16:10.959425 IP sea15s11-in-f10.1e100.net.https > 192.168.1.10.60931: Flags [.], seq 103820:105168, ack 1203, win 178, options [nop,nop,TS val 2728624610 ecr 677489], length 1348
20:16:10.960243 IP sea15s11-in-f10.1e100.net.https > 192.168.1.10.60931: Flags [.], seq 105168:106516, ack 1203, win 178, options [nop,nop,TS val 2728624610 ecr 677489], length 1348
20:16:10.960311 IP sea15s11-in-f10.1e100.net.https > 192.168.1.10.60931: Flags [.], seq 106516:107864, ack 1203, win 178, options [nop,nop,TS val 2728624610 ecr 677489], length 1348
20:16:10.960440 IP sea15s11-in-f10.1e100.net.https > 192.168.1.10.60931: Flags [.], seq 107864:109212, ack 1203, win 178, options [nop,nop,TS val 2728624610 ecr 677489], length 1348
20:16:10.960497 IP sea15s11-in-f10.1e100.net.https > 192.168.1.10.60931: Flags [.], seq 109212:110560, ack 1203, win 178, options [nop,nop,TS val 2728624610 ecr 677489], length 1348
20:16:10.961851 IP sea15s11-in-f10.1e100.net.https > 192.168.1.10.60931: Flags [.], seq 110560:111908, ack 1203, win 178, options [nop,nop,TS val 2728624611 ecr 677492], length 1348
20:16:10.961942 IP sea15s11-in-f10.1e100.net.https > 192.168.1.10.60931: Flags [.], seq 111908:113256, ack 1203, win 178, options [nop,nop,TS val 2728624611 ecr 677492], length 1348
20:16:10.963627 IP sea15s11-in-f10.1e100.net.https > 192.168.1.10.60931: Flags [.], seq 113256:114604, ack 1203, win 178, options [nop,nop,TS val 2728624611 ecr 677492], length 1348
20:16:10.963685 IP sea15s11-in-f10.1e100.net.https > 192.168.1.10.60931: Flags [.], seq 114604:115952, ack 1203, win 178, options [nop,nop,TS val 2728624611 ecr 677492], length 1348
20:16:10.965329 IP sea15s11-in-f10.1e100.net.https > 192.168.1.10.60931: Flags [.], seq 115952:117300, ack 1203, win 178, options [nop,nop,TS val 2728624612 ecr 677492], length 1348
20:16:10.965392 IP sea15s11-in-f10.1e100.net.https > 192.168.1.10.60931: Flags [.], seq 117300:118648, ack 1203, win 178, options [nop,nop,TS val 2728624612 ecr 677492], length 1348
20:16:10.966941 IP sea15s11-in-f10.1e100.net.https > 192.168.1.10.60931: Flags [.], seq 118648:119996, ack 1203, win 178, options [nop,nop,TS val 2728624614 ecr 677492], length 1348
20:16:10.967080 IP sea15s11-in-f10.1e100.net.https > 192.168.1.10.60931: Flags [.], seq 119996:121344, ack 1203, win 178, options [nop,nop,TS val 2728624614 ecr 677492], length 1348
20:16:10.967116 IP sea15s11-in-f10.1e100.net.https > 192.168.1.10.60931: Flags [.], seq 121344:122692, ack 1203, win 178, options [nop,nop,TS val 2728624614 ecr 677492], length 1348
20:16:10.968771 IP sea15s11-in-f10.1e100.net.https > 192.168.1.10.60931: Flags [.], seq 122692:124040, ack 1203, win 178, options [nop,nop,TS val 2728624617 ecr 677493], length 1348
20:16:10.970458 IP sea15s11-in-f10.1e100.net.https > 192.168.1.10.60931: Flags [.], seq 124040:125388, ack 1203, win 178, options [nop,nop,TS val 2728624617 ecr 677493], length 1348
20:16:10.970522 IP sea15s11-in-f10.1e100.net.https > 192.168.1.10.60931: Flags [.], seq 125388:126736, ack 1203, win 178, options [nop,nop,TS val 2728624617 ecr 677493], length 1348
20:16:10.972100 IP sea15s11-in-f10.1e100.net.https > 192.168.1.10.60931: Flags [.], seq 126736:128084, ack 1203, win 178, options [nop,nop,TS val 2728624617 ecr 677493], length 1348
20:16:10.972135 IP sea15s11-in-f10.1e100.net.https > 192.168.1.10.60931: Flags [.], seq 128084:129432, ack 1203, win 178, options [nop,nop,TS val 2728624617 ecr 677493], length 1348
20:16:10.972226 IP 192.168.1.10.60931 > sea15s11-in-f10.1e100.net.https: Flags [.], ack 86296, win 1505, options [nop,nop,TS val 677495 ecr 2728624555], length 0
20:16:10.972281 IP 192.168.1.10.60931 > sea15s11-in-f10.1e100.net.https: Flags [.], ack 87644, win 1526, options [nop,nop,TS val 677495 ecr 2728624559], length 0
20:16:10.972292 IP 192.168.1.10.60931 > sea15s11-in-f10.1e100.net.https: Flags [.], ack 88992, win 1547, options [nop,nop,TS val 677495 ecr 2728624559], length 0
20:16:10.972303 IP 192.168.1.10.60931 > sea15s11-in-f10.1e100.net.https: Flags [.], ack 90340, win 1568, options [nop,nop,TS val 677495 ecr 2728624560], length 0
20:16:10.972312 IP 192.168.1.10.60931 > sea15s11-in-f10.1e100.net.https: Flags [.], ack 91688, win 1589, options [nop,nop,TS val 677495 ecr 2728624560], length 0
20:16:10.972321 IP 192.168.1.10.60931 > sea15s11-in-f10.1e100.net.https: Flags [.], ack 93036, win 1610, options [nop,nop,TS val 677495 ecr 2728624560], length 0
20:16:10.972340 IP 192.168.1.10.60931 > sea15s11-in-f10.1e100.net.https: Flags [.], ack 94384, win 1631, options [nop,nop,TS val 677495 ecr 2728624560], length 0
20:16:10.972764 IP 192.168.1.10.60931 > sea15s11-in-f10.1e100.net.https: Flags [.], ack 95732, win 1652, options [nop,nop,TS val 677496 ecr 2728624560], length 0
20:16:10.972780 IP 192.168.1.10.60931 > sea15s11-in-f10.1e100.net.https: Flags [.], ack 97080, win 1673, options [nop,nop,TS val 677497 ecr 2728624562], length 0
